PT	AU	BA	BE	GP	AF	BF	CA	TI	SO	SE	BS	LA	DT	CT	CY	CL	SP	HO	DE	ID	AB	C1	RP	EM	RI	OI	FU	FX	CR	NR	TC	Z9	U1	U2	PU	PI	PA	SN	EI	BN	J9	JI	PD	PY	VL	IS	PN	SU	SI	MA	BP	EP	AR	DI	D2	EA	PG	WC	SC	GA	UT	PM	OA	HC	HP	DA
C	Verma, S; Girdhar, A; Jha, RRK		Perez, GM; Tiwari, S; Trivedi, MC; Mishra, KK		Verma, Staffi; Girdhar, Akshay; Jha, Ravi Ranjan Kumar			Real-Time Eye Detection Method for Driver Assistance System	AMBIENT COMMUNICATIONS AND COMPUTER SYSTEMS, RACCCS 2017	Advances in Intelligent Systems and Computing				2nd International Conference on Recent Advancement in Computer, Communication and Computational Sciences (RACCCS)	SEP 02-03, 2017	Aryabhatta Coll Engn & Res Ctr, Ajmer, INDIA		Aryabhatta Coll Engn & Res Ctr																				2194-5357	2194-5365	978-981-10-7386-1; 978-981-10-7385-4				2018	696						693	702		10.1007/978-981-10-7386-1_58							WOS:000454481600058						
C	Krokavec, D; Filasova, A		Koscielny, JM; Syfert, M; Sztyber, A		Krokavec, Dusan; Filasova, Anna			H-2/H-infinity Principle in Discrete-Time Virtual Actuator Design	ADVANCED SOLUTIONS IN DIAGNOSTICS AND FAULT TOLERANT CONTROL	Advances in Intelligent Systems and Computing				13th International Conference on Diagnostics of Processes and Systems (DPS)	SEP 10-13, 2017	Sandomierz, POLAND	Warsaw Univ Technol, Univ Zielona Gora, Gdansk Univ Technol, Warsaw Univ Technol, Fac Mechatron, Inst Automat Control & Robot, Polish Acad Sci, Comm Automat Control & Robot								Filasova, Anna/AAA-6013-2020; Krokavec, Dusan/R-5448-2018	Krokavec, Dusan/0000-0002-4358-1226												2194-5357	2194-5365	978-3-319-64474-5; 978-3-319-64473-8				2018	635						45	56		10.1007/978-3-319-64474-5_4							WOS:000456930300004						
C	Marsalek, O; Dlugos, J; Novotny, P; Zhanal, L		Jablonski, R; Brezina, T		Marsalek, Ondrej; Dlugos, Jozef; Novotny, Pavel; Zhanal, Lubor			Contact Area Evaluation Experiment Verified by Computational Model in MBS	ADVANCED MECHATRONICS SOLUTIONS	Advances in Intelligent Systems and Computing				11th International Conference on Mechatronics	SEP 21-23, 2015	Warsaw, POLAND	Warsaw Univ Technol, Fac Mechatron								Novotny, Pavel/P-9308-2019; Novotny, Pavel/P-8188-2015	Novotny, Pavel/0000-0002-7513-2345; 												2194-5357		978-3-319-23923-1				2016	393						489	494		10.1007/978-3-319-23923-1_71							WOS:000389517600071						
C	Jape, VS; Bharadwaj, DG		Dash, SS; Bhaskar, MA; Panigrahi, BK; Das, S		Jape, Vidula S.; Bharadwaj, D. G.			A New Approach to Object-Oriented Programming Language for Remote Power Quality Monitoring and Analysis Considering Harmonics	ARTIFICIAL INTELLIGENCE AND EVOLUTIONARY COMPUTATIONS IN ENGINEERING SYSTEMS, ICAIECES 2015	Advances in Intelligent Systems and Computing				International Conference on Artificial Intelligence and Evolutionary Computations in Engineering Systems (ICAIECES)	APR 22-23, 2015	Velammal Engn Coll, Chennai, INDIA		Velammal Engn Coll																				2194-5357		978-81-322-2656-7; 978-81-322-2654-3				2016	394						323	331		10.1007/978-81-322-2656-7_29							WOS:000371315700029						
C	Spielman, Z; Gertman, DI; Liu, HR; Pray, I; Traiteur, J; Wold, S; Wysmuller, S		Stanton, NA		Spielman, Zachary; Gertman, David I.; Liu, Haoran; Pray, Ira; Traiteur, Justin; Wold, Scott; Wysmuller, Steven			Machine Learning and Big Data Analytics in Support of Fleet Safety During Severe Weather	ADVANCES IN HUMAN ASPECTS OF TRANSPORTATION	Advances in Intelligent Systems and Computing				AHFE International Conference on Human Factors in Transportation	JUL 17-21, 2017	Los Angeles, CA																						2194-5357	2194-5365	978-3-319-60441-1; 978-3-319-60440-4				2018	597						662	671		10.1007/978-3-319-60441-1_64							WOS:000448241200064						
S	Jus, A; Nowak, P; Szewczyk, R		Szewczyk, R; Zielinski, C; Kaliczynska, M		Jus, Andrzej; Nowak, Pawel; Szewczyk, Roman			Automatic System for Identification of Temperature Parameters of Resistors Based on Self-heating Phenomena	PROGRESS IN AUTOMATION, ROBOTICS AND MEASURING TECHNIQUES, VOL 3: MEASURING TECHNIQUES AND SYSTEMS	Advances in Intelligent Systems and Computing																Nowak, Pawel/0000-0003-4156-5473; Szewczyk, Roman/0000-0002-1214-1009												2194-5357		978-3-319-15835-8; 978-3-319-15834-1				2015	352						91	100		10.1007/978-3-319-15835-8_11	10.1007/978-3-319-15835-8						WOS:000372957700012						
C	Monica, S; Bergenti, F		Omatu, S; Selamat, A; Bocewicz, G; Sitek, P; Nielsen, I; GarciaGarcia, JA; Bajo, J		Monica, Stefania; Bergenti, Federico			A Study of Consensus Formation using Kinetic Theory	DISTRIBUTED COMPUTING AND ARTIFICIAL INTELLIGENCE, (DCAI 2016)	Advances in Intelligent Systems and Computing				13th International Conference on Distributed Computing and Artificial Intelligence (DCAI)	JUN 01-03, 2016	Sevilla, SPAIN	IBM, Indra, Fidetia, IEEE SMC Spain								Bergenti, Federico/B-3252-2017; Monica, Stefania/B-3257-2017	Bergenti, Federico/0000-0002-4756-4765; Monica, Stefania/0000-0001-6254-4765												2194-5357	2194-5365	978-3-319-40162-1; 978-3-319-40161-4				2016	474						213	221		10.1007/978-3-319-40162-1_23							WOS:000387181500023						
C	Miller, M; Holley, S		Baldwin, C		Miller, Mark; Holley, Sam			SHELL Revisited: Cognitive Loading and Effects of Digitized Flight Deck Automation	ADVANCES IN NEUROERGONOMICS AND COGNITIVE ENGINEERING (AHFE 2017)	Advances in Intelligent Systems and Computing				8th International Conference on Applied Human Factors and Ergonomics (AHFE) / International Conferences on Cognitive and Neuroergonomics and Cognitive Computing and Internet of Things	JUL 17-21, 2017	Los Angeles, CA																						2194-5357	2194-5365	978-3-319-60642-2; 978-3-319-60641-5				2018	586						95	107		10.1007/978-3-319-60642-2_9							WOS:000465822500009						
C	Sima, G; Lile, R; Glavan, DO; Muncut, E		Balas, VE; Jain, LC; Kovacevic, B		Sima, Gheorghe; Lile, Ramona; Glavan, Dan Ovidiu; Muncut, Elena			Management, Traceability and Control of Industrial Processes	SOFT COMPUTING APPLICATIONS, (SOFA 2014), VOL 2	Advances in Intelligent Systems and Computing				6th International Workshop on Soft Computing Applications (SOFA)	JUL 24-26, 2014	Timisoara, ROMANIA	Univ Belgrade								Glavan, Dan/H-8752-2016	Glavan, Dan/0000-0001-9840-6356												2194-5357	2194-5365	978-3-319-18416-6; 978-3-319-18415-9				2016	357		2				971	980		10.1007/978-3-319-18416-6_77							WOS:000452854600021						
C	Gu, HJ; Liu, W; Zhao, XH		Du, ZY		Gu, Haijun; Liu, Wei; Zhao, Xiaohui			Semantic-Based Wireless Video Surveillance System	INTELLIGENCE COMPUTATION AND EVOLUTIONARY COMPUTATION	Advances in Intelligent Systems and Computing				International Conference of Intelligence Computation and Evolutionary Computation (ICEC 2012)	JUL 07, 2012	Wuhan, PEOPLES R CHINA	Informat Technol & Ind Engn Res Ctr																					2194-5357		978-3-642-31655-5				2013	180						965	973									WOS:000316302700133						
C	Morisawa, T; Mizuuchi, I		Menegatti, E; Michael, N; Berns, K; Yamaguchi, H		Morisawa, Toma; Mizuuchi, Ikuo			Diversive Curiosity in Robots and Action Selection Method for Obtaining Unexperienced Sensory Information	INTELLIGENT AUTONOMOUS SYSTEMS 13	Advances in Intelligent Systems and Computing				13th International Conference on Intelligent Autonomous Systems (IAS)	JUL 15-18, 2014	Centro Congressi Padova, Padova, ITALY	Univ Padova	Centro Congressi Padova							Mizuuchi, Ikuo/B-9946-2013	Mizuuchi, Ikuo/0000-0003-4657-2613												2194-5357	2194-5365	978-3-319-08338-4; 978-3-319-08337-7				2016	302						1343	1355		10.1007/978-3-319-08338-4_97							WOS:000377956900097						
C	Chaurasia, D; Sankat, S; Solanki, SK		Stanton, NA; Landry, S; DiBucchianico, G; Vallicelli, A		Chaurasia, Devarshi; Sankat, Sandeep; Solanki, Sushil Kumar			Bus Rapid Transit (BRTS): A Case Study to Investigate Its Use by the Persons with Disability	ADVANCES IN HUMAN ASPECTS OF TRANSPORTATION	Advances in Intelligent Systems and Computing				International Conference on Human Factors in Transportation	JUL 27-31, 2016	FL									SANKAT, SANDEEP/AAW-4223-2021	SANKAT, SANDEEP/0000-0002-7968-5924												2194-5357		978-3-319-41682-3; 978-3-319-41681-6				2017	484						799	809		10.1007/978-3-319-41682-3_66							WOS:000390836900066						
C	Werewka, J; Turek, M		Swiatek, J; Borzemski, L; Grzech, A; Wilimowska, Z		Werewka, Jan; Turek, Michal			Computer Science PhD Program Evaluation Proposal Based on Domain and Non-domain Characteristics	INFORMATION SYSTEMS ARCHITECTURE AND TECHNOLOGY, ISAT 2015, PT III	Advances in Intelligent Systems and Computing				36th International Conference on Information Systems Architecture and Technology (ISAT)	SEP 20-22, 2015	Karpacz, POLAND	Wroclaw Univ Technol, Fac Comp Sci & Management, Dept Comp Sci, Wroclaw Univ Technol, Fac Comp Sci & Management, Dept Management Syst								Werewka, Jan/AAA-9823-2021													2194-5357	2194-5365	978-3-319-28564-1; 978-3-319-28562-7				2016	431						177	187		10.1007/978-3-319-28564-1_15							WOS:000378553900015						
C	Griol, D; Molina, JM		Herrero, A; Baruque, B; Sedano, J; Quintian, H; Corchado, E		Griol, David; Manuel Molina, Jose			Illustrating Abstract Concepts by Means of Virtual Learning Artifacts	INTERNATIONAL JOINT CONFERENCE: CISIS'15 AND ICEUTE'15	Advances in Intelligent Systems and Computing				8th International Conf on Computational Intelligence in Security for Information Systems / 6th International Conf on EUropean Transnational Education	JUN, 2015	Burgos, SPAIN	IEEE Spain Sect, IEEE Syst, Man & Cybernet Spanish Chapter, Int Federat Computat Log								Griol, David/L-1258-2014	Griol, David/0000-0001-6266-5321												2194-5357	2194-5365	978-3-319-19713-5; 978-3-319-19712-8				2015	369						607	616		10.1007/978-3-319-19713-5_53							WOS:000365128500053						
C	Zedan, IA; Elsayed, KM; Emary, E		Hassanien, AE; Shaalan, K; Gaber, T; Azar, AT; Tolba, MF		Zedan, Ibrahim A.; Elsayed, Khaled M.; Emary, Eid			An Innovative Method for Key Frames Extraction in News Videos	PROCEEDINGS OF THE INTERNATIONAL CONFERENCE ON ADVANCED INTELLIGENT SYSTEMS AND INFORMATICS 2016	Advances in Intelligent Systems and Computing				2nd International Conference on Advanced Intelligent Systems and Informatics (AISI)	OCT 24-26, 2016	Cairo, EGYPT	Sci Res Grp Egypt, IEEE Computat Intelligence Soc, Egypt Chapter, IEEE Robot & Automat Soc, Egypt Chapter								Emary, Eid M/C-6131-2017	Emary, Eid M/0000-0002-9537-2530												2194-5357	2194-5365	978-3-319-48308-5; 978-3-319-48307-8				2017	533						383	394		10.1007/978-3-319-48308-5_37							WOS:000398724000037						
C	Rahul, PK; Kumar, TG		Suresh, LP; Dash, SS; Panigrahi, BK		Rahul, P. K.; Kumar, T. Gireesh			A Novel Authentication Framework for Hadoop	ARTIFICIAL INTELLIGENCE AND EVOLUTIONARY ALGORITHMS IN ENGINEERING SYSTEMS, VOL 1	Advances in Intelligent Systems and Computing				International Conference on Artificial Intelligence and Evolutionary Algorithms in Engineering Systems (ICAEES)	APR 22-23, 2014	Noorul Islam Univ, Noorul Islam Ctr Higher Educ, Kumaracoil, INDIA		Noorul Islam Univ, Noorul Islam Ctr Higher Educ								T, Gireesh Kumar/0000-0002-6313-3850												2194-5357	2194-5365	978-81-322-2126-5; 978-81-322-2125-8				2015	324						333	340		10.1007/978-81-322-2126-5_37							WOS:000357781400037						
C	Chitty, DM		Chao, F; Schockaert, S; Zhang, Q		Chitty, Darren M.			Applying ACO to Large Scale TSP Instances	ADVANCES IN COMPUTATIONAL INTELLIGENCE SYSTEMS	Advances in Intelligent Systems and Computing				17th Annual UK Workshop on Computational Intelligence (UKCI)	SEP 06-08, 2017	Cardiff, ENGLAND																						2194-5357	2194-5365	978-3-319-66939-7; 978-3-319-66938-0				2018	650						104	118		10.1007/978-3-319-66939-7_9							WOS:000449922000009						
C	Veena, KN; Kumar, BPV		Kumar, MA; Selvarani, R; Kumar, TVS		Veena, K. N.; Kumar, Vijaya B. P.			Hidden Markov Model with Computational Intelligence for Dynamic Clustering in Wireless Sensor Networks	PROCEEDINGS OF INTERNATIONAL CONFERENCE ON ADVANCES IN COMPUTING	Advances in Intelligent Systems and Computing				International Conference on Advances in Computing (ICAdC 2012)	JUL 04-06, 2012	M S Ramaiah Inst Technol, INDIA	M S Ramaiah Inst Technol, Informat Sci & Engn, M S Ramaiah Inst Technol, Comp Sci & Engn, M S Ramaiah Inst Technol, Comp Applicat	M S Ramaiah Inst Technol							N, Veena K/AAR-5566-2021													2194-5357	2194-5365	978-81-322-0739-9; 978-81-322-0740-5				2013	174						19	30									WOS:000316088900003						
C	Abhishek, K; Roshan, S; Kumar, P; Ranjan, R		Meghanathan, N; Nagamalai, D; Chaki, N		Abhishek, Kumar; Roshan, Sahana; Kumar, Prabhat; Ranjan, Rajeev			A Comprehensive Study on Multifactor Authentication Schemes	ADVANCES IN COMPUTING AND INFORMATION TECHNOLOGY, VOL 2	Advances in Intelligent Systems and Computing				2nd International Conference on Advances in Computing and Information Technology (ACITY 2012)	JUL 13-15, 2012	Chennai, INDIA									Kumar, Prabhat/AAA-9743-2019; Abhishek, Kumar/C-9914-2017	Kumar, Prabhat/0000-0001-9945-7702; Abhishek, Kumar/0000-0001-6825-2392												2194-5357		978-3-642-31551-0				2013	177						561	+									WOS:000312968800057						
C	Mohiddin, MK; Dutt, VBSSI		Satapathy, SC; Bhateja, V; Udgata, SK; Pattnaik, PK		Mohiddin, Md. Khaja; Dutt, V. B. S. Srilatha Indra			Minimization of Energy Consumption Using X-Layer Network Transformation Model for IEEE 802.15.4-Based MWSNs	PROCEEDINGS OF THE 5TH INTERNATIONAL CONFERENCE ON FRONTIERS IN INTELLIGENT COMPUTING: THEORY AND APPLICATIONS, FICTA 2016, VOL 1	Advances in Intelligent Systems and Computing				5th International Conference on Frontiers in Intelligent Computing - Theory and Applications (FICTA)	SEP 16-17, 2016	KIIT Univ, Sch Comp Engn, Bhubaneswar, INDIA		KIIT Univ, Sch Comp Engn							Vemuri, B S Srilatha Indira Dutt/U-1997-2019; Mohiddin, Khaja/AAK-3642-2020	Vemuri, B S Srilatha Indira Dutt/0000-0002-4770-2742; Mohiddin, Khaja/0000-0002-6342-3778												2194-5357	2194-5365	978-981-10-3153-3; 978-981-10-3152-6				2017	515						741	751		10.1007/978-981-10-3153-3_74							WOS:000425536200074						
C	Leszczynski, P; Stencel, K		Morzy, T; Harder, T; Wrembel, R		Leszczynski, Pawel; Stencel, Krzysztof			Prop Scale: An Update Propagator for Joint Scalable Storage	ADVANCES IN DATABASES AND INFORMATION SYSTEMS	Advances in Intelligent Systems and Computing				16th East-European Conference on Advances in Databases and Information Systems (ADBIS 2012)	SEP 17-21, 2012	Poznan, POLAND	Allegro Grp, POZnan, IBM, Microsoft, Roche, Targit, Samsung, Edge Solut, Itelligence								Krzysztof, Stencel J./H-9940-2014	Krzysztof, Stencel J./0000-0001-6356-4872												2194-5357	2194-5365	978-3-642-32740-7				2013	186						173	+									WOS:000313020600016						
C	Dominguez-Morales, JP; Jimenez-Fernandez, A; Vicente-Diaz, S; Linares-Barranco, A; Olmo-Sevilla, A; Fernandez-Enriquez, A		Ollero, A; Sanfeliu, A; Montano, L; Lau, N; Cardeira, C		Pedro Dominguez-Morales, Juan; Jimenez-Fernandez, Angel; Vicente-Diaz, Saturnino; Linares-Barranco, Alejandro; Olmo-Sevilla, Asuncion; Fernandez-Enriquez, Antonio			A Protocol Generator Tool for Automatic In-Vitro HPV Robotic Analysis	ROBOT 2017: THIRD IBERIAN ROBOTICS CONFERENCE, VOL 2	Advances in Intelligent Systems and Computing				3rd Iberian Robotics Conference (Robot)	NOV 22-24, 2017	Seville, SPAIN									Jimenez-Fernandez, Angel/G-2748-2016; Linares-Barranco, Alejandro/B-7087-2011; Dominguez-Morales, Juan Pedro/G-2875-2016; Diaz, Saturnino Vicente/U-9829-2017	Jimenez-Fernandez, Angel/0000-0003-3061-5922; Linares-Barranco, Alejandro/0000-0002-6056-740X; Dominguez-Morales, Juan Pedro/0000-0002-5474-107X; Diaz, Saturnino Vicente/0000-0001-9466-485X												2194-5357	2194-5365	978-3-319-70836-2; 978-3-319-70835-5				2018	694						580	591		10.1007/978-3-319-70836-2_48							WOS:000436471400048						
C	Anderson, R; Mansingh, G		Filev, D; Jablkowski, J; Kacprzyk, J; Krawczak, M; Popchev, I; Rutkowski, L; Sgurev, V; Sotirova, E; Szynkarczyk, P; Zadrozny, S		Anderson, Ricardo; Mansingh, Gunjan			KIISA: Towards a Reference Architecture for Integrated Knowledge Services	INTELLIGENT SYSTEMS'2014, VOL 2: TOOLS, ARCHITECTURES, SYSTEMS, APPLICATIONS	Advances in Intelligent Systems and Computing				7th IEEE International Conference on Intelligent Systems (IEEE IS)	SEP 24-26, 2014	Warsaw, POLAND	Polish Acad Sci, Syst Res Inst, Polish Acad Sci, Dept IV Engn Sci, Ind Inst Automat & Measurements, Inst Elect & Elect Engineers, Poland Sect, Computat Intelligence Soc, Polish Operat & Syst Res Soc, Inst Elect Elect Engineers Syst, Man & Cybernet Soc, Inst Elect Elect Engineers Computat Intelligence Soc, Polish Neural Network Soc, Polish Assoc Artificial Intelligence, Inst Elect Elect Engineers																					2194-5357		978-3-319-11309-8				2015	323						247	257		10.1007/978-3-319-11310-4_22							WOS:000360203500022						
C	Avanzini, GB; Zanchettin, AM; Rocco, P		Menegatti, E; Michael, N; Berns, K; Yamaguchi, H		Avanzini, Giovanni Buizza; Zanchettin, Andrea Maria; Rocco, Paolo			Reactive Constrained Model Predictive Control for Redundant Mobile Manipulators	INTELLIGENT AUTONOMOUS SYSTEMS 13	Advances in Intelligent Systems and Computing				13th International Conference on Intelligent Autonomous Systems (IAS)	JUL 15-18, 2014	Centro Congressi Padova, Padova, ITALY	Univ Padova	Centro Congressi Padova								ROCCO, PAOLO/0000-0001-6716-434X												2194-5357	2194-5365	978-3-319-08338-4; 978-3-319-08337-7				2016	302						1301	1314		10.1007/978-3-319-08338-4_94							WOS:000377956900094						
C	Cardenas-Cobo, J; Novoa-Hernandez, P; Puris, A; Benavides, D		Auer, ME; Kim, KS		Cardenas-Cobo, Jesennia; Novoa-Hernandez, Pavel; Puris, Amikar; Benavides, David			Recommending Exercises in Scratch: An Integrated Approach for Enhancing the Learning of Computer Programming	ENGINEERING EDUCATION FOR A SMART SOCIETY	Advances in Intelligent Systems and Computing				World Engineering Education Forum (WEEF) / Global Engineering Deans Council (GEDC)	NOV 06-10, 2016	Seoul, SOUTH KOREA	Korea Soc Engn Educ, Korea Engn Deans Council								Novoa-Hernandez, Pavel/N-5075-2014; Benavides, David/K-2791-2014	Novoa-Hernandez, Pavel/0000-0003-3267-6753; Benavides, David/0000-0002-8449-3273; Cardenas Cobo, Jesennia/0000-0001-8580-8743												2194-5357	2194-5365	978-3-319-60937-9; 978-3-319-60936-2				2018	627						255	271		10.1007/978-3-319-60937-9_20							WOS:000451586800020						
C	Sandhya, P; Lakshmi, M		Meghanathan, N; Nagamalai, D; Chaki, N		Sandhya, P.; Lakshmi, M.			Strategic Composition of Semantic Web Services Using SLAKY Composer	ADVANCES IN COMPUTING AND INFORMATION TECHNOLOGY, VOL 3	Advances in Intelligent Systems and Computing				2nd International Conference on Advances in Computing and Information Technology (ACITY 2012)	JUL 13-15, 2012	Chennai, INDIA										M, Lakshmi/0000-0001-8646-4962												2194-5357	2194-5365	978-3-642-31599-2				2013	178						411	+									WOS:000312969100040						
C	Capkovic, F		Filev, D; Jablkowski, J; Kacprzyk, J; Krawczak, M; Popchev, I; Rutkowski, L; Sgurev, V; Sotirova, E; Szynkarczyk, P; Zadrozny, S		Capkovic, Frantisek			Modelling, Control and Performance Evaluation of a Combined Robotic Cell by Petri Nets	INTELLIGENT SYSTEMS'2014, VOL 2: TOOLS, ARCHITECTURES, SYSTEMS, APPLICATIONS	Advances in Intelligent Systems and Computing				7th IEEE International Conference on Intelligent Systems (IEEE IS)	SEP 24-26, 2014	Warsaw, POLAND	Polish Acad Sci, Syst Res Inst, Polish Acad Sci, Dept IV Engn Sci, Ind Inst Automat & Measurements, Inst Elect & Elect Engineers, Poland Sect, Computat Intelligence Soc, Polish Operat & Syst Res Soc, Inst Elect Elect Engineers Syst, Man & Cybernet Soc, Inst Elect Elect Engineers Computat Intelligence Soc, Polish Neural Network Soc, Polish Assoc Artificial Intelligence, Inst Elect Elect Engineers																					2194-5357		978-3-319-11309-8				2015	323						15	26		10.1007/978-3-319-11310-4_2							WOS:000360203500002						
C	Xu, HC; Wang, S; Zhao, BJ		Tarn, TJ; Chen, SB; Chen, XQ		Xu, Hui-Chao; Wang, Su; Zhao, Bao-Jun			Research and Analysis of Architectural Construction Safety Dynamic Infrasound Network System Based on Acoustic Vector Sensor	ROBOTIC WELDING, INTELLIGENCE AND AUTOMATION, RWIA'2014	Advances in Intelligent Systems and Computing				International Conference on Robotic Welding, Intelligence and Automation (RWIA)	OCT 25-27, 2014	Shanghai, PEOPLES R CHINA																						2194-5357		978-3-319-18997-0; 978-3-319-18996-3				2015	363						609	618		10.1007/978-3-319-18997-0_53							WOS:000375990500053						
C	Laskowski, D; Polkowski, M; Lubkowski, P; Nowosielski, L		Zamojski, W; Mazurkiewicz, J; Sugier, J; Walkowiak, T; Kacprzyk, J		Laskowski, Dariusz; Polkowski, Marcin; Lubkowski, Piotr; Nowosielski, Leszek			Effectiveness Examination of a Multi-channel CSMA/CA Detector	ADVANCES IN DEPENDABILITY ENGINEERING OF COMPLEX SYSTEMS	Advances in Intelligent Systems and Computing				12th International Conference on Dependability and Complex Systems (DepCoS-RELCOMEX)	JUL 02-06, 2017	Brunow, POLAND	Wroclaw Univ Sci & Technol, Dept Comp Engn								Nowosielski, Leszek/T-4741-2018; Dariusz, Laskowski/ABA-1773-2021	Nowosielski, Leszek/0000-0002-4230-4905; Dariusz, Laskowski/0000-0001-9922-0350; PIOTR, LUBKOWSKI/0000-0002-1748-5070												2194-5357	2194-5365	978-3-319-59415-6; 978-3-319-59414-9				2018	582						225	232		10.1007/978-3-319-59415-6_22							WOS:000441189200022						
C	Kirchner, D; Geihs, K		Menegatti, E; Michael, N; Berns, K; Yamaguchi, H		Kirchner, Dominik; Geihs, Kurt			Adaptive Model-Based Monitoring for Robots	INTELLIGENT AUTONOMOUS SYSTEMS 13	Advances in Intelligent Systems and Computing				13th International Conference on Intelligent Autonomous Systems (IAS)	JUL 15-18, 2014	Centro Congressi Padova, Padova, ITALY	Univ Padova	Centro Congressi Padova																				2194-5357	2194-5365	978-3-319-08338-4; 978-3-319-08337-7				2016	302						43	56		10.1007/978-3-319-08338-4_4							WOS:000377956900004						
C	Bindu, NS; Sheshadri, HS		Jain, LC; Patnaik, S; Ichalkaranje, N		Bindu, N. S.; Sheshadri, H. S.			A Comparative Study of Correlation Based Stereo Matching Algorithms: Illumination and Exposure	INTELLIGENT COMPUTING, COMMUNICATION AND DEVICES	Advances in Intelligent Systems and Computing				1st International Conference on Intelligent Computing, Communication and Devices (ICCD)	APR 18-19, 2014	SOA Univ, Bhubaneswar, INDIA		SOA Univ																				2194-5357	2194-5365	978-81-322-2008-4				2015	309						191	201		10.1007/978-81-322-2009-1_22							WOS:000380479900022						
C	Holz, D; Behnke, S		Lee, S; Cho, HS; Yoon, KJ; Lee, JM		Holz, Dirk; Behnke, Sven			Fast Range Image Segmentation and Smoothing Using Approximate Surface Reconstruction and Region Growing	INTELLIGENT AUTONOMOUS SYSTEMS 12 , VOL 2	Advances in Intelligent Systems and Computing				12th International Conference of Intelligent Autonomous Systems	JUN 26-29, 2012	Jeju, SOUTH KOREA									Behnke, Sven/B-5509-2013	Behnke, Sven/0000-0002-5040-7525												2194-5357	2194-5365	978-3-642-33931-8; 978-3-642-33932-5				2013	194						61	73									WOS:000313768300007						
C	Camargo, JA; Barrios-Aranibar, D		Omatu, S; Selamat, A; Bocewicz, G; Sitek, P; Nielsen, I; GarciaGarcia, JA; Bajo, J		Alejandro Camargo, J.; Barrios-Aranibar, Dennis			delta-Radius Unified Influence Value Reinforcement Learning	DISTRIBUTED COMPUTING AND ARTIFICIAL INTELLIGENCE, (DCAI 2016)	Advances in Intelligent Systems and Computing				13th International Conference on Distributed Computing and Artificial Intelligence (DCAI)	JUN 01-03, 2016	Sevilla, SPAIN	IBM, Indra, Fidetia, IEEE SMC Spain								Barrios Aranibar, Dennis/K-2343-2017	Barrios Aranibar, Dennis/0000-0001-7482-3390												2194-5357	2194-5365	978-3-319-40162-1; 978-3-319-40161-4				2016	474						125	135		10.1007/978-3-319-40162-1_14							WOS:000387181500014						
C	Toyoda, H; Sayer, TB; Domeyer, JE		Goonetilleke, R; Karwowski, W		Toyoda, Heishiro; Sayer, Tina B.; Domeyer, Joshua E.			Analyzing Driving Behavior Change as Influenced by Visual Feedback in Following Distance	ADVANCES IN PHYSICAL ERGONOMICS AND HUMAN FACTORS	Advances in Intelligent Systems and Computing				International Conference on Physical Ergonomics and Human Factors	JUL 27-31, 2016	FL																						2194-5357		978-3-319-41694-6; 978-3-319-41693-9				2016	489						955	966		10.1007/978-3-319-41694-6_91							WOS:000389642400091						
C	Gogan, LM; Draghici, A; Ivascu, L		Balas, VE; Jain, LC; Kovacevic, B		Gogan, L. M.; Draghici, A.; Ivascu, L.			Technological Implications in the Development and Modelling of the Intellectual Capital	SOFT COMPUTING APPLICATIONS, (SOFA 2014), VOL 2	Advances in Intelligent Systems and Computing				6th International Workshop on Soft Computing Applications (SOFA)	JUL 24-26, 2014	Timisoara, ROMANIA	Univ Belgrade								Draghici, Anca/AAL-8281-2020; Ivascu, Larisa/E-5644-2016	Draghici, Anca/0000-0002-5155-034X; Ivascu, Larisa/0000-0003-1506-5467												2194-5357	2194-5365	978-3-319-18416-6; 978-3-319-18415-9				2016	357		2				1047	1058		10.1007/978-3-319-18416-6_84							WOS:000452854600028						
