PT	AU	BA	BE	GP	AF	BF	CA	TI	SO	SE	BS	LA	DT	CT	CY	CL	SP	HO	DE	ID	AB	C1	RP	EM	RI	OI	FU	FX	CR	NR	TC	Z9	U1	U2	PU	PI	PA	SN	EI	BN	J9	JI	PD	PY	VL	IS	PN	SU	SI	MA	BP	EP	AR	DI	D2	EA	PG	WC	SC	GA	UT	PM	OA	HC	HP	DA
C	Kambayashi, Y; Nishiyama, T; Matsuzawa, T; Takimoto, M		Grzech, A; Borzemski, L; Swiatek, J; Wilimowska, Z		Kambayashi, Yasushi; Nishiyama, Takushi; Matsuzawa, Tomofumi; Takimoto, Munehiro			An Implementation of an Ad Hoc Mobile Multi-agent System for a Safety Information	INFORMATION SYSTEMS ARCHITECTURE AND TECHNOLOGY, ISAT 2015, PT II	Advances in Intelligent Systems and Computing				36th International Conference on Information Systems Architecture and Technology (ISAT)	SEP 20-22, 2015	Karpacz, POLAND	Wroclaw Univ Technol, Fac Comp Sci & Management, Dept Comp Sci, Wroclaw Univ Technol, Fac Comp Sci & Management, Dept Management Syst																					2194-5357	2194-5365	978-3-319-28561-0; 978-3-319-28559-7				2016	430						201	213		10.1007/978-3-319-28561-0_16							WOS:000378552500016						
C	Borah, S; Panigrahi, R; Chakraborty, A		Saeed, K; Chaki, N; Pati, B; Bakshi, S; Mohapatra, DP		Borah, Samarjeet; Panigrahi, Ranjit; Chakraborty, Anindita			An Enhanced Intrusion Detection System Based on Clustering	PROGRESS IN ADVANCED COMPUTING AND INTELLIGENT ENGINEERING, VOL 2	Advances in Intelligent Systems and Computing				International Conference on Advanced Computing and Intelligent Engineering (ICACIE)	DEC 23-25, 2016	C.V. Raman Coll Engn, Bhubaneswar, INDIA	DRDO	C.V. Raman Coll Engn							Panigrahi, Ranjit/AAT-8462-2020; Borah, Samarjeet/C-9801-2013	Panigrahi, Ranjit/0000-0001-6728-5977; Borah, Samarjeet/0000-0001-9304-3525												2194-5357	2194-5365	978-981-10-6875-1; 978-981-10-6874-4				2018	564						37	45		10.1007/978-981-10-6875-1_5							WOS:000452453900005						
C	Frejlichowski, D; Gosciewska, K; Forczmanski, P; Nowosielski, A; Hofman, R		Burduk, R; Jackowski, K; Kurzynski, M; Wozniak, M; Zolnierek, A		Frejlichowski, Dariusz; Gosciewska, Katarzyna; Forczmanski, Pawel; Nowosielski, Adam; Hofman, Radoslaw			Extraction of the Foreground Regions by Means of the Adaptive Background Modelling Based on Various Colour Components for a Visual Surveillance System	PROCEEDINGS OF THE 8TH INTERNATIONAL CONFERENCE ON COMPUTER RECOGNITION SYSTEMS CORES 2013	Advances in Intelligent Systems and Computing				8th International Conference on Computer Recognition Systems (CORES)	MAY 25-27, 2013	Wroclaw, POLAND									Nowosielski, Adam/D-7930-2016; Forczmanski, Pawel/AAA-4978-2020; Frejlichowski, Dariusz/H-8107-2016; Forczmanski, Pawel/L-1055-2013; Gosciewska, Katarzyna/AAL-7671-2020	Nowosielski, Adam/0000-0001-7729-7867; Forczmanski, Pawel/0000-0002-3618-9146; Forczmanski, Pawel/0000-0002-3618-9146; Gosciewska, Katarzyna/0000-0002-6726-2174												2194-5357	2194-5365	978-3-319-00969-8; 978-3-319-00968-1				2013	226						351	360		10.1007/978-3-319-00969-8_34							WOS:000354284200034						
C	Penas, DR; Banga, JR; Gonzalez, P; Doallo, R		SaezRodriguez, J; Rocha, MP; FdezRiverola, F; Santana, JFD		Penas, D. R.; Banga, Julio R.; Gonzalez, P.; Doallo, R.			A Parallel Differential Evolution Algorithm for Parameter Estimation in Dynamic Models of Biological Systems	8TH INTERNATIONAL CONFERENCE ON PRACTICAL APPLICATIONS OF COMPUTATIONAL BIOLOGY & BIOINFORMATICS (PACBB 2014)	Advances in Intelligent Systems and Computing				8th International Conference on Practical Applications of Computational Biology & Bioinformatics (PACBB)	JUN 04-06, 2014	Univ Salamanca, Salamanca, SPAIN	Telefonica Digital, Indra, Ingn Software Avanzado S A, IBM, IEEE Syst Man & Cybernet Soc Spain, Asociac Espanola Para Inteligencia Artificial, Associacao Portuguesa Para Inteligencia Artificial, Ctr Natl Rech Scientifique, Unive Salamanca, Bioinformat Intelligent Syst & Educ Technol Res Grp, Univ Vigo, Next Generat Comp Syst Grp	Univ Salamanca							Banga, Julio R./A-8388-2008; Banga, Julio R./ABD-8629-2020; Gonzalez, Patricia/F-3822-2016; Penas, David R./N-6931-2017	Banga, Julio R./0000-0002-4245-0320; Banga, Julio R./0000-0002-4245-0320; Gonzalez, Patricia/0000-0003-0378-9222; Penas, David R./0000-0002-7256-3094												2194-5357	2194-5365	978-3-319-07581-5; 978-3-319-07580-8				2014	294						173	181		10.1007/978-3-319-07581-5_21							WOS:000351276700021						
C	Su, GF; Chen, JG; Liu, FZ; Huang, QY		Wen, Z; Li, T		Su, Guofeng; Chen, Jianguo; Liu, Fengzhi; Huang, Quanyi			Research on Key Technologies for Jail Incident Prevention and Response System	PRACTICAL APPLICATIONS OF INTELLIGENT SYSTEMS, ISKE 2013	Advances in Intelligent Systems and Computing				8th International Conference on Intelligent Systems and Knowledge Engineering (ISKE)	NOV 20-23, 2013	Shenzhen, PEOPLES R CHINA	Shenzhen Univ, Sci China Press, Chinese Acad Sci, IEEE Computat Intelligence Soc, Chinese Assoc Artificial Intelligence, State Key Lab Complex Elect Syst Simulat, Sci & Technol Integrated Informat Syst Lab, SW Jiaotong Univ, Univ Technol								Su, Guofeng/K-6798-2015													2194-5357		978-3-642-54927-4; 978-3-642-54926-7				2014	279						765	774		10.1007/978-3-642-54927-4_72							WOS:000348509400072						
C	Venkatesan, R; Raja, PDA; Ganesh, AB		Suresh, LP; Dash, SS; Panigrahi, BK		Venkatesan, R.; Raja, P. Dinesh Anton; Ganesh, A. Balaji			Video Surveillance Based Tracking System	ARTIFICIAL INTELLIGENCE AND EVOLUTIONARY ALGORITHMS IN ENGINEERING SYSTEMS, VOL 1	Advances in Intelligent Systems and Computing				International Conference on Artificial Intelligence and Evolutionary Algorithms in Engineering Systems (ICAEES)	APR 22-23, 2014	Noorul Islam Univ, Noorul Islam Ctr Higher Educ, Kumaracoil, INDIA		Noorul Islam Univ, Noorul Islam Ctr Higher Educ								P, DINESH ANTON RAJA/0000-0002-5946-7129												2194-5357		978-81-322-2126-5; 978-81-322-2125-8				2015	324						369	378		10.1007/978-81-322-2126-5_41							WOS:000357781400041						
C	Mo, HD; Xie, M		Zamojski, W; Mazurkiewicz, J; Sugier, J; Walkowiak, T; Kacprzyk, J		Mo, Huadong; Xie, Min			Modeling and Reliability Analysis of Digital Networked Systems Subject to Degraded Communication Networks	THEORY AND ENGINEERING OF COMPLEX SYSTEMS AND DEPENDABILITY	Advances in Intelligent Systems and Computing				10th International Conference on Dependability and Complex Systems (DepCoS-RELCOMEX)	JUN 29-JUL 03, 2015	Brunow, POLAND	Wroclaw Univ Technol, Dept Comp Engn								Xie, Min/A-5552-2011	Xie, Min/0000-0002-8500-8364; MO, Huadong/0000-0002-7782-2884												2194-5357	2194-5365	978-3-319-19216-1; 978-3-319-19215-4				2015	365						295	303		10.1007/978-3-319-19216-1_28							WOS:000365127100028						
C	Sahu, DP; Singh, K; Prakash, S		Satapathy, SC; Raju, KS; Mandal, JK; Bhateja, V		Sahu, Dinesh Prasad; Singh, Karan; Prakash, Shiv			Maximizing Availability and Minimizing Markesan for Task Scheduling in Grid Computing Using NSGA II	PROCEEDINGS OF THE SECOND INTERNATIONAL CONFERENCE ON COMPUTER AND COMMUNICATION TECHNOLOGIES, IC3T 2015, VOL 3	Advances in Intelligent Systems and Computing				2nd International Conference on Computer and Communication Technologies	JUL 24-26, 2015	CMR Tech Campus, Hyderabad, INDIA	CSI, Div V Educ & Res	CMR Tech Campus							Singh, Karan/AAR-1348-2020	Singh, Karan/0000-0002-6992-1655												2194-5357	2194-5365	978-81-322-2526-3; 978-81-322-2525-6				2016	381						219	224		10.1007/978-81-322-2526-3_24							WOS:000378024000024						
C	Yordanova, M; Mehmed-Hamza, M		Abraham, A; Kovalev, S; Tarassov, V; Snasel, V; Vasileva, M; Sukhanov, A		Yordanova, Marinela; Mehmed-Hamza, Mediha			A Computing Approach to Risk Assessment Related to Electromagnetic Field Exposure from Overhead Power Lines	PROCEEDINGS OF THE SECOND INTERNATIONAL SCIENTIFIC CONFERENCE INTELLIGENT INFORMATION TECHNOLOGIES FOR INDUSTRY (IITI'17), VOL 2	Advances in Intelligent Systems and Computing				2nd International Scientific Conference on Intelligent Information Technologies for Industry (IITI)	SEP 14-16, 2017	Varna, BULGARIA	Tech Univ Varna, Tech Univ Sofia, VSB Tech Univ Ostrava, Rostov State Transport Univ								Mehmed-Hamza, Mediha/U-1786-2017	Mehmed-Hamza, Mediha/0000-0003-1928-7446												2194-5357	2194-5365	978-3-319-68324-9				2018	680						220	227		10.1007/978-3-319-68324-9_24							WOS:000585075400024						
C	Lampart, M; Zapomel, J		Abraham, A; Jiang, XH; Snasel, V; Pan, JS		Lampart, Marek; Zapomel, Jaroslav			Vibration Attenuation of the Electromechanical System by a Double Impact Element	INTELLIGENT DATA ANALYSIS AND APPLICATIONS	Advances in Intelligent Systems and Computing				2nd Euro-China Conference on Intelligent Data Analysis and Applications (ECC)	2015	Tech Univ Ostrava, Ostrava, CZECH REPUBLIC	Fujian Univ Technol	Tech Univ Ostrava							Zapomel, Jaroslav/ABH-5654-2020; Lampart, Marek/D-1963-2013	Zapomel, Jaroslav/0000-0002-7943-4287; Lampart, Marek/0000-0001-6349-8553												2194-5357	2194-5365	978-3-319-21206-7; 978-3-319-21205-0				2015	370						25	35		10.1007/978-3-319-21206-7_3							WOS:000365130300003						
C	Khan, G; Sengupta, S; Sarkar, A		Chaki, R; Saeed, K; Cortesi, A; Chaki, N		Khan, Gitosree; Sengupta, Sabnam; Sarkar, Anirban			Modeling and Analysis of Enterprise Cloud Bus Using a Petri Net Based Approach	ADVANCED COMPUTING AND SYSTEMS FOR SECURITY, VOL 4	Advances in Intelligent Systems and Computing				3rd International Doctoral Symposium on Applied Computation and Security Systems (ACSS)	AUG 12-14, 2016	Kolkata, INDIA	Univ Calcutta, NIT, Tata Consultancy Serv, Springer Nature, ACM India, Ms Neitec, Ms Fujitsu Inc, Univ Calcutta, Dept Comp Sci & Engn, Univ Calcutta, A K Choudhury Sch Informat Technol																					2194-5357	2194-5365	978-981-10-3391-9; 978-981-10-3390-2				2017	568						17	36		10.1007/978-981-10-3391-9_2							WOS:000425353200002						
C	Qian, S		MizeraPietraszko, J; Pichappan, P		Qian, Shi			Damping Loss Prevention on Aerobics Special Shoe Materials Based on Intelligent Analysis	LECTURE NOTES IN REAL-TIME INTELLIGENT SYSTEMS (RTIS 2016)	Advances in Intelligent Systems and Computing				1st Beijing International Conference on Real-Time Intelligent Systems (RTIS)	SEP 01-03, 2016	Beijing, PEOPLES R CHINA																						2194-5357	2194-5365	978-3-319-60744-3; 978-3-319-60743-6				2018	613						378	384		10.1007/978-3-319-60744-3_41							WOS:000452919900041						
C	Brotons-Martinez, JM; Sansalvador-Selles, ME		GilAluja, J; TercenoGomez, A; FerrerComalat, JC; MerigoLindahl, JM; LinaresMustaros, S		Brotons-Martinez, Jose M.; Sansalvador-Selles, Manuel E.			A Methodology for the Valuation of Quality Management System in a Fuzzy Environment	SCIENTIFIC METHODS FOR THE TREATMENT OF UNCERTAINTY IN SOCIAL SCIENCES	Advances in Intelligent Systems and Computing				18th International SIGEF Congress on Scientific methods for the treatment of uncertainty in social sciences	JUL 06-08, 2015	Girona, SPAIN	Int Assoc Fuzzy Set Management & Econ, Univ Girona, Res Grp Accounting & Math Econ & Business								brotons, jose manuel/K-4552-2014	brotons, jose manuel/0000-0003-4433-3758												2194-5357		978-3-319-19704-3; 978-3-319-19703-6				2015	377						183	193		10.1007/978-3-319-19704-3_15							WOS:000364842100015						
C	Singh, N; Singh, S		Satapathy, SC; Avadhani, PS; Udgata, SK; Lakshminarayana, S		Singh, Nirmal; Singh, Sarbjeet			Design and Performance Analysis of File Replication Strategy on Distributed File System Using GridSim	ICT AND CRITICAL INFRASTRUCTURE: PROCEEDINGS OF THE 48TH ANNUAL CONVENTION OF COMPUTER SOCIETY OF INDIA - VOL I	Advances in Intelligent Systems and Computing				48th Annual Convention of Computer Society of India (CSI)	DEC 13-15, 2013	Comp Soc India, Vishakapatnam Chapter, Visakhapatnam, INDIA		Comp Soc India, Vishakapatnam Chapter							Singh, Sarbjeet/K-7472-2012	Singh, Sarbjeet/0000-0003-0600-8487												2194-5357	2194-5365	978-3-319-03107-1				2014	248						629	637		10.1007/978-3-319-03107-1_69							WOS:000345334100069						
C	Kim, Y; Gomez, M; Goppert, J; Matson, ET		Kim, JH; Yang, W; Jo, J; Sincak, P; Myung, H		Kim, Yongho; Gomez, Mauricio; Goppert, James; Matson, Eric T.			Model Checking of a Training System Using NuSMV for Humanoid Robot Soccer	ROBOT INTELLIGENCE TECHNOLOGY ANDAPPLICATIONS 3	Advances in Intelligent Systems and Computing				3rd International Conference on Robot Intelligence Technology and Applications	NOV 06-08, 2014	Beijing, PEOPLES R CHINA									Goppert, James/AAB-8501-2019	Goppert, James/0000-0002-2044-4931												2194-5357	2194-5365	978-3-319-16841-8; 978-3-319-16840-1				2015	345						531	540		10.1007/978-3-319-16841-8_48							WOS:000380533900048						
C	Bystrov, V; Malygina, S; Khaliullina, D		Silhavy, R; Silhavy, P; Prokopova, Z		Bystrov, Vitaliy; Malygina, Svetlana; Khaliullina, Darya			Using the Method of System Dynamics to Forecast Additional Manpower Needs in Murmansk Region	APPLIED COMPUTATIONAL INTELLIGENCE AND MATHEMATICAL METHODS: COMPUTATIONAL METHODS IN SYSTEMS AND SOFTWARE 2017, VOL. 2	Advances in Intelligent Systems and Computing				Conference on Computational Methods in Systems and Software (CoMeSySo)	SEP 12-14, 2017	Vsetin, CZECH REPUBLIC	OpenPublish eu s r o								Vitaliy, Bystrov/H-6947-2018; Malygina, Svetlana/J-4042-2018	Vitaliy, Bystrov/0000-0002-9369-8457; Malygina, Svetlana/0000-0001-6010-5662												2194-5357	2194-5365	978-3-319-67621-0				2018	662						310	317		10.1007/978-3-319-67621-0_28							WOS:000440507200028						
C	Xie, H; Su, DL; Pan, YJ; Xu, ZF		Patnaik, S; Li, X		Xie, Hong; Su, Donglin; Pan, Yijia; Xu, Zhongfu			Design and Implementation of a Middleware for Service-Oriented Distributed Systems	PROCEEDINGS OF INTERNATIONAL CONFERENCE ON SOFT COMPUTING TECHNIQUES AND ENGINEERING APPLICATION, ICSCTEA 2013	Advances in Intelligent Systems and Computing				International Conference on Soft Computing Techniques and Engineering Application (ICSCTEA)	SEP 25-27, 2013	Kunming, PEOPLES R CHINA																						2194-5357		978-81-322-1695-7; 978-81-322-1694-0				2014	250						351	359		10.1007/978-81-322-1695-7_40							WOS:000342742500040						
C	Li, W; He, XX; Tang, C; Wu, KS; Chen, XH; Yu, SY; Lei, YL; Fang, YN; Song, YP		Pan, JS; Snasel, V; Sung, TW; Wang, XD		Li, Wei; He, Xiaoxuan; Tang, Chao; Wu, Keshou; Chen, Xuhui; Yu, Shaoyong; Lei, Yuliang; Fang, Yanan; Song, Yuping			Handwritten Numbers and English Characters Recognition System	INTELLIGENT DATA ANALYSIS AND APPLICATIONS, (ECC 2016)	Advances in Intelligent Systems and Computing				3rd Euro-China Conference on Intelligent Data Analysis and Applications (ECC)	NOV 07-09, 2016	Fujian Univ Technol, Fuzhou, PEOPLES R CHINA	Fujian Provincial Key Lab Big Data Mining & Applicat, VSB Techn Univ Ostrava, Taiwan Assoc Web Intelligence Consortium & Immers Co Ltd	Fujian Univ Technol																				2194-5357		978-3-319-48499-0; 978-3-319-48498-3				2017	535						145	154		10.1007/978-3-319-48499-0_18							WOS:000398625400018						
C	Sirkemaa, S		Antipova, T; Rocha, A		Sirkemaa, Seppo			Standards and Information Systems Management - The Key to Success	INFORMATION TECHNOLOGY SCIENCE	Advances in Intelligent Systems and Computing				International Conference on Information Technology Science (MosITS)	DEC 01-03, 2017	Moscow, RUSSIA									Sirkemaa, Seppo/V-8947-2017	Sirkemaa, Seppo/0000-0003-2529-2209												2194-5357	2194-5365	978-3-319-74980-8; 978-3-319-74979-2				2018	724						245	251		10.1007/978-3-319-74980-8_23							WOS:000511443000023						
C	Grabska, E; Lachwa, A; Slusarczyk, G		Gruca, A; Brachman, A; Kozielski, S; Czachorski, T		Grabska, Ewa; Lachwa, Andrzej; Slusarczyk, Grazyna			Approximate Reasoning and Fuzzy Evaluation in Code Compliance Checking	MAN-MACHINE INTERACTIONS 4, ICMMI 2015	Advances in Intelligent Systems and Computing				4th International Conference on Man-Machine Interactions (ICMMI)	OCT 06-09, 2015	Kocierz Pass, POLAND	IEEE Poland Sect Chapters, IEEE, Silesian Univ Technol, Inst Informat, Polish Acad Sci, Inst Theoret & Appl Informat									Grabska, Ewa/0000-0002-4965-5601												2194-5357		978-3-319-23437-3; 978-3-319-23436-6				2016	391						551	561		10.1007/978-3-319-23437-3_47							WOS:000378034400047						
C	Peixoto, R; Portela, F; Santos, MF		Rocha, A; Correia, AM; Adeli, H; Reis, LP; Teixeira, MM		Peixoto, Rui; Portela, Filipe; Santos, Manuel F.			Towards a Pervasive Data Mining Engine - Architecture overview	NEW ADVANCES IN INFORMATION SYSTEMS AND TECHNOLOGIES, VOL 2	Advances in Intelligent Systems and Computing				World Conference on Information Systems and Technologies (WorldCIST)	MAR 22-24, 2016	Recife, BRAZIL									Santos, Manuel/ABD-3467-2020; Portela, Filipe/G-5324-2012; Santos, Manuel F/I-8250-2015	Santos, Manuel/0000-0002-5441-3316; Portela, Filipe/0000-0003-2181-6837; Santos, Manuel F/0000-0002-5441-3316												2194-5357	2194-5365	978-3-319-31307-8; 978-3-319-31306-1				2016	445						557	566		10.1007/978-3-319-31307-8_58							WOS:000417260200058						
C	Xia, Z		Yang, G		Xia, Zhuang			Research on Function Block Application in Process Control System	PROCEEDINGS OF THE 2012 INTERNATIONAL CONFERENCE ON COMMUNICATION, ELECTRONICS AND AUTOMATION ENGINEERING	Advances in Intelligent Systems and Computing				International Conference on Communications, Electronics and Automation Engineering	AUG 23-25, 2012	Xian, PEOPLES R CHINA	Xian Technol Univ, Shaanxi Network & Monitoring Control Engn Lab, Missouri Western State Univ																					2194-5357		978-3-642-31697-5				2013	181						127	133									WOS:000315538000019						
C	Gzik, M; Wodarski, P; Jurkojc, J; Michnik, R; Bieniek, A		Gzik, M; Tkacz, E; Paszenda, Z; Pietka, E		Gzik, Marek; Wodarski, Piotr; Jurkojc, Jacek; Michnik, Robert; Bieniek, Andrzej			Interactive System of Enginering Support of Upper Limb Diagnosis	INNOVATIONS IN BIOMEDICAL ENGINEERING	Advances in Intelligent Systems and Computing				Conference on Innovations in Biomedical Engineering (IBE)	OCT 16-18, 2016	Zabrze, POLAND									Jurkojc, Jacek/Z-3074-2019; Wodarski, Piotr/U-5108-2018; Bieniek, Andrzej/M-9584-2015; Michnik, Robert/M-4447-2015	Jurkojc, Jacek/0000-0003-0827-5335; Wodarski, Piotr/0000-0001-6701-1546; Bieniek, Andrzej/0000-0003-4303-131X; Michnik, Robert/0000-0002-5286-6055												2194-5357	2194-5365	978-3-319-47154-9; 978-3-319-47153-2				2017	526						115	123		10.1007/978-3-319-47154-9_14							WOS:000455777500014						
C	Philip, G; D'Souza, M		Choudhary, RK; Mandal, JK; Auluck, N; Nagarajaram, HA		Philip, Gracy; D'Souza, Meenakshi			Safety Validation of an Embedded Real-Time System at Hardware-Software Integration Test Environment	ADVANCED COMPUTING AND COMMUNICATION TECHNOLOGIES	Advances in Intelligent Systems and Computing				9th International Conference on Advanced Computing and Communication Technologies (ICACCT)	NOV 28-29, 2015	Asia Pacific Inst Informat Technol, Panipat, INDIA	Inst Elect & Telecommunicat Engineers, Comp Soc India	Asia Pacific Inst Informat Technol																				2194-5357		978-981-10-1023-1; 978-981-10-1021-7				2016	452						51	58		10.1007/978-981-10-1023-1_5							WOS:000387180900005						
C	Gupta, P; Purohit, GN; Gupta, A		Babu, BV; Nagar, A; Deep, K; Pant, M; Bansal, JC; Ray, K; Gupta, U		Gupta, Pratishtha; Purohit, G. N.; Gupta, Adhyana			Approaches of Computing Traffic Load for Automated Traffic Signal Control: A Survey	PROCEEDINGS OF THE SECOND INTERNATIONAL CONFERENCE ON SOFT COMPUTING FOR PROBLEM SOLVING (SOCPROS 2012)	Advances in Intelligent Systems and Computing				2nd International Conference on Soft Computing for Problem Solving (SocProS)	DEC 28-30, 2012	JK Lakshmipat Univ, Jaipur, INDIA	JK Lakshmipat Univ, Inst Engn & Technol	JK Lakshmipat Univ																				2194-5357	2194-5365	978-81-322-1602-5; 978-81-322-1601-8				2014	236						931	945		10.1007/978-81-322-1602-5_99							WOS:000337801800099						
C	Czajkowski, A; Patan, K		Korbicz, J; Kowal, M		Czajkowski, Andrzej; Patan, Krzysztof			Model Predictive Control of the Two Rotor Aero-Dynamical System Using State Space Neural Networks with Delays	INTELLIGENT SYSTEMS IN TECHNICAL AND MEDICAL DIAGNOSTICS	Advances in Intelligent Systems and Computing				11th International Conference on Diagnostics of Processes and Systems (DPS)	SEP 08-11, 2013	Lagow Lubuski, POLAND	Univ Zielona Gora, Inst Control & Computat Engn, Warsaw Univ Technol, Lubuskie Sci Soc, Polish Minist Sci & Higher Educ, Polish Acad Sci, Comm Automat Control & Robot, Gdansk Univ Technol								czajkowski, andrzej/I-5413-2014; Patan, Krzysztof/H-7889-2014	czajkowski, andrzej/0000-0002-7990-5886; Patan, Krzysztof/0000-0002-6989-9400												2194-5357		978-3-642-39881-0; 978-3-642-39880-3				2014	230						113	124		10.1007/978-3-642-39881-0_9							WOS:000329201800009						
C	Jinny, SV; Kumari, JJ		Suresh, LP; Dash, SS; Panigrahi, BK		Jinny, S. Vinila; Kumari, J. Jaya			Encrusted CRF in Intrusion Detection System	ARTIFICIAL INTELLIGENCE AND EVOLUTIONARY ALGORITHMS IN ENGINEERING SYSTEMS, VOL 2	Advances in Intelligent Systems and Computing				International Conference on Artificial Intelligence and Evolutionary Algorithms in Engineering Systems (ICAEES)	APR 22-23, 2014	Noorul Islam Univ, Noorul Islam Ctr Higher Educ, Kumaracoil, INDIA		Noorul Islam Univ, Noorul Islam Ctr Higher Educ							S, Vinila Jinny/AAT-5968-2020; Jayakumari, J./AAE-3049-2019	S, Vinila Jinny/0000-0003-2756-6736; Jayakumari, J./0000-0001-9500-7907												2194-5357		978-81-322-2135-7; 978-81-322-2134-0				2015	325						605	613		10.1007/978-81-322-2135-7_64							WOS:000357378500064						
C	Vasantrao, KV; Desai, CG		Satapathy, SC; Raju, KS; Mandal, JK; Bhateja, V		Vasantrao, Kardile Vilas; Desai, Chitra G.			"Jugaad"-The Creativeness for Selection of Software Development Methodology Advisory System-Fuzzy Expert System	PROCEEDINGS OF THE SECOND INTERNATIONAL CONFERENCE ON COMPUTER AND COMMUNICATION TECHNOLOGIES, IC3T 2015, VOL 1	Advances in Intelligent Systems and Computing				2nd International Conference on Computer and Communication Technologies	JUL 24-26, 2015	CMR Tech Campus, Hyderabad, INDIA	CSI, Div V Educ & Res	CMR Tech Campus																				2194-5357		978-81-322-2517-1; 978-81-322-2516-4				2016	379						411	423		10.1007/978-81-322-2517-1_40							WOS:000377858400040						
C	Kowalczyk, M; Kryjak, T		Mitkowski, W; Kacprzyk, J; Oprzedkiewicz, K; Skruch, P		Kowalczyk, Marcin; Kryjak, Tomasz			Object Tracking With the Use of a Moving Camera Implemented in Heterogeneous Zynq System on Chip	TRENDS IN ADVANCED INTELLIGENT CONTROL, OPTIMIZATION AND AUTOMATION	Advances in Intelligent Systems and Computing				19th Polish Control Conference (KKA)	JUN 18-21, 2017	Krakow, POLAND	AGH Univ Sci & Technol, Fac Elect Engn, Automat, Comp Sci & Biomed Engn, Dept Automat & Biomed Engn, Polish Acad Sci, Comm Automat Control & Robot, Polish Acad Arts & Sci, Commiss Engn Sci								Kryjak, Tomasz/C-5223-2013	Kryjak, Tomasz/0000-0001-6798-4444												2194-5357	2194-5365	978-3-319-60699-6				2017	577						354	363		10.1007/978-3-319-60699-6_34							WOS:000470009800034						
C	Eid, MM; Mohamed, MA; Abou-El-Soud, MA		Abraham, A; Jiang, XH; Snasel, V; Pan, JS		Eid, M. M.; Mohamed, M. A.; Abou-El-Soud, M. A.			Development of Iris Security System Using Adaptive Quality-Based Template Fusion	INTELLIGENT DATA ANALYSIS AND APPLICATIONS	Advances in Intelligent Systems and Computing				2nd Euro-China Conference on Intelligent Data Analysis and Applications (ECC)	2015	Tech Univ Ostrava, Ostrava, CZECH REPUBLIC	Fujian Univ Technol	Tech Univ Ostrava																				2194-5357		978-3-319-21206-7; 978-3-319-21205-0				2015	370						265	278		10.1007/978-3-319-21206-7_23							WOS:000365130300023						
C	Syed, U; Patil, M; Li, YQ; Craig, B		Rebelo, F; Soares, M		Syed, Uzairulhassan; Patil, Manoj; Li, Yueqing; Craig, Brian			Ergonomics Evaluation of a Manual Braking System for Skateboards	ADVANCES IN ERGONOMICS IN DESIGN (AHFE 2017)	Advances in Intelligent Systems and Computing				AHFE International Conference on Ergonomics in Design	JUL 17-21, 2017	Los Angeles, CA																						2194-5357	2194-5365	978-3-319-60582-1; 978-3-319-60581-4				2018	588						157	164		10.1007/978-3-319-60582-1_16							WOS:000448239400016						
C	Wang, SY; Hu, TJ		Chen, W; Hosoda, K; Menegatti, E; Shimizu, M; Wang, H		Wang, Shuyuan; Hu, Tianjiang			ROS-Gazebo Supported Platform for Tag-in-Loop Indoor Localization of Quadrocopter	INTELLIGENT AUTONOMOUS SYSTEMS 14	Advances in Intelligent Systems and Computing				14th International Conference on Intelligent Autonomous Systems (IAS)	JUL 03-07, 2016	Shanghai Jiao Tong Univ, Shanghai, PEOPLES R CHINA		Shanghai Jiao Tong Univ																				2194-5357	2194-5365	978-3-319-48036-7; 978-3-319-48035-0				2017	531						185	197		10.1007/978-3-319-48036-7_14							WOS:000406996500014						
C	Domek, S		Mitkowski, W; Kacprzyk, J; Oprzedkiewicz, K; Skruch, P		Domek, Stefan			Approximation and stability analysis of some kinds of switched fractional linear systems	TRENDS IN ADVANCED INTELLIGENT CONTROL, OPTIMIZATION AND AUTOMATION	Advances in Intelligent Systems and Computing				19th Polish Control Conference (KKA)	JUN 18-21, 2017	Krakow, POLAND	AGH Univ Sci & Technol, Fac Elect Engn, Automat, Comp Sci & Biomed Engn, Dept Automat & Biomed Engn, Polish Acad Sci, Comm Automat Control & Robot, Polish Acad Arts & Sci, Commiss Engn Sci								Domek, Stefan/G-6698-2016	Domek, Stefan/0000-0002-4056-5175												2194-5357	2194-5365	978-3-319-60699-6				2017	577						442	454		10.1007/978-3-319-60699-6_43							WOS:000470009800043						
