PT	AU	BA	BE	GP	AF	BF	CA	TI	SO	SE	BS	LA	DT	CT	CY	CL	SP	HO	DE	ID	AB	C1	RP	EM	RI	OI	FU	FX	CR	NR	TC	Z9	U1	U2	PU	PI	PA	SN	EI	BN	J9	JI	PD	PY	VL	IS	PN	SU	SI	MA	BP	EP	AR	DI	D2	EA	PG	WC	SC	GA	UT	PM	OA	HC	HP	DA
C	Sabitha, R; Bhuma, KT; Thyagarajan, T		Satapathy, SC; Biswal, BN; Udgata, SK; Mandal, JK		Sabitha, Ramakrishnan; Bhuma, Krishna T.; Thyagarajan, Thangavelu			Design and Analysis of Fuzzy Logic and Neural Network Based Transmission Power Control Techniques for Energy Efficient Wireless Sensor Networks	PROCEEDINGS OF THE 3RD INTERNATIONAL CONFERENCE ON FRONTIERS OF INTELLIGENT COMPUTING: THEORY AND APPLICATIONS (FICTA) 2014, VOL 1	Advances in Intelligent Systems and Computing				3rd International Conference on Frontiers in Intelligent Computing - Theory and Applications (FICTA)	NOV 14-15, 2014	Bhubaneswar, INDIA	Bhubaneswar Engn Coll, Anil Neerukonda Inst Technol & Sci, CSI Student Branch																					2194-5357	2194-5365	978-3-319-11932-8				2015	327						295	303		10.1007/978-3-319-11933-5_32							WOS:000347779500032						
C	Mahitha, O; Suma, V		Satapathy, SC; Avadhani, PS; Udgata, SK; Lakshminarayana, S		Mahitha, O.; Suma, V.			Effective Disaster Management to Enhance the Cloud Stability	ICT AND CRITICAL INFRASTRUCTURE: PROCEEDINGS OF THE 48TH ANNUAL CONVENTION OF COMPUTER SOCIETY OF INDIA - VOL I	Advances in Intelligent Systems and Computing				48th Annual Convention of Computer Society of India (CSI)	DEC 13-15, 2013	Comp Soc India, Vishakapatnam Chapter, Visakhapatnam, INDIA		Comp Soc India, Vishakapatnam Chapter								V, Suma/0000-0003-1942-6741												2194-5357	2194-5365	978-3-319-03107-1				2014	248						583	591		10.1007/978-3-319-03107-1_64							WOS:000345334100064						
C	Sharif, MM; Tharwat, A; Hassanien, AE; Hefeny, HA		Abraham, A; Jiang, XH; Snasel, V; Pan, JS		Sharif, Mahir M.; Tharwat, Alaa; Hassanien, Aboul Ella; Hefeny, Hesham A.			Automated Enzyme Function Classification Based on Pairwise Sequence Alignment Technique	INTELLIGENT DATA ANALYSIS AND APPLICATIONS	Advances in Intelligent Systems and Computing				2nd Euro-China Conference on Intelligent Data Analysis and Applications (ECC)	2015	Tech Univ Ostrava, Ostrava, CZECH REPUBLIC	Fujian Univ Technol	Tech Univ Ostrava							Hassanien, Aboul ella/O-5672-2014; Sharif, Mahir/O-6720-2014; Hefny, Hesham/A-5619-2013	Hassanien, Aboul ella/0000-0002-9989-6681; Hefny, Hesham/0000-0001-5862-675X												2194-5357	2194-5365	978-3-319-21206-7; 978-3-319-21205-0				2015	370						499	510		10.1007/978-3-319-21206-7_43							WOS:000365130300043						
C	Ramamoorthy, S; Kirubakaran, R; Subramanian, RS		Suresh, LP; Dash, SS; Panigrahi, BK		Ramamoorthy, Suganya; Kirubakaran, R.; Subramanian, Rajaram Siva			Texture Feature Extraction Using MGRLBP Method for Medical Image Classification	ARTIFICIAL INTELLIGENCE AND EVOLUTIONARY ALGORITHMS IN ENGINEERING SYSTEMS, VOL 1	Advances in Intelligent Systems and Computing				International Conference on Artificial Intelligence and Evolutionary Algorithms in Engineering Systems (ICAEES)	APR 22-23, 2014	Noorul Islam Univ, Noorul Islam Ctr Higher Educ, Kumaracoil, INDIA		Noorul Islam Univ, Noorul Islam Ctr Higher Educ							Rajaram, S/AAP-9237-2020; Ramamoorthy, Suganya/X-9718-2018	Ramamoorthy, Suganya/0000-0003-1874-6479; R, KIRUBAKARAN/0000-0002-1467-604X												2194-5357	2194-5365	978-81-322-2126-5; 978-81-322-2125-8				2015	324						747	753		10.1007/978-81-322-2126-5_80							WOS:000357781400080						
C	Navamani, TM; Yogesh, P		Satapathy, SC; Biswal, BN; Udgata, SK; Mandal, JK		Navamani, T. M.; Yogesh, P.			Secure Efficient Routing against Packet Dropping Attacks in Wireless Mesh Networks	PROCEEDINGS OF THE 3RD INTERNATIONAL CONFERENCE ON FRONTIERS OF INTELLIGENT COMPUTING: THEORY AND APPLICATIONS (FICTA) 2014, VOL 2	Advances in Intelligent Systems and Computing				3rd International Conference on Frontiers in Intelligent Computing - Theory and Applications (FICTA)	NOV 14-15, 2014	Bhubaneswar, INDIA	Bhubaneswar Engn Coll, Anil Neerukonda Inst Technol & Sci, CSI Student Branch									t M, Navamani/0000-0001-9197-4692												2194-5357	2194-5365	978-3-319-12012-6; 978-3-319-12011-9				2015	328						673	686		10.1007/978-3-319-12012-6_75							WOS:000365181700075						
C	Aizad, T; Maganga, O; Sumislawska, M; Burnham, KJ		Selvaraj, H; Zydek, D; Chmaj, G		Aizad, T.; Maganga, O.; Sumislawska, M.; Burnham, K. J.			A comparative Study of Model-Based and Data-Based Model Order Reduction Techniques for Nonlinear Systems	PROGRESS IN SYSTEMS ENGINEERING	Advances in Intelligent Systems and Computing				23rd International Conference on Systems Engineering	AUG 19-21, 2014	Las Vegas, NV	Univ Nevada Las Vegas, ALDEC, NVEnergy									Sumislawska, Malgorzata/0000-0003-4769-9157												2194-5357	2194-5365	978-3-319-08421-3				2015	366						83	88		10.1007/978-3-319-08422-0_12							WOS:000360214900012						
C	Hagan, M; Kim, M		Chung, WJ; Shin, CS		Hagan, Margaret; Kim, Miso			Design for Dignity and Procedural Justice	ADVANCES IN AFFECTIVE AND PLEASURABLE DESIGN (AHFE 2017)	Advances in Intelligent Systems and Computing				8th International Conference on Applied Human Factors and Ergonomics (AHFE) / International Conference on Affective and Pleasurable Design	JUL 17-21, 2017	Los Angeles, CA																						2194-5357	2194-5365	978-3-319-60495-4; 978-3-319-60494-7				2018	585						135	145		10.1007/978-3-319-60495-4_15							WOS:000465822900015						
C	Yu, C		Du, Z		Yu, Chen			Developing a Small Enterprise's Human Resource Management System -Based on the Theory of Software Engineering	PROCEEDINGS OF THE 2012 INTERNATIONAL CONFERENCE OF MODERN COMPUTER SCIENCE AND APPLICATIONS	Advances in Intelligent Systems and Computing				International Conference of Modern Computer Science and Applications (MCSA 2012)	SEP 08, 2012	Wuhan, PEOPLES R CHINA	Informat Technol & Ind Engn Res Ctr																					2194-5357		978-3-642-33029-2				2013	191						473	477									WOS:000313841400076						
C	Chudzikiewicz, J; Malinowski, T; Zielinski, Z		Grzenda, M; Awad, AI; Furtak, J; Legierski, J		Chudzikiewicz, Jan; Malinowski, Tomasz; Zielinski, Zbigniew			An Analytical Method of Server Placement in Regular Networks and Its Evaluation by Simulation Experiments	ADVANCES IN NETWORK SYSTEMS: ARCHITECTURES, SECURITY, AND APPLICATIONS	Advances in Intelligent Systems and Computing				3rd International Conference on Innovative Network Systems and Applications (iNetSApp) held in conjunction with Federated Conference on Computer Science and Information Systems (FedCSIS)	SEP 13-16, 2015	Technical Univ Lodz, Lodz, POLAND	IEEE Comp Soc, Polish Informat Proc Soc, IEEE Reg 8, IEEE Poland Sect Comp Soc Chapter, IEEE Poland Gdansk Sect Comp Soc Chapter, IEEE CIS Poland Sect Chapter, ACM Special Interest Grp Applied Comp, ACM Lodz Chapter, European Alliance Innovat, Polish Acad Sci, Comm Comp Sci, Polish Operat & Syst Res Soc, Eastern Cluster ICT Poland, Mazovia Cluster ICT	Technical Univ Lodz							Chudzikiewicz, Jan/N-5873-2018	Chudzikiewicz, Jan/0000-0002-1352-9638; Malinowski, Tomasz/0000-0001-5191-8282; Zielinski, Zbigniew/0000-0001-5129-0448												2194-5357	2194-5365	978-3-319-44354-6; 978-3-319-44352-2				2017	461						13	32		10.1007/978-3-319-44354-6_2							WOS:000455643800002						
C	Azarov, A; Abramov, M; Tulupyeva, T; Tulupyev, A		Samsonovich, AV; Klimov, VV; Rybina, GV		Azarov, Artur; Abramov, Maksim; Tulupyeva, Tatiana; Tulupyev, Alexander			Users' of Information Systems Protection Analysis from Malefactor's Social Engineering Attacks Taking into Account Malefactor's Competence Profile	BIOLOGICALLY INSPIRED COGNITIVE ARCHITECTURES (BICA) FOR YOUNG SCIENTISTS	Advances in Intelligent Systems and Computing				1st International Early Research Career Enhancement School on Biologically Inspired Cognitive Architectures (FIERCES on BICA)	APR 21-24, 2016	Moscow, RUSSIA	Russian Assoc Artificial Intelligence, BICA Soc, Russian Sci Fdn								Tulupyev, Alexander/A-8495-2012; Azarov, Artur A/G-2610-2015; Tulupyeva, Tatiana/G-2942-2015; Abramov, Maksim/P-9551-2016	Tulupyev, Alexander/0000-0003-1814-4646; Azarov, Artur A/0000-0003-3240-597X; Tulupyeva, Tatiana/0000-0003-3630-7971; Abramov, Maksim/0000-0002-5476-3025												2194-5357		978-3-319-32554-5; 978-3-319-32553-8				2016	449						25	30		10.1007/978-3-319-32554-5_4							WOS:000386313100004						
C	Selvaraj, R; Kuthadi, VM; Marwala, T		Satapathy, SC; Biswal, BN; Udgata, SK; Mandal, JK		Selvaraj, Rajalakshmi; Kuthadi, Venu Madhav; Marwala, Tshilidzi			Hybrid Technique for Frequent Pattern Extraction from Sequential Database	PROCEEDINGS OF THE 3RD INTERNATIONAL CONFERENCE ON FRONTIERS OF INTELLIGENT COMPUTING: THEORY AND APPLICATIONS (FICTA) 2014, VOL 1	Advances in Intelligent Systems and Computing				3rd International Conference on Frontiers in Intelligent Computing - Theory and Applications (FICTA)	NOV 14-15, 2014	Bhubaneswar, INDIA	Bhubaneswar Engn Coll, Anil Neerukonda Inst Technol & Sci, CSI Student Branch									Venu Madhav, Prof Kuthadi/0000-0003-4515-1921												2194-5357	2194-5365	978-3-319-11932-8				2015	327						265	275		10.1007/978-3-319-11933-5_29							WOS:000347779500029						
S	Rossi, R; Gastaldi, M; Gecchele, G		Zak, J; Hadas, Y; Rossi, R		Rossi, Riccardo; Gastaldi, Massimiliano; Gecchele, Gregorio			Automatic Incident Detection on Freeway Ramp Junctions. A Fuzzy Logic-Based System Using Loop Detector Data	ADVANCED CONCEPTS, METHODOLOGIES AND TECHNOLOGIES FOR TRANSPORTATION AND LOGISTICS	Advances in Intelligent Systems and Computing																												2194-5357	2194-5365	978-3-319-57105-8				2018	572						370	383		10.1007/978-3-319-57105-8_18	10.1007/978-3-319-57105-8						WOS:000425063200022						
C	Du, W; Lin, H; Sun, JW; Yang, HB; Yu, B		Abraham, A; Cherukuri, AK; Madureira, AM; Muda, AK		Du, Wei; Lin, Hu; Sun, Jianwei; Yang, Haibo; Yu, Bo			Building Influence for Online Social Networks	PROCEEDINGS OF THE EIGHTH INTERNATIONAL CONFERENCE ON SOFT COMPUTING AND PATTERN RECOGNITION (SOCPAR 2016)	Advances in Intelligent Systems and Computing				8th International Conference on Soft Computing and Pattern Recognition (SoCPaR) / 8th International Conference on Computational Aspects of Social Networks (CASoN)	DEC 19-21, 2016	Vellore Inst Technol Univ, Vellore, INDIA	Machine Intelligence Research Labs	Vellore Inst Technol Univ																				2194-5357	2194-5365	978-3-319-60618-7; 978-3-319-60617-0				2018	614						709	718		10.1007/978-3-319-60618-7_69							WOS:000454700100069						
C	Lalitha, RVS; Suma, GJ		Satapathy, SC; Raju, KS; Mandal, JK; Bhateja, V		Lalitha, R. V. S.; Suma, G. Jaya			Vehicular Ad Hoc Networks: Trimming Pile-Ups in Data Dissemination Using HTPVANET Algorithm	PROCEEDINGS OF THE SECOND INTERNATIONAL CONFERENCE ON COMPUTER AND COMMUNICATION TECHNOLOGIES, IC3T 2015, VOL 3	Advances in Intelligent Systems and Computing				2nd International Conference on Computer and Communication Technologies	JUL 24-26, 2015	CMR Tech Campus, Hyderabad, INDIA	CSI, Div V Educ & Res	CMR Tech Campus							Lalitha/AAI-1986-2020	Lalitha, Dr.R.V.S./0000-0002-1808-9969												2194-5357		978-81-322-2526-3; 978-81-322-2525-6				2016	381						557	571		10.1007/978-81-322-2526-3_58							WOS:000378024000058						
C	Vanus, J; Kucera, P; Koziorek, J		Silhavy, R; Senkerik, R; Oplatkova, ZK; Silhavy, P; Prokopova, Z		Vanus, Jan; Kucera, Pavel; Koziorek, Jiri			The Software Analysis Used for Visualization of Technical Functions Control in Smart Home Care	MODERN TRENDS AND TECHNIQUES IN COMPUTER SCIENCE (CSOC 2014)	Advances in Intelligent Systems and Computing				3rd Computer Science On-line Conference (CSOC)	APR, 2014	ELECTR NETWORK									Koziorek, Jiri/C-6211-2016	Koziorek, Jiri/0000-0002-7138-887X												2194-5357	2194-5365	978-3-319-06740-7				2014	285						549	558		10.1007/978-3-319-06740-7_47							WOS:000370620000047						
C	Stankiewicz, B; Darowski, M; Palko, KJ		Augustyniak, P; Maniewski, R; Tadeusiewicz, R		Stankiewicz, Barbara; Darowski, Marek; Palko, Krzysztof Jakub			Influence of Preterm Birth, BPD and Lung Inhomogeneity on Respiratory System Impedance - Model Studies	RECENT DEVELOPMENTS AND ACHIEVEMENTS IN BIOCYBERNETICS AND BIOMEDICAL ENGINEERING	Advances in Intelligent Systems and Computing				20th Polish Conference on Biocybernetics and Biomedical Engineering (PCBBE)	SEP 20-22, 2017	AGH Univ Sci & Technol, Krakow, POLAND	Polish Acad Sci, Comm Biocybernet & Biomed Engn, Polish Soc Biomed Engn, IEEE Signal Proc Soc, Polish Chapter	AGH Univ Sci & Technol							Palko, Krzysztof Jakub/AAG-6104-2019	Palko, Krzysztof Jakub/0000-0001-8861-7950; Darowski, Marek/0000-0002-4681-6633; Stankiewicz, Barbara/0000-0002-0492-314X												2194-5357	2194-5365	978-3-319-66905-2				2018	647						68	83		10.1007/978-3-319-66905-2_6							WOS:000462742700006						
C	Venkatesan, M; Thangavelu, A; Prabhavathy, P		Bansal, JC; Singh, PK; Deep, K; Pant, M; Nagar, AK		Venkatesan, M.; Thangavelu, Arunkumar; Prabhavathy, P.			An Improved Bayesian Classification Data mining Method for Early Warning Landslide Susceptibility Model Using GIS	PROCEEDINGS OF SEVENTH INTERNATIONAL CONFERENCE ON BIO-INSPIRED COMPUTING: THEORIES AND APPLICATIONS (BIC-TA 2012), VOL 2	Advances in Intelligent Systems and Computing				7th International Conference on Bio-Inspired Computing: Theories and Applications (BIC-TA 2012)	DEC 14-16, 2012	ABV Indian Inst Informat Technol & Management Gwalior, Madhya Pradesh, INDIA		ABV Indian Inst Informat Technol & Management Gwalior							Thangavelu, Arunkumar/AAW-9523-2020	Thangavelu, Arunkumar/0000-0001-7384-8975; M, Venkatesan/0000-0002-1651-7093												2194-5357	2194-5365	978-81-322-1040-5				2013	202						277	+		10.1007/978-81-322-1041-2_24							WOS:000314999400024						
C	Aromaa, S; Leino, SP; Reyes-Lecuona, A; Frangakis, N; Berglund, J; Bosch, T; van Rhijn, G; Granholm, G		Trzcielinski, S		Aromaa, Susanna; Leino, Simo-Pekka; Reyes-Lecuona, Arcadio; Frangakis, Nikos; Berglund, Jonatan; Bosch, Tim; van Rhijn, Gu; Granholm, Goran			Digital Tools to Support Knowledge Sharing and Cooperation in High-Investment Product-Services	ADVANCES IN ERGONOMICS OF MANUFACTURING: MANAGING THE ENTERPRISE OF THE FUTURE	Advances in Intelligent Systems and Computing				AHFE International Conference on Human Aspects of Advanced Manufacturing	JUL 17-21, 2017	Los Angeles, CA									Reyes-Lecuona, Arcadio/M-7022-2014	Aromaa, Susanna/0000-0001-8843-496X; Reyes-Lecuona, Arcadio/0000-0002-3699-4065												2194-5357	2194-5365	978-3-319-60474-9; 978-3-319-60473-2				2018	606						235	246		10.1007/978-3-319-60474-9_22							WOS:000451451400022						
C	Alcalde, C; Burusco, A; Fuentes-Gonzalez, R		Bustince, H; Fernandez, J; Mesiar, R; Calco, T		Alcalde, C.; Burusco, A.; Fuentes-Gonzalez, R.			Application of OWA Operators in the L-Fuzzy Concept Analysis	AGGREGATION FUNCTIONS IN THEORY AND IN PRACTISE	Advances in Intelligent Systems and Computing				7th International Summer School on Aggregation Operators (AGOP 2013)	JUL 16-20, 2013	Publ Univ Navarra, Pamplona, SPAIN	Univ Publ Navarra, Vicerrectorado Proyecc Universitaria, Univ Publ Navarra, Vicerrectorado Investigac, Univ Publ Navarra, Escuela Tecn Superior Ingn Ind & Telecommunicac, Univ Publ Navarra, Dept Auomtat & Computac, European Soc Fuzzy Log & Technol, Ayuntamiento Pamplona, Apezteguia Architects	Publ Univ Navarra							Bustince, Humberto/H-4868-2011; Burusco, Ana/C-4762-2008	Bustince, Humberto/0000-0002-1279-6195; Burusco, Ana/0000-0003-4974-9488; Alcalde, Cristina/0000-0002-7888-8252												2194-5357	2194-5365	978-3-642-39164-4				2013	228						129	+		10.1007/978-3-642-39165-1_16							WOS:000323292300015						
C	Jindal, K; Baliyan, N; Rana, PS		Sa, PK; Bakshi, S; Hatzilygeroudis, IK; Sahoo, MN		Jindal, Kapil; Baliyan, Niyati; Rana, Prashant Singh			Obesity Prediction Using Ensemble Machine Learning Approaches	RECENT FINDINGS IN INTELLIGENT COMPUTING TECHNIQUES, VOL 2	Advances in Intelligent Systems and Computing				5th International Conference on Advanced Computing, Networking, and Informatics (ICACNI)	JUN 01-03, 2017	Natl Inst Technol Goa, Dept Comp Sci & Engn, Goa, INDIA	Natl Inst Technol Rourkela, Ctr Comp Vis & Pattern Recognit	Natl Inst Technol Goa, Dept Comp Sci & Engn																				2194-5357	2194-5365	978-981-10-8636-6; 978-981-10-8635-9				2018	708						355	362		10.1007/978-981-10-8636-6_37							WOS:000589263000037						
C	Kaur, M; Singh, B		Saeed, K; Chaki, N; Pati, B; Bakshi, S; Mohapatra, DP		Kaur, Manjot; Singh, Birinder			Implementation of SSVEP Technology to Develop Assistive Devices	PROGRESS IN ADVANCED COMPUTING AND INTELLIGENT ENGINEERING, VOL 2	Advances in Intelligent Systems and Computing				International Conference on Advanced Computing and Intelligent Engineering (ICACIE)	DEC 23-25, 2016	C.V. Raman Coll Engn, Bhubaneswar, INDIA	DRDO	C.V. Raman Coll Engn																				2194-5357	2194-5365	978-981-10-6875-1; 978-981-10-6874-4				2018	564						687	699		10.1007/978-981-10-6875-1_67							WOS:000452453900067						
C	Sharma, V; Alam, B; Doja, MN		Satapathy, SC; Raju, KS; Mandal, JK; Bhateja, V		Sharma, Vivek; Alam, Bashir; Doja, M. N.			Fuzzy-Based M-AODV Routing Protocol in MANETs	PROCEEDINGS OF THE SECOND INTERNATIONAL CONFERENCE ON COMPUTER AND COMMUNICATION TECHNOLOGIES, IC3T 2015, VOL 2	Advances in Intelligent Systems and Computing				2nd International Conference on Computer and Communication Technologies	JUL 24-26, 2015	CMR Tech Campus, Hyderabad, INDIA	CSI, Div V Educ & Res	CMR Tech Campus																				2194-5357	2194-5365	978-81-322-2523-2; 978-81-322-2522-5				2016	380						773	779		10.1007/978-81-322-2523-2_75							WOS:000378023800075						
C	Kuznetsov, VP; Romanovskaya, EV; Egorova, AO; Andryashina, NS; Kozlova, EP		Popkova, EG		Kuznetsov, Viktor P.; Romanovskaya, Elena, V; Egorova, Anastasia O.; Andryashina, Natalia S.; Kozlova, Elena P.			Approaches to Developing a New Product in the Car Building Industry	IMPACT OF INFORMATION ON MODERN HUMANS	Advances in Intelligent Systems and Computing				Scientific and Practical Conference on Humans as an Object of Study by Modern Science	NOV 23-24, 2017	Nizhny Novgorod, RUSSIA	Kozma Minin Nizhny Novgorod State Pedagog Univ, Inst Sci Commun								Andryashina, Nataliya/K-2486-2017; Romanovskaya, Elena/K-2794-2017; Anastasia, Egorova/F-3759-2017; Kozlova, Elena/J-3942-2017; Kuznetsov, Viktor/AAE-8174-2020	Andryashina, Nataliya/0000-0002-0236-4102; Romanovskaya, Elena/0000-0003-1111-0902; Anastasia, Egorova/0000-0002-2712-7197; Kozlova, Elena/0000-0003-3225-1405; Kuznetsov, Viktor/0000-0003-2039-6826												2194-5357	2194-5365	978-3-319-75383-6; 978-3-319-75382-9				2018	622						494	501		10.1007/978-3-319-75383-6_63							WOS:000570135200062						
C	Saumya, S; Kumar, J; Singh, JP		Chaki, R; Cortesi, A; Saeed, K; Chaki, N		Saumya, Sunil; Kumar, Jitendra; Singh, Jyoti Prakash			Genre Fraction Detection of a Movie Using Text Mining	ADVANCED COMPUTING AND SYSTEMS FOR SECURITY, VOL 5	Advances in Intelligent Systems and Computing				4th International Doctoral Symposium on Applied Computation and Security Systems (ACSS)	MAR 17-19, 2017	Patna, INDIA	Tata Consultancy Serv, Springer, ACM								Saumya, Sunil/AAY-6734-2021; Singh, Jyoti Prakash/I-4953-2016	Singh, Jyoti Prakash/0000-0002-3742-7484; Saumya, Sunil/0000-0002-9555-9434												2194-5357	2194-5365	978-981-10-8180-4; 978-981-10-8179-8				2018	666						167	177		10.1007/978-981-10-8180-4_11							WOS:000553804300011						
C	Wang, Q; Shen, L; Wang, ZY		Patnaik, S; Li, X		Wang, Qiong; Shen, Li; Wang, Zhiying			Research on Scale-Out Workloads and Optimal Design of Multicore Processors	PROCEEDINGS OF INTERNATIONAL CONFERENCE ON SOFT COMPUTING TECHNIQUES AND ENGINEERING APPLICATION, ICSCTEA 2013	Advances in Intelligent Systems and Computing				International Conference on Soft Computing Techniques and Engineering Application (ICSCTEA)	SEP 25-27, 2013	Kunming, PEOPLES R CHINA																						2194-5357	2194-5365	978-81-322-1695-7; 978-81-322-1694-0				2014	250						157	166		10.1007/978-81-322-1695-7_19							WOS:000342742500019						
C	Korobiichuk, I; Hryshchuk, R; Mamarev, V; Okhrimchuk, V; Kachniarz, M		Koscielny, JM; Syfert, M; Sztyber, A		Korobiichuk, Igor; Hryshchuk, Ruslan; Mamarev, Victor; Okhrimchuk, Volodymyr; Kachniarz, Maciej			Cyberattack Classificator Verification	ADVANCED SOLUTIONS IN DIAGNOSTICS AND FAULT TOLERANT CONTROL	Advances in Intelligent Systems and Computing				13th International Conference on Diagnostics of Processes and Systems (DPS)	SEP 10-13, 2017	Sandomierz, POLAND	Warsaw Univ Technol, Univ Zielona Gora, Gdansk Univ Technol, Warsaw Univ Technol, Fac Mechatron, Inst Automat Control & Robot, Polish Acad Sci, Comm Automat Control & Robot																					2194-5357	2194-5365	978-3-319-64474-5; 978-3-319-64473-8				2018	635						402	411		10.1007/978-3-319-64474-5_34							WOS:000456930300034						
C	Borgest, N; Korovin, M		Kobayashi, SY; Piegat, A; Pejas, J; ElFray, I; Kacprzyk, J		Borgest, Nikolay; Korovin, Maksim			Ontological Approach Towards Semantic Data Filtering in the Interface Design Applied to the Interface Design and Dialogue Creation for the "Robot-Aircraft Designer" Informational System	HARD AND SOFT COMPUTING FOR ARTIFICIAL INTELLIGENCE, MULTIMEDIA AND SECURITY	Advances in Intelligent Systems and Computing				20th Conference on Advanced Computer System (ACS)	OCT 19-21, 2016	Miedzyzdroje, POLAND	W Pomeranian Univ Technol, Fac Comp Sci & Informat Technol, Warsaw Univ Technol, Fac Math & Informat Sci, AGH Univ Sci & Technol, Fac Phys & Appl Comp Sci, Polish Acad Sci, Inst Comp Sci, Ehime Univ								Borgest, Nikolay M/I-8689-2014	Borgest, Nikolay M/0000-0003-2934-6198; Korovin, Maksim/0000-0002-2298-8457												2194-5357		978-3-319-48429-7; 978-3-319-48428-0				2017	534						93	101		10.1007/978-3-319-48429-7_9							WOS:000405325600009						
C	Khattab, D; Ebeid, HM; Hussein, AS; Tolba, MF		Hassanien, AE; Shaalan, K; Gaber, T; Azar, AT; Tolba, MF		Khattab, Dina; Ebeid, Hala M.; Hussein, Ashraf S.; Tolba, Mohamed F.			3D Mesh Segmentation Based on Unsupervised Clustering	PROCEEDINGS OF THE INTERNATIONAL CONFERENCE ON ADVANCED INTELLIGENT SYSTEMS AND INFORMATICS 2016	Advances in Intelligent Systems and Computing				2nd International Conference on Advanced Intelligent Systems and Informatics (AISI)	OCT 24-26, 2016	Cairo, EGYPT	Sci Res Grp Egypt, IEEE Computat Intelligence Soc, Egypt Chapter, IEEE Robot & Automat Soc, Egypt Chapter								Ebied, Hala M./O-7461-2016; Khattab, Dina/AAE-6485-2019; Hussein, Ashraf S/C-9329-2011; Khattab, Dina/AAC-4250-2021	Ebied, Hala M./0000-0001-9843-842X; Khattab, Dina/0000-0003-1201-1789												2194-5357	2194-5365	978-3-319-48308-5; 978-3-319-48307-8				2017	533						598	607		10.1007/978-3-319-48308-5_57							WOS:000398724000057						
C	Bhoi, SK; Panda, SK; Khilar, PM		Kumar, MA; Selvarani, R; Kumar, TVS		Bhoi, Sourav Kumar; Panda, Sanjaya Kumar; Khilar, Pabitra Mohan			A Density-Based Clustering Paradigm to Detect Faults in Wireless Sensor Network	PROCEEDINGS OF INTERNATIONAL CONFERENCE ON ADVANCES IN COMPUTING	Advances in Intelligent Systems and Computing				International Conference on Advances in Computing (ICAdC 2012)	JUL 04-06, 2012	M S Ramaiah Inst Technol, INDIA	M S Ramaiah Inst Technol, Informat Sci & Engn, M S Ramaiah Inst Technol, Comp Sci & Engn, M S Ramaiah Inst Technol, Comp Applicat	M S Ramaiah Inst Technol							Bhoi, Sourav Kumar/AAX-9796-2020; KHILAR, PABITRA M/I-5368-2018; Panda, Sanjaya Kumar/I-6124-2015	Bhoi, Sourav Kumar/0000-0002-5173-3453; KHILAR, PABITRA M/0000-0003-1969-2775; Panda, Sanjaya Kumar/0000-0003-3242-525X												2194-5357	2194-5365	978-81-322-0739-9; 978-81-322-0740-5				2013	174						865	871									WOS:000316088900103						
C	Yang, T; Peng, WF; Li, XR; Wang, YJ		Wen, Z; Li, T		Yang, Tan; Peng, Wanfen; Li, Xiangru; Wang, Yongjun			A Robust IHC Color Image Automatic Segmentation Algorithm	FOUNDATIONS OF INTELLIGENT SYSTEMS (ISKE 2013)	Advances in Intelligent Systems and Computing				8th International Conference on Intelligent Systems and Knowledge Engineering (ISKE)	NOV 20-23, 2013	Shenzhen, PEOPLES R CHINA	Shenzhen Univ, Sci China Press, Chinese Acad Sci, IEEE Computat Intelligence Soc, Chinese Assoc Artificial Intelligence, State Key Lab Complex Elect Syst Simulat, Sci & Technol Integrated Informat Syst Lab, SW Jiaotong Univ, Univ Technol																					2194-5357		978-3-642-54924-3; 978-3-642-54923-6				2014	277						319	328		10.1007/978-3-642-54924-3_30							WOS:000349457000030						
C	Biradar, M; Ahmed, M		Satapathy, SC; Bhateja, V; Udgata, SK; Pattnaik, PK		Biradar, Megha; Ahmed, Muzameel			Visual Based Information Retrieval Using Voronoi Tree	PROCEEDINGS OF THE 5TH INTERNATIONAL CONFERENCE ON FRONTIERS IN INTELLIGENT COMPUTING: THEORY AND APPLICATIONS, (FICTA 2016), VOL 2	Advances in Intelligent Systems and Computing				5th International Conference on Frontiers in Intelligent Computing - Theory and Applications (FICTA)	SEP 16-17, 2016	KIIT Univ, Sch Comp Engn, Bhubaneswar, INDIA		KIIT Univ, Sch Comp Engn																				2194-5357	2194-5365	978-981-10-3156-4; 978-981-10-3155-7				2017	516						603	609		10.1007/978-981-10-3156-4_64							WOS:000518098500064						
