PT	AU	BA	BE	GP	AF	BF	CA	TI	SO	SE	BS	LA	DT	CT	CY	CL	SP	HO	DE	ID	AB	C1	RP	EM	RI	OI	FU	FX	CR	NR	TC	Z9	U1	U2	PU	PI	PA	SN	EI	BN	J9	JI	PD	PY	VL	IS	PN	SU	SI	MA	BP	EP	AR	DI	D2	EA	PG	WC	SC	GA	UT	PM	OA	HC	HP	DA
C	Liu, W; Ding, HT; Guo, KH		Du, ZY		Liu Wei; Ding Haitao; Guo Konghui			Research on ESC Hydraulic Control Unit Property and Pressure Estimation	INTELLIGENCE COMPUTATION AND EVOLUTIONARY COMPUTATION	Advances in Intelligent Systems and Computing				International Conference of Intelligence Computation and Evolutionary Computation (ICEC 2012)	JUL 07, 2012	Wuhan, PEOPLES R CHINA	Informat Technol & Ind Engn Res Ctr																					2194-5357		978-3-642-31655-5				2013	180						625	631									WOS:000316302700086						
C	Ronnback, S		Merdan, M; Lepuschitz, W; Koppensteiner, G; Balogh, R		Ronnback, Sven			Using Modern Software and the ICE Approach When Teaching University Students Modelling in Robotics	ROBOTICS IN EDUCATION: RESEARCH AND PRACTICES FOR ROBOTICS IN STEM EDUCATION	Advances in Intelligent Systems and Computing				7th International Conference on Robotics in Education (RiE)	APR 14-15, 2016	Vienna, AUSTRIA																						2194-5357		978-3-319-42975-5; 978-3-319-42974-8				2017	457						63	68		10.1007/978-3-319-42975-5_6							WOS:000401107000006						
C	Ahmad, T; Firmansyah, DM; Angreni, DS		Herawan, T; Ghazali, R; Nawi, NM; Deris, MM		Ahmad, Tohari; Firmansyah, Diksy M.; Angreni, Dwi S.			Difference Expansion-Based Data Hiding Method by Changing Expansion Media	RECENT ADVANCES ON SOFT COMPUTING AND DATA MINING	Advances in Intelligent Systems and Computing				2nd International Conference on Soft Computing and Data Mining (SCDM)	AUG 18-20, 2016	Bandung, INDONESIA									Ahmad, Tohari/R-6569-2019; Cleaton-Jones, Peter E/L-4090-2016	Ahmad, Tohari/0000-0002-3390-0756; Angreni, Dwi Shinta/0000-0002-2517-0132												2194-5357	2194-5365	978-3-319-51281-5; 978-3-319-51279-2				2017	549						414	423		10.1007/978-3-319-51281-5_42							WOS:000416517100042						
C	Anandhi, RJ; Natarajan, S		Babu, BV; Nagar, A; Deep, K; Pant, M; Bansal, JC; Ray, K; Gupta, U		Anandhi, R. J.; Natarajan, S.			Privacy Protected Mining Using Heuristic Based Inherent Voting Spatial Cluster Ensembles	PROCEEDINGS OF THE SECOND INTERNATIONAL CONFERENCE ON SOFT COMPUTING FOR PROBLEM SOLVING (SOCPROS 2012)	Advances in Intelligent Systems and Computing				2nd International Conference on Soft Computing for Problem Solving (SocProS)	DEC 28-30, 2012	JK Lakshmipat Univ, Jaipur, INDIA	JK Lakshmipat Univ, Inst Engn & Technol	JK Lakshmipat Univ							J, Anandhi R/ABE-5662-2020; Subramanyam, Natarajan/B-8986-2019	J, Anandhi R/0000-0002-0117-0912; 												2194-5357	2194-5365	978-81-322-1602-5; 978-81-322-1601-8				2014	236						1183	1193		10.1007/978-81-322-1602-5_124							WOS:000337801800124						
C	Klein, LF; Rigo, SJ; Cazella, SC; Ben, AJ		Lindgren, H; DePaz, JF; Novais, P; FernandezCaballero, A; Yoe, H; Ramirez, AJ; Villarrubia, G		Klein, Lucas Felipe; Rigo, Sandro Jose; Cazella, Silvio Cesar; Ben, Angela Jornada			An Application for Mobile Devices Focused on Clinical Decision Support: Diabetes Mellitus Case	AMBIENT INTELLIGENCE - SOFTWARE AND APPLICATIONS (ISAMI 2016)	Advances in Intelligent Systems and Computing				7th International Symposium on Ambient Intelligence (ISAmI)	JUN 01-03, 2016	Univ Seville, Seville, SPAIN	IEEE Secc Espana, CNRS, AFIA, AEPIA, APPIA, AI*IA, Junta Castilla Leon, IBM, Escuela Tecnica Super Ingn Informatica, Umea Univ, Univ Minho, Inst Educacao, Indra, Fidetia, IEEE Syst Man& Cybernet Soc	Univ Seville							Cazella, Silvio Cesar/A-5278-2017	Cazella, Silvio/0000-0003-2343-893X; Jornada Ben, Angela/0000-0003-4793-9026; Rigo, Sandro Jose/0000-0001-8140-5621												2194-5357		978-3-319-40114-0; 978-3-319-40113-3				2016	476						57	65		10.1007/978-3-319-40114-0_7							WOS:000382645900007						
C	Polhill, G; Milazzo, L; Dawson, T; Gimona, A; Parker, D		Jager, W; Verbrugge, R; Flache, A; DeRoo, G; Hoogduin, L; Hemelrijk, C		Polhill, Gary; Milazzo, Lorenzo; Dawson, Terry; Gimona, Alessandro; Parker, Dawn			Lessons Learned Replicating the Analysis of Outputs from a Social Simulation of Biodiversity Incentivisation	ADVANCES IN SOCIAL SIMULATION 2015	Advances in Intelligent Systems and Computing				11th Annual Social Simulation Conference	SEP 14-18, 2015	Groningen Ctr Social Complex Studies, Groningen, NETHERLANDS		Groningen Ctr Social Complex Studies							Polhill, Gary/S-5400-2016; Dawson, Terence Peter/E-4724-2011; Milazzo, Lorenzo/A-7996-2013	Polhill, Gary/0000-0002-8596-0590; Dawson, Terence Peter/0000-0002-4314-1378; Milazzo, Lorenzo/0000-0002-9451-8964												2194-5357	2194-5365	978-3-319-47253-9; 978-3-319-47252-2				2017	528						355	365		10.1007/978-3-319-47253-9_32							WOS:000418582900032						
C	Hadinata, E; Sembiring, RW; Kusumasari, TF; Herawan, T		Herawan, T; Ghazali, R; Nawi, NM; Deris, MM		Hadinata, Edrian; Sembiring, Rahmat W.; Kusumasari, Tien Fabrianti; Herawan, Tutut			The Algorithm Expansion for Starting Point Determination Using Clustering Algorithm Method with Fuzzy C-Means	RECENT ADVANCES ON SOFT COMPUTING AND DATA MINING	Advances in Intelligent Systems and Computing				2nd International Conference on Soft Computing and Data Mining (SCDM)	AUG 18-20, 2016	Bandung, INDONESIA									Herawan, Tutut/AAB-6534-2021; Kusumasari, Tien Fabrianti/AAH-6137-2020	Herawan, Tutut/0000-0001-9262-9137; Sembiring, Ph.D, Rahmat Widia/0000-0003-4321-9451; Kusumasari, Tien/0000-0002-1016-4522												2194-5357	2194-5365	978-3-319-51281-5; 978-3-319-51279-2				2017	549						506	516		10.1007/978-3-319-51281-5_51							WOS:000416517100051						
C	Xiong, XL; Xiang, XM		Sun, H; Yang, CY; Lin, CW; Pan, JS; Snasel, V; Abraham, A		Xiong, XiaoLin; Xiang, XinMing			Command Center Operation Miss Root Cause Analysis	GENETIC AND EVOLUTIONARY COMPUTING	Advances in Intelligent Systems and Computing				8th International Conference on Genetic and Evolutionary Computing (ICGEC)	OCT 18-20, 2014	Nanchang Inst Technol, Nanchang, PEOPLES R CHINA	National Kaohsiung Univ Appl Sci, VSB Tech Univ Ostrava, Sping	Nanchang Inst Technol																				2194-5357		978-3-319-12285-4				2015	329						59	65		10.1007/978-3-319-12286-1_7							WOS:000360095800007						
C	Biswas, PP; Suganthan, PN; Amaratunga, GAJ		Deep, K; Bansal, JC; Das, KN; Lal, AK; Garg, H; Nagar, AK; Pant, M		Biswas, Partha P.; Suganthan, P. N.; Amaratunga, Gehan A. J.			Optimization of Wind Turbine Rotor Diameters and Hub Heights in a Windfarm Using Differential Evolution Algorithm	PROCEEDINGS OF SIXTH INTERNATIONAL CONFERENCE ON SOFT COMPUTING FOR PROBLEM SOLVING, SOCPROS 2016, VOL 2	Advances in Intelligent Systems and Computing				6th International Conference on Soft Computing for Problem Solving (SocProS)	DEC 23-24, 2016	Thapar Univ, Sch Math, Patiala, INDIA	Liverpool Hope Univ, Soft Comp Res Soc	Thapar Univ, Sch Math							Suganthan, .Ponnuthurai N/A-5023-2011	Suganthan, .Ponnuthurai N/0000-0003-0901-5105												2194-5357	2194-5365	978-981-10-3325-4; 978-981-10-3324-7				2017	547						131	141		10.1007/978-981-10-3325-4_13							WOS:000426127900013						
C	Pokorny, P; Jarosova, Z		Silhavy, R; Silhavy, P; Prokopova, Z; Senkerik, R; Oplatkova, ZK		Pokorny, Pavel; Jarosova, Zuzana			The Lukov Castle - A Historical 3D Visualization in Different Time Periods	SOFTWARE ENGINEERING TRENDS AND TECHNIQUES IN INTELLIGENT SYSTEMS, CSOC2017, VOL 3	Advances in Intelligent Systems and Computing				6th Computer Science On-Line Conference (CSOC)	APR, 2017	Zlin, CZECH REPUBLIC	OpenPublish eu s r o																					2194-5357		978-3-319-57141-6				2017	575						299	308		10.1007/978-3-319-57141-6_32							WOS:000405338500032						
C	Szewczyk, RL; Ratomska, M; Jaskiewicz, M		Hunek, WP; Paszkiel, S		Szewczyk, Rafal Lukasz; Ratomska, Marta; Jaskiewicz, Marta			The Neglected Problem of the Neurofeedback Learning (In)Ability	BIOMEDICAL ENGINEERING AND NEUROSCIENCE	Advances in Intelligent Systems and Computing				3rd International Scientific Conference on Brain-Computer Interfaces (BCI)	MAR 13-14, 2018	Opole Univ Technol, Opole, POLAND	Opole Univ Technol, Fac Elect Engn, Automat Control & Informat, Polish Acad Sci, Commiss Metrol, Branch Katowice	Opole Univ Technol																				2194-5357	2194-5365	978-3-319-75025-5; 978-3-319-75024-8				2018	720						45	58		10.1007/978-3-319-75025-5_6							WOS:000455233100006						
C	Sato, A		Goonetilleke, R; Karwowski, W		Sato, Ayanori			The Effect of Speaking Aloud on Prospective Memory Performance in an Interrupted Situation	ADVANCES IN PHYSICAL ERGONOMICS AND HUMAN FACTORS	Advances in Intelligent Systems and Computing				International Conference on Physical Ergonomics and Human Factors	JUL 27-31, 2016	FL																						2194-5357		978-3-319-41694-6; 978-3-319-41693-9				2016	489						921	930		10.1007/978-3-319-41694-6_88							WOS:000389642400088						
C	Chung, YN; Hu, YJ; Tsai, XZ; Hsu, CH; Lai, CW		Lin, JCW; Pan, JS; Chu, SC; Chen, CM		Chung, Yi-Nung; Hu, Yun-Jhong; Tsai, Xian-Zhi; Hsu, Chao-Hsing; Lai, Chien-Wen			Applying Image Processing Technology to Region Area Estimation	GENETIC AND EVOLUTIONARY COMPUTING	Advances in Intelligent Systems and Computing				11th International Conference on Genetic and Evolutionary Computing (ICGEC)	NOV 06-08, 2017	Fujian Univ Technol, Kaohsiung, TAIWAN	Springer, Fujian Univ Technol, Fujian Provincial Key Lab Big Data Mining & Applicat, Natl Univ Kaohsiung, Harbin Inst Technol, Natl Kaohsiung Univ Appl Sci, VSB Tech Univ Ostrava	Fujian Univ Technol																				2194-5357	2194-5365	978-981-10-6487-6; 978-981-10-6486-9				2018	579						77	83		10.1007/978-981-10-6487-6_10							WOS:000577963500010						
C	Borysiuk, Z; Konieczny, M; Krecisz, K; Pakosz, P		Hunek, WP; Paszkiel, S		Borysiuk, Zbigniew; Konieczny, Mariusz; Krecisz, Krzysztof; Pakosz, Pawel			Application of sEMG and Posturography as Tools in the Analysis of Biosignals of Aging Process of Subjects in the Post-production Age	BIOMEDICAL ENGINEERING AND NEUROSCIENCE	Advances in Intelligent Systems and Computing				3rd International Scientific Conference on Brain-Computer Interfaces (BCI)	MAR 13-14, 2018	Opole Univ Technol, Opole, POLAND	Opole Univ Technol, Fac Elect Engn, Automat Control & Informat, Polish Acad Sci, Commiss Metrol, Branch Katowice	Opole Univ Technol							Pakosz, Pawel/M-6730-2019; Konieczny, Mariusz/AAT-7384-2020; Krecisz, Krzysztof/E-7246-2018	Pakosz, Pawel/0000-0002-5754-3298; Konieczny, Mariusz/0000-0001-7995-0882; Krecisz, Krzysztof/0000-0003-2802-981X; Borysiuk, Zbigniew/0000-0002-1775-9270												2194-5357	2194-5365	978-3-319-75025-5; 978-3-319-75024-8				2018	720						23	29		10.1007/978-3-319-75025-5_3							WOS:000455233100003						
C	Banawi, A		Charytonowicz, J		Banawi, Abdulaziz			Barriers to Implement Building Information Modeling (BIM) in Public Projects in Saudi Arabia	ADVANCES IN HUMAN FACTORS, SUSTAINABLE URBAN PLANNING AND INFRASTRUCTURE (AHFE 2017)	Advances in Intelligent Systems and Computing				8th International Conference on Applied Human Factors and Ergonomics (AHFE) / International Conference on Human Factors, Sustainable Urban Planning and Infrastructure	JUL 17-21, 2017	Los Angeles, CA																						2194-5357	2194-5365	978-3-319-60450-3; 978-3-319-60449-7				2018	600						119	125		10.1007/978-3-319-60450-3_12							WOS:000465822600012						
C	Sivagurunathan, S; Prathapchandran, K		Senthilkumar, M; Ramasamy, V; Sheen, S; Veeramani, C; Bonato, A; Batten, L		Sivagurunathan, S.; Prathapchandran, K.			A Centralized Trust Computation (CTC) Model for Secure Group Formation in Military Based Mobile Ad Hoc Networks Using Stereotypes	COMPUTATIONAL INTELLIGENCE, CYBER SECURITY AND COMPUTATIONAL MODELS, ICC3 2015	Advances in Intelligent Systems and Computing				2nd International Conference on Computational Intelligence, Cyber Security and Computational Models (ICC3)	DEC 17-19, 2015	Coimbatore, INDIA	PSG Coll Technol, Dept Appl Math & Computat Sci								Kannimuthu, Prathapchandran/Z-3679-2019	Kannimuthu, Prathapchandran/0000-0002-5125-1972												2194-5357	2194-5365	978-981-10-0251-9; 978-981-10-0250-2				2016	412						427	438		10.1007/978-981-10-0251-9_40							WOS:000369722400040						
C	Wenninger, S; Lames, M		Chung, P; Soltoggio, A; Dawson, CW; Meng, Q; Pain, M		Wenninger, Sebastian; Lames, Martin			Markov Simulation by Numerical Derivation in Table Tennis	PROCEEDINGS OF THE 10TH INTERNATIONAL SYMPOSIUM ON COMPUTER SCIENCE IN SPORTS (ISCSS)	Advances in Intelligent Systems and Computing				10th International Symposium on Computer Science in Sports (ISCSS)	SEP 09-11, 2015	Loughborough, ENGLAND	Int Assoc Comp Sci Sport, Int Soc Sport Psychol																					2194-5357		978-3-319-24560-7; 978-3-319-24558-4				2016	392						161	169		10.1007/978-3-319-24560-7_21							WOS:000381878700021						
C	Montero, CS; Jormanainen, I		Alimisis, D; Moro, M; Menegatti, E		Montero, Calkin Suero; Jormanainen, Ilkka			Theater Meets Robot - Toward Inclusive STEAM Education	EDUCATIONAL ROBOTICS IN THE MAKERS ERA	Advances in Intelligent Systems and Computing				International Conference on Educational Robotics (EDUROBOTICS)	NOV 25, 2016	Athens, GREECE	EDUMOTIVA, Univ Padua, Dept Informat Engn, INNOVATHENS																					2194-5357	2194-5365	978-3-319-55553-9; 978-3-319-55552-2				2017	560						34	40		10.1007/978-3-319-55553-9_3							WOS:000418793600003						
C	Yao, L; Chen, ZC; Yang, JJ		Wen, Z; Li, T		Yao, Lu; Chen, Zhi-Cheng; Yang, Jian-Jun			Research on Risk Assessment of Ship Repair Based on Case-Based Reasoning	KNOWLEDGE ENGINEERING AND MANAGEMENT , ISKE 2013	Advances in Intelligent Systems and Computing				8th International Conference on Intelligent Systems and Knowledge Engineering (ISKE)	NOV 20-23, 2013	Shenzhen, PEOPLES R CHINA	Shenzhen Univ, Sci China Press, Chinese Acad Sci, IEEE Computat Intelligence Soc, Chinese Assoc Artificial Intelligence, State Key Lab Complex Elect Syst Simulat, Sci & Technol Integrated Informat Syst Lab, SW Jiaotong Univ, Univ Technol																					2194-5357	2194-5365	978-3-642-54930-4; 978-3-642-54929-8				2014	278						53	59		10.1007/978-3-642-54930-4_6							WOS:000342922200006						
C	Peng, ZD; Lai, J		Lin, JCW; Pan, JS; Chu, SC; Chen, CM		Peng, Zhengdao; Lai, Jean			Commonsense-Knowledge Based Inference Engine	GENETIC AND EVOLUTIONARY COMPUTING	Advances in Intelligent Systems and Computing				11th International Conference on Genetic and Evolutionary Computing (ICGEC)	NOV 06-08, 2017	Fujian Univ Technol, Kaohsiung, TAIWAN	Springer, Fujian Univ Technol, Fujian Provincial Key Lab Big Data Mining & Applicat, Natl Univ Kaohsiung, Harbin Inst Technol, Natl Kaohsiung Univ Appl Sci, VSB Tech Univ Ostrava	Fujian Univ Technol																				2194-5357	2194-5365	978-981-10-6487-6; 978-981-10-6486-9				2018	579						128	135		10.1007/978-981-10-6487-6_16							WOS:000577963500016						
C	Xie, JC		Pan, JS; Lin, JCW; Wang, CH; Jiang, XH		Xie, Jing-Chen			A Study of Micro-film Creation: Using the Inspirational Story of a Tomato Farm Micro-film	GENETIC AND EVOLUTIONARY COMPUTING	Advances in Intelligent Systems and Computing				10th International Conference on Genetic and Evolutionary Computing (ICGEC)	NOV 07-09, 2016	Fujian Univ Technol, Fuzhou, PEOPLES R CHINA	Springer, Univ Comp Studies, Univ Miyazaki, Kaohsiung Univ Appl Sci, Tech Univ Ostrava, Taiwan Assoc Web Intelligence Consortium, Immers Co Ltd	Fujian Univ Technol																				2194-5357		978-3-319-48490-7; 978-3-319-48489-1				2017	536						80	86		10.1007/978-3-319-48490-7_10							WOS:000405229700010						
C	Sujatha, P; Purushothaman, S; Rajeswari, R		Sathiakumar, S; Awasthi, LK; Masillamani, MR; Sridhar, SS		Sujatha, P.; Purushothaman, S.; Rajeswari, R.			Performance Study of Combined Artificial Neural Network Algorithms for Image Steganalysis	PROCEEDINGS OF INTERNATIONAL CONFERENCE ON INTERNET COMPUTING AND INFORMATION COMMUNICATIONS (ICICIC GLOBAL 2012)	Advances in Intelligent Systems and Computing				1st International Conference on Internet Computing and Information Communications (ICICIC)	FEB 12-14, 2012	Chennai, INDIA	ICICIC Global, SCBIT									pothula, sujatha/0000-0003-3859-1929												2194-5357	2194-5365	978-81-322-1298-0; 978-81-322-1299-7				2014	216						441	451		10.1007/978-81-322-1299-7_41							WOS:000328352200041						
C	Kumari, K; Nanda, SJ; Maddila, RK		Deep, K; Bansal, JC; Das, KN; Lal, AK; Garg, H; Nagar, AK; Pant, M		Kumari, Kaushlya; Nanda, Satyasai Jagannath; Maddila, Ravi Kumar			Optimal Path Determination in a Survivable Virtual Topology of an Optical Network Using Ant Colony Optimization	PROCEEDINGS OF SIXTH INTERNATIONAL CONFERENCE ON SOFT COMPUTING FOR PROBLEM SOLVING, SOCPROS 2016, VOL 2	Advances in Intelligent Systems and Computing				6th International Conference on Soft Computing for Problem Solving (SocProS)	DEC 23-24, 2016	Thapar Univ, Sch Math, Patiala, INDIA	Liverpool Hope Univ, Soft Comp Res Soc	Thapar Univ, Sch Math							Nanda, Satyasai Jagannath/N-5095-2017; Maddila, Ravi K/C-5229-2008	Nanda, Satyasai Jagannath/0000-0002-4005-5589; Maddila, Ravi K/0000-0002-9918-393X												2194-5357	2194-5365	978-981-10-3325-4; 978-981-10-3324-7				2017	547						48	58		10.1007/978-981-10-3325-4_6							WOS:000426127900006						
C	Rogozov, Y		Abraham, A; Kovalev, S; Tarassov, V; Snasel, V; Vasileva, M; Sukhanov, A		Rogozov, Y.			Approach to the Construction of a Systemic Concept	PROCEEDINGS OF THE SECOND INTERNATIONAL SCIENTIFIC CONFERENCE INTELLIGENT INFORMATION TECHNOLOGIES FOR INDUSTRY (IITI'17), VOL 1	Advances in Intelligent Systems and Computing				2nd International Scientific Conference on Intelligent Information Technologies for Industry (IITI)	SEP 14-16, 2017	Varna, BULGARIA	Tech Univ Varna, Tech Univ Sofia, VSB Tech Univ Ostrava, Rostov State Transport Univ																					2194-5357	2194-5365	978-3-319-68321-8				2018	679						429	438		10.1007/978-3-319-68321-8_44							WOS:000585070600044						
C	Albers, A; Bursac, N; Heimicke, J; Walter, B; Reiss, N		Auer, ME; Guralnick, D; Simonics, I		Albers, Albert; Bursac, Nikola; Heimicke, Jonas; Walter, Benjamin; Reiss, Nicolas			20 Years of Co-creation Using Case Based Learning An Integrated Approach for Teaching Innovation and Research in Product Generation Engineering	TEACHING AND LEARNING IN A DIGITAL WORLD	Advances in Intelligent Systems and Computing				20th International Conference on Interactive Collaborative Learning (ICL) - Teaching and Learning in a Digital World	SEP 27-29, 2017	Budapest, HUNGARY										Albers, Albert/0000-0001-5432-704X; Heimicke, Jonas/0000-0002-6381-2618												2194-5357	2194-5365	978-3-319-73204-6; 978-3-319-73203-9				2018	716						636	647		10.1007/978-3-319-73204-6_69							WOS:000546474900069						
C	Joyo, MK; Ahmed, SF; Abu Bakar, MI; Ali, A		Mishra, DK; Azar, AT; Joshi, A		Joyo, M. Kamran; Ahmed, Syed Faiz; Abu Bakar, Mohd Izhar; Ali, Athar			Horizontal Motion Control of Underactuated Quadrotor Under Disturbed and Noisy Circumstances	INFORMATION AND COMMUNICATION TECHNOLOGY (ICICT 2016)	Advances in Intelligent Systems and Computing				2nd International Congress on Information and Communication Technology (ICICT)	DEC 12-13, 2016	Bangkok, THAILAND	G R Fdn, Comp Soc India Div IV Commun & Div V Educ & Res								Ali, Athar/AAG-5366-2021; Ali, Athar/I-9023-2018	Ali, Athar/0000-0002-5936-447X; Ali, Athar/0000-0002-5936-447X; Joyo, M. Kamran/0000-0001-6397-648X												2194-5357	2194-5365	978-981-10-5508-9; 978-981-10-5507-2				2018	625						63	79		10.1007/978-981-10-5508-9_6							WOS:000448462400006						
C	Bayat, A		Kantola, JI; Barath, T; Nazir, S; Andre, T		Bayat, Ashkan			City Branding and the Way It Is Perceived in People's Mind, a Case Study of Milad Tower in Iran	ADVANCES IN HUMAN FACTORS, BUSINESS MANAGEMENT, TRAINING AND EDUCATION	Advances in Intelligent Systems and Computing				International Conference on Human Factors, Business Management and Society	JUL 27-31, 2016	FL																						2194-5357	2194-5365	978-3-319-42070-7; 978-3-319-42069-1				2017	498						601	607		10.1007/978-3-319-42070-7_56							WOS:000390893100056						
C	Thomas, A; Oommen, BJ		Burduk, R; Jackowski, K; Kurzynski, M; Wozniak, M; Zolnierek, A		Thomas, A.; Oommen, B. John			Classification of Multi-dimensional Distributions Using Order Statistics Criteria	PROCEEDINGS OF THE 8TH INTERNATIONAL CONFERENCE ON COMPUTER RECOGNITION SYSTEMS CORES 2013	Advances in Intelligent Systems and Computing				8th International Conference on Computer Recognition Systems (CORES)	MAY 25-27, 2013	Wroclaw, POLAND									Oommen, B. John/P-6323-2017	Oommen, B. John/0000-0002-5105-1575												2194-5357		978-3-319-00969-8; 978-3-319-00968-1				2013	226						19	29		10.1007/978-3-319-00969-8_2							WOS:000354284200002						
C	Lidynia, C; Brauner, P; Ziefle, M		Ahram, T; Falcao, C		Lidynia, Chantal; Brauner, Philipp; Ziefle, Martina			A Step in the Right Direction - Understanding Privacy Concerns and Perceived Sensitivity of Fitness Trackers	ADVANCES IN HUMAN FACTORS IN WEARABLE TECHNOLOGIES AND GAME DESIGN (AHFE 2017)	Advances in Intelligent Systems and Computing				8th International Conference on Applied Human Factors and Ergonomics / International Conferences on Human Factors and Wearable Technologies, and Human Factors in Game Design	JUL 17-21, 2017	Los Angeles, CA									Brauner, Philipp/AAH-1500-2020; Brauner, Philipp/H-5038-2017	Brauner, Philipp/0000-0003-2837-5181; Brauner, Philipp/0000-0003-2837-5181; Lidynia, Chantal/0000-0003-4539-2119												2194-5357	2194-5365	978-3-319-60639-2; 978-3-319-60638-5				2018	608						42	53		10.1007/978-3-319-60639-2_5							WOS:000465822700005						
C	Rashid, U; Awan, FG; Kamran, M		Latifi, S		Rashid, Umar; Awan, Faheem Gohar; Kamran, Muhammad			SINR Maximization in Relay-Assisted Multi-user Wireless Networks	INFORMATION TECHNOLOGY: NEW GENERATIONS	Advances in Intelligent Systems and Computing				13th International Conference on Information Technology - New Generations (ITNG)	APR 11-13, 2016	Las Vegas, NV																						2194-5357		978-3-319-32467-8; 978-3-319-32466-1				2016	448						83	90		10.1007/978-3-319-32467-8_8							WOS:000385289400008						
C	Xue, XS; Tsai, PW; Zhang, LL		Pan, JS; Lin, JCW; Wang, CH; Jiang, XH		Xue, Xingsi; Tsai, Pei-Wei; Zhang, Li-Li			Using Parallel Compact Evolutionary Algorithm for Optimizing Ontology Alignment	GENETIC AND EVOLUTIONARY COMPUTING	Advances in Intelligent Systems and Computing				10th International Conference on Genetic and Evolutionary Computing (ICGEC)	NOV 07-09, 2016	Fujian Univ Technol, Fuzhou, PEOPLES R CHINA	Springer, Univ Comp Studies, Univ Miyazaki, Kaohsiung Univ Appl Sci, Tech Univ Ostrava, Taiwan Assoc Web Intelligence Consortium, Immers Co Ltd	Fujian Univ Technol							Tsai, Pei-Wei/F-1948-2018	Tsai, Pei-Wei/0000-0002-9429-8957												2194-5357	2194-5365	978-3-319-48490-7; 978-3-319-48489-1				2017	536						157	165		10.1007/978-3-319-48490-7_19							WOS:000405229700019						
C	Bauer, W; Vocke, C		Goonetilleke, R; Karwowski, W		Bauer, Wilhelm; Vocke, Christian			Implications of Sedentary Lifestyle for Designing Dynamic Work in Times of Digital Selfness	ADVANCES IN PHYSICAL ERGONOMICS AND HUMAN FACTORS	Advances in Intelligent Systems and Computing				International Conference on Physical Ergonomics and Human Factors	JUL 27-31, 2016	FL																						2194-5357		978-3-319-41694-6; 978-3-319-41693-9				2016	489						675	685		10.1007/978-3-319-41694-6_65							WOS:000389642400065						
C	Rybarczyk, D; Milecki, A		Szewczyk, R; Zielinski, C; Kaliczynska, M		Rybarczyk, Dominik; Milecki, Andrzej			The Design and Application of Wireless 3D Tool for Offline Programming of Soldering Robot	AUTOMATION 2018: ADVANCES IN AUTOMATION, ROBOTICS AND MEASUREMENT TECHNIQUES	Advances in Intelligent Systems and Computing				International Conference on Automation	MAR 21-23, 2018	Warsaw, POLAND									Milecki, A./H-6742-2014	Milecki, A./0000-0001-5513-4864; Rybarczyk, Dominik/0000-0002-6715-5045												2194-5357	2194-5365	978-3-319-77179-3; 978-3-319-77178-6				2018	743						453	461		10.1007/978-3-319-77179-3_42							WOS:000462745200042						
C	Gahlawat, M; Sharma, P		Satapathy, SC; Joshi, A; Modi, N; Pathak, N		Gahlawat, Monica; Sharma, Priyanka			Support Vector Machine-Based Model for Host Overload Detection in Clouds	PROCEEDINGS OF INTERNATIONAL CONFERENCE ON ICT FOR SUSTAINABLE DEVELOPMENT, ICT4SD 2015, VOL 1	Advances in Intelligent Systems and Computing				International Conference on Information and Communication Technology for Sustainable Development (ICT4SD)	JUL 03-04, 2015	Ahmedabad, INDIA	ASSOCHAM Gujarat Chapter, ACM Profess Chapter, GESIA, Sabar Inst Technol								Gahlawat, Monica/AAF-1426-2019; Gahlawat, Monica/AAE-1039-2021	Gahlawat, Monica/0000-0002-7415-9730												2194-5357	2194-5365	978-981-10-0129-1; 978-981-10-0127-7				2016	408						369	376		10.1007/978-981-10-0129-1_39							WOS:000372056300039						
C	Abdullah, FS; Abd Manan, NS; Ahmad, A; Wafa, SW; Shahril, MR; Zulaily, N; Amin, RM; Ahmed, A		Herawan, T; Ghazali, R; Nawi, NM; Deris, MM		Abdullah, Fadzli Syed; Abd Manan, Nor Saidah; Ahmad, Aryati; Wafa, Sharifah Wajihah; Shahril, Mohd Razif; Zulaily, Nurzaime; Amin, Rahmah Mohd; Ahmed, Amran			Data Mining Techniques for Classification of Childhood Obesity Among Year 6 School Children	RECENT ADVANCES ON SOFT COMPUTING AND DATA MINING	Advances in Intelligent Systems and Computing				2nd International Conference on Soft Computing and Data Mining (SCDM)	AUG 18-20, 2016	Bandung, INDONESIA									Shahril, Mohd Razif/K-7320-2015	Shahril, Mohd Razif/0000-0002-8680-3087; Syed Saadun Tarek Wafa, Sharifah Wajihah Wafa/0000-0002-1791-2714												2194-5357	2194-5365	978-3-319-51281-5; 978-3-319-51279-2				2017	549						465	474		10.1007/978-3-319-51281-5_47							WOS:000416517100047						
