PT	AU	BA	BE	GP	AF	BF	CA	TI	SO	SE	BS	LA	DT	CT	CY	CL	SP	HO	DE	ID	AB	C1	RP	EM	RI	OI	FU	FX	CR	NR	TC	Z9	U1	U2	PU	PI	PA	SN	EI	BN	J9	JI	PD	PY	VL	IS	PN	SU	SI	MA	BP	EP	AR	DI	D2	EA	PG	WC	SC	GA	UT	PM	OA	HC	HP	DA
C	Chovanec, M; Milanova, J; Cechovic, L; Sarafin, P; Hudik, M; Kochlan, M		Grzenda, M; Awad, AI; Furtak, J; Legierski, J		Chovanec, Michal; Milanova, Jana; Cechovic, Lukas; Sarafin, Peter; Hudik, Martin; Kochlan, Michal			Firefly-Based Universal Synchronization Algorithm in Wireless Sensor Network	ADVANCES IN NETWORK SYSTEMS: ARCHITECTURES, SECURITY, AND APPLICATIONS	Advances in Intelligent Systems and Computing				3rd International Conference on Innovative Network Systems and Applications (iNetSApp) held in conjunction with Federated Conference on Computer Science and Information Systems (FedCSIS)	SEP 13-16, 2015	Technical Univ Lodz, Lodz, POLAND	IEEE Comp Soc, Polish Informat Proc Soc, IEEE Reg 8, IEEE Poland Sect Comp Soc Chapter, IEEE Poland Gdansk Sect Comp Soc Chapter, IEEE CIS Poland Sect Chapter, ACM Special Interest Grp Applied Comp, ACM Lodz Chapter, European Alliance Innovat, Polish Acad Sci, Comm Comp Sci, Polish Operat & Syst Res Soc, Eastern Cluster ICT Poland, Mazovia Cluster ICT	Technical Univ Lodz																				2194-5357	2194-5365	978-3-319-44354-6; 978-3-319-44352-2				2017	461						71	86		10.1007/978-3-319-44354-6_5							WOS:000455643800005						
C	Kandl, S		Selvaraj, H; Zydek, D; Chmaj, G		Kandl, Susanne			Cost Effectiveness of Coverage-Guided Test-Suite Reduction for Safety-Relevant Systems	PROGRESS IN SYSTEMS ENGINEERING	Advances in Intelligent Systems and Computing				23rd International Conference on Systems Engineering	AUG 19-21, 2014	Las Vegas, NV	Univ Nevada Las Vegas, ALDEC, NVEnergy																					2194-5357		978-3-319-08421-3				2015	366						595	601		10.1007/978-3-319-08422-0_84							WOS:000360214900084						
C	Idrus, A; Mahmoud, MA; Ahmad, MS; Yahya, A; Husen, H		Omatu, S; Rodriguez, S; Villarrubia, G; Faria, P; Sitek, P; Prieto, J		Idrus, Arazi; Mahmoud, Moamin A.; Ahmad, Mohd Sharifuddin; Yahya, Azani; Husen, Hapsa			A Negotiation Algorithm for Decision-Making in the Construction Domain	DISTRIBUTED COMPUTING AND ARTIFICIAL INTELLIGENCE	Advances in Intelligent Systems and Computing				14th International Symposium on Distributed Computing and Artificial Intelligence (DCAI)	JUN 21-23, 2017	Porto, PORTUGAL	Osaka Inst Technol, Polytechn Porto, Univ Salamanca, IBM, Indra, IEEE Syst Man & Cybernet Soc Spain								Mahmoud, Moamin/W-1268-2019													2194-5357	2194-5365	978-3-319-62410-5				2018	620						115	123		10.1007/978-3-319-62410-5_14							WOS:000426343700014						
C	Ahmad, SS; Darbari, M; Purohit, H		Silhavy, R; Senkerik, R; Oplatkova, ZK; Silhavy, P; Prokopova, Z		Ahmad, Sayed Sayeed; Darbari, Manuj; Purohit, Harsh			Application of Evolutionary Algorithm in Supply Chain Management for Internet Marketing	SOFTWARE ENGINEERING PERSPECTIVES AND APPLICATION IN INTELLIGENT SYSTEMS, VOL 2	Advances in Intelligent Systems and Computing				5th Computer Science On-line Conference (CSOC)	APR 27-30, 2016	Prague, CZECH REPUBLIC									Ahmad, Sayed Sayeed/U-2997-2017	Ahmad, Sayed Sayeed/0000-0001-6320-8720; Bhattacharya, Bhupal/0000-0002-7136-3138												2194-5357	2194-5365	978-3-319-33622-0; 978-3-319-33620-6				2016	465						139	146		10.1007/978-3-319-33622-0_13							WOS:000385788200013						
C	Parwekar, P; Gupta, A; Arora, S		Satapathy, SC; Udgata, SK; Biswal, BN		Parwekar, Pritee; Gupta, Akansha; Arora, Shrey			Application of Sensor in Shoe	PROCEEDINGS OF THE INTERNATIONAL CONFERENCE ON FRONTIERS OF INTELLIGENT COMPUTING: THEORY AND APPLICATIONS (FICTA) 2013	Advances in Intelligent Systems and Computing				2nd International Conference on Frontiers in Intelligent Computing - Theory and Applications (FICTA)	NOV 14-16, 2013	Bhubaneswar, INDIA	Bhubaneswar Engn Coll								Parwekar, Pritee/AAG-9984-2020	Parwekar, Pritee/0000-0002-2439-1507												2194-5357		978-3-319-02931-3; 978-3-319-02930-6				2014	247						409	416		10.1007/978-3-319-02931-3_46							WOS:000339490600046						
C	Al-Dahoud, A; Fezari, M; Wassila, A; Al-Rawashdeh, T		Zamojski, W; Mazurkiewicz, J; Sugier, J; Walkowiak, T; Kacprzyk, J		Al-Dahoud, Ali; Fezari, Mohamed; Wassila, Abadi; Al-Rawashdeh, Tahmer			Multiclass SVM/HMM Vowels Recognition System Towards Improving Human Computer Interaction	DEPENDABILITY ENGINEERING AND COMPLEX SYSTEMS	Advances in Intelligent Systems and Computing				11th International Conference on Dependability and Complex Systems (DepCoS-RELCOMEX)	JUN 27-JUL 01, 2016	Brunow, POLAND	Wroclaw Univ Sci & Technol, Dept Comp Engn								FEZARI, Mohamed/P-8524-2016	FEZARI, Mohamed/0000-0003-3364-0066												2194-5357	2194-5365	978-3-319-39639-2; 978-3-319-39638-5				2016	470						1	11		10.1007/978-3-319-39639-2_1							WOS:000389636200001						
C	Campeanu, G; Saadatmand, M		Latifi, S		Campeanu, Gabriel; Saadatmand, Mehrdad			A 2-Layer Component-Based Architecture for Heterogeneous CPU-GPU Embedded Systems	INFORMATION TECHNOLOGY: NEW GENERATIONS	Advances in Intelligent Systems and Computing				13th International Conference on Information Technology - New Generations (ITNG)	APR 11-13, 2016	Las Vegas, NV									Saadatmand, Mehrdad/H-7232-2019	Saadatmand, Mehrdad/0000-0002-1512-0844												2194-5357	2194-5365	978-3-319-32467-8; 978-3-319-32466-1				2016	448						629	639		10.1007/978-3-319-32467-8_55							WOS:000385289400055						
C	Santanelli, JL; Neto, FBD		Madureira, AM; Abraham, A; Gamboa, D; Novais, P		Santanelli, Joao Lima; de Lima Neto, Fernando Buarque			Network Intrusion Detection Using Danger Theory and Genetic Algorithms	INTELLIGENT SYSTEMS DESIGN AND APPLICATIONS (ISDA 2016)	Advances in Intelligent Systems and Computing				16th International Conference on Intelligent Systems Design and Applications (ISDA)	DEC 16-18, 2016	Porto, PORTUGAL	Inst Super Engn Porto, Machine Intelligence Res Labs								de Lima Neto, Fernando Buarque/G-4592-2011	de Lima Neto, Fernando Buarque/0000-0003-1200-225X												2194-5357	2194-5365	978-3-319-53480-0; 978-3-319-53479-4				2017	557						394	405		10.1007/978-3-319-53480-0_39							WOS:000406998500039						
C	Appalla, P; Kuthadi, VM; Marwala, T		Satapathy, SC; Mandal, JK; Udgata, SK; Bhateja, V		Appalla, Padmaja; Kuthadi, Venu Madhav; Marwala, Tshilidzi			An Efficient Educational Data Mining Approach to Support E-learning	INFORMATION SYSTEMS DESIGN AND INTELLIGENT APPLICATIONS, VOL 2, INDIA 2016	Advances in Intelligent Systems and Computing				3rd International Conference on Information System Design and Intelligent Applications (INDIA)	JAN 08-09, 2016	ANITS Campus, Visakhapatnam, INDIA	Anil Neerukonda Inst Technol & Sci, Det CSE, ANITS CSI Student Branch	ANITS Campus								Venu Madhav, Prof Kuthadi/0000-0003-4515-1921												2194-5357	2194-5365	978-81-322-2752-6; 978-81-322-2750-2				2016	434						63	75		10.1007/978-81-322-2752-6_6							WOS:000373009100006						
C	Waefler, T; Fischer, K; Kunz, C; Saric, N		Arezes, P		Waefler, Toni; Fischer, Katrin; Kunz, Christian; Saric, Nina			Managing Tacit Knowledge in Safety Critical Systems	ADVANCES IN SAFETY MANAGEMENT AND HUMAN FACTORS, AHFE 2017	Advances in Intelligent Systems and Computing				8th International Conference on Applied Human Factors and Ergonomics and the Affiliated Conferences (AHFE) / International Conference on Safety Management and Human Factors	JUL 17-21, 2017	Los Angeles, CA																						2194-5357	2194-5365	978-3-319-60525-8; 978-3-319-60524-1				2018	604						30	36		10.1007/978-3-319-60525-8_4							WOS:000465512600004						
S	Borzecki, M; Skurski, A; Kaminski, M; Napieralski, A; Kasprzak, J; Lipiec, P		Pietka, E; Kawa, J; Wieclawek, W		Borzecki, Maciej; Skurski, Adam; Kaminski, Marek; Napieralski, Andrzej; Kasprzak, Jaroslaw; Lipiec, Piotr			Applications of Ray-Casting in Medical Imaging	INFORMATION TECHNOLOGIES IN BIOMEDICINE, VOL 3	Advances in Intelligent Systems and Computing															Lipiec, Piotr/S-9223-2016; Kaminski, Marek/M-8431-2018; Napieralski, Andrzej/M-1621-2016; Kasprzak, Jaroslaw Damian/S-4496-2016	Kaminski, Marek/0000-0003-1893-0516; Napieralski, Andrzej/0000-0002-3844-3435; 												2194-5357	2194-5365	978-3-319-06593-9; 978-3-319-06592-2				2014	283						3	14		10.1007/978-3-319-06593-9_1	10.1007/978-3-319-06593-9						WOS:000352133800002						
C	Saedudin, RR; Kasim, SB; Mahdin, H; Hasibuan, MA		Herawan, T; Ghazali, R; Nawi, NM; Deris, MM		Saedudin, Rd Rohmat; Kasim, Shahreen Binti; Mahdin, Hairulnizam; Hasibuan, Muhammad Azani			Soft Set Approach for Clustering Graduated Dataset	RECENT ADVANCES ON SOFT COMPUTING AND DATA MINING	Advances in Intelligent Systems and Computing				2nd International Conference on Soft Computing and Data Mining (SCDM)	AUG 18-20, 2016	Bandung, INDONESIA									Hasibuan, Muhammad Azani/AAH-3836-2021; Kasim, Shahreen/AAR-1876-2021; Mahdin, Hairulnizam/AAX-9755-2020; Saedudin, Rd. Rohmat/AAN-3666-2020; /AAS-6509-2021	Hasibuan, Muhammad Azani/0000-0001-5230-8865; /0000-0002-2275-0094; saedudin, rohmat/0000-0001-6914-9514												2194-5357	2194-5365	978-3-319-51281-5; 978-3-319-51279-2				2017	549						631	637		10.1007/978-3-319-51281-5_63							WOS:000416517100063						
C	Serrao, C; Gamito, M		Rocha, A; Correia, AM; Wilson, T; Stroetmann, KA		Serrao, Carlos; Gamito, Miguel			Building an Integrated System for the Management of Scientific Nature Events through Open Source Software Integration	ADVANCES IN INFORMATION SYSTEMS AND TECHNOLOGIES	Advances in Intelligent Systems and Computing				World Conference on Information Systems and Technologies (WorldCIST)	MAR 27-30, 2013	Olhao, PORTUGAL	Iberian Assoc Informat Syst & Technologies								Serrao, Carlos/A-3115-2011	Serrao, Carlos/0000-0002-4847-2432												2194-5357		978-3-642-36981-0				2013	206						763	772		10.1007/978-3-642-36981-0_71							WOS:000354617500071						
C	Self, RJ; Aquilina, C		Uden, L; Herrera, F; Perez, JB; Rodriguea, JMC		Self, Richard J.; Aquilina, Conrad			TechnoStress in the 21st Century; Does It Still Exist and How Does It Affect Knowledge Management and Other Information Systems Initiatives	7TH INTERNATIONAL CONFERENCE ON KNOWLEDGE MANAGEMENT IN ORGANIZATIONS: SERVICE AND CLOUD COMPUTING	Advances in Intelligent Systems and Computing				7th International Conference on Knowledge Management in Organizations (KMO 2012)	JUL 11-13, 2012	Salamanca, SPAIN																						2194-5357	2194-5365	978-3-642-30866-6				2013	172						117	+									WOS:000312508900011						
C	Zelenka, J; Kasanicky, T		Borangiu, T		Zelenka, Jan; Kasanicky, Tomas			Control and Coordination System Supported by Biologically Inspired Method for 3D Space "Proof of Concept"	ADVANCES IN ROBOT DESIGN AND INTELLIGENT CONTROL	Advances in Intelligent Systems and Computing				24th International Conference on Robotics in Alpe-Adria-Danube Region (RAAD)	MAY 27-29, 2015	Bucharest, ROMANIA									Zelenka, Jan/A-5101-2013	Zelenka, Jan/0000-0001-5852-0429; Kasanicky, Tomas/0000-0002-1931-6537												2194-5357	2194-5365	978-3-319-21290-6; 978-3-319-21289-0				2016	371						147	156		10.1007/978-3-319-21290-6_15							WOS:000381804400015						
C	Ayvarnam, N; Mayurappriyan, PS		Sundari, PD; Dash, SS; Das, S; Panigrahi, BK		Ayvarnam, Nagarajan; Mayurappriyan, P. S.			Dynamic Scheduling of Machines Towards the Vision of Industry 4.0 Studio-A Case Study	PROCEEDINGS OF 2ND INTERNATIONAL CONFERENCE ON INTELLIGENT COMPUTING AND APPLICATIONS	Advances in Intelligent Systems and Computing				2nd International Conference on Intelligent Computing and Applications (ICICA)	FEB 05-06, 2016	KCG Coll Technol, Chennai, INDIA		KCG Coll Technol							S, Mayurappriyan P/AAP-7872-2020													2194-5357	2194-5365	978-981-10-1645-5; 978-981-10-1644-8				2017	467						103	111		10.1007/978-981-10-1645-5_9							WOS:000401652200009						
C	Sanyal, MK; Das, S; Bhadra, S		Satapathy, SC; Biswal, BN; Udgata, SK; Mandal, JK		Sanyal, Manas Kumar; Das, Sudhangsu; Bhadra, Sajal			A Cloud Based Architecture of Existing e-District Project in India towards Cost Effective e-Governance Implementation	PROCEEDINGS OF THE 3RD INTERNATIONAL CONFERENCE ON FRONTIERS OF INTELLIGENT COMPUTING: THEORY AND APPLICATIONS (FICTA) 2014, VOL 2	Advances in Intelligent Systems and Computing				3rd International Conference on Frontiers in Intelligent Computing - Theory and Applications (FICTA)	NOV 14-15, 2014	Bhubaneswar, INDIA	Bhubaneswar Engn Coll, Anil Neerukonda Inst Technol & Sci, CSI Student Branch																					2194-5357		978-3-319-12012-6; 978-3-319-12011-9				2015	328						65	73		10.1007/978-3-319-12012-6_8							WOS:000365181700008						
C	Jayanth, S; Poorvi, MB; Sunil, MP		Satapathy, SC; Prasad, VK; Rani, BP; Udgata, SK; Raju, KS		Jayanth, S.; Poorvi, M. B.; Sunil, M. P.			Inventory Management System Using IOT	PROCEEDINGS OF THE FIRST INTERNATIONAL CONFERENCE ON COMPUTATIONAL INTELLIGENCE AND INFORMATICS, ICCII 2016	Advances in Intelligent Systems and Computing				1st International Conference on Computational Intelligence and Informatics (ICCII)	MAY 28-30, 2016	JNTUHCE, Dept Comp Sci & Engn, Hyderabad, INDIA	CSI, Div V Educ & Res	JNTUHCE, Dept Comp Sci & Engn							MP, Sunil/ABB-6966-2020	MP, Sunil/0000-0002-7737-4145												2194-5357	2194-5365	978-981-10-2471-9; 978-981-10-2470-2				2017	507						201	210		10.1007/978-981-10-2471-9_20							WOS:000417216000020						
S	Parrado-Garcia, FJ; Lopez-Matencio, P; Chaves-Dieguez, D; Vales-Alonso, J; Alcaraz, JJ; Gonzalez-Castano, FJ		Hippe, ZS; Kulikowski, JL; Mroczek, T; Wtorek, J		Parrado-Garcia, F. J.; Lopez-Matencio, P.; Chaves-Dieguez, D.; Vales-Alonso, J.; Alcaraz, J. J.; Gonzalez-Castano, F. J.			Evaluation of Team-Sport Training Effort Control Systems	HUMAN-COMPUTER SYSTEMS INTERACTION: BACKGROUNDS AND APPLICATIONS 3	Advances in Intelligent Systems and Computing															Lopez-Matencio, Pablo/K-3944-2013; Alcaraz, Juan J/E-7393-2012; Gonzalez-Castano, Francisco J./D-2637-2018	Lopez-Matencio, Pablo/0000-0002-9881-6192; Alcaraz, Juan J/0000-0002-1756-0130; Gonzalez-Castano, Francisco Javier/0000-0001-5225-8378; Vales-Alonso, Javier/0000-0002-8761-7235												2194-5357	2194-5365	978-3-319-08491-6; 978-3-319-08490-9				2014	300						337	355		10.1007/978-3-319-08491-6_28	10.1007/978-3-319-08491-6						WOS:000360129800028						
C	Kandukuru, S; Sharma, RM		Sa, PK; Bakshi, S; Hatzilygeroudis, IK; Sahoo, MN		Kandukuru, Satish; Sharma, R. M.			PNSDroid: A Hybrid Approach for Detection of Android Malware	RECENT FINDINGS IN INTELLIGENT COMPUTING TECHNIQUES, VOL 3	Advances in Intelligent Systems and Computing				5th International Conference on Advanced Computing, Networking, and Informatics (ICACNI)	JUN 01-03, 2017	Natl Inst Technol Goa, Dept Comp Sci & Engn, Goa, INDIA	Natl Inst Technol Rourkela, Ctr Comp Vis & Pattern Recognit	Natl Inst Technol Goa, Dept Comp Sci & Engn																				2194-5357	2194-5365	978-981-10-8633-5; 978-981-10-8632-8				2018	709						361	367		10.1007/978-981-10-8633-5_36							WOS:000589275800036						
C	Korad, SL; Parkavi, A		Reddy, MS; Viswanath, K; Prasad, KMS		Korad, S. Likitha; Parkavi, A.			Recommendation Engine to Improvise Curriculum of OBE by Using Comparative Analysis of Institutional Curriculum with Industrial Requirements	INTERNATIONAL PROCEEDINGS ON ADVANCES IN SOFT COMPUTING, INTELLIGENT SYSTEMS AND APPLICATIONS, ASISA 2016	Advances in Intelligent Systems and Computing				International Conference on Advances in Soft Computing, Intelligent Systems and Applications (ASISA)	2016	Bangalore, INDIA	R L Jalappa Inst Technol, ARPVGSI, IEEE Robot & Automat Soc								Parkavi, A/AAD-3167-2021													2194-5357	2194-5365	978-981-10-5272-9; 978-981-10-5271-2				2018	628						217	226		10.1007/978-981-10-5272-9_21							WOS:000451046800021						
C	Sharma, V; Garg, P		Pant, M; Deep, K; Bansal, JC; Nagar, A; Das, KN		Sharma, Vivek; Garg, Pulkit			Fault Diagnosis of ZSI-Fed 3-Phase Induction Motor Drive System Using MATLAB	PROCEEDINGS OF FIFTH INTERNATIONAL CONFERENCE ON SOFT COMPUTING FOR PROBLEM SOLVING (SOCPROS 2015), VOL 2	Advances in Intelligent Systems and Computing				5th International Conference on Soft Computing for Problem Solving (SocProS)	DEC 18-20, 2015	Roorkee, INDIA										SHARMA, VIVEK/0000-0002-1143-0298												2194-5357		978-981-10-0451-3; 978-981-10-0450-6				2016	437						193	202		10.1007/978-981-10-0451-3_19							WOS:000385787900019						
C	Ainapure, BS; Shah, D; Rao, AA		Sa, PK; Sahoo, MN; Murugappan, M; Wu, Y; Majhi, B		Ainapure, Bharati S.; Shah, Deven; Rao, A. Ananda			Understanding Perception of Cache-Based Side-Channel Attack on Cloud Environment	PROGRESS IN INTELLIGENT COMPUTING TECHNIQUES: THEORY, PRACTICE, AND APPLICATIONS, VOL 2	Advances in Intelligent Systems and Computing				4th International Conference on Advanced Computing, Networking and Informatics (ICACNI)	SEP 22-24, 2016	Natl Inst Technol Rourkela, Ctr Comp Vis & Pattern Recognit, Rourkela, INDIA	Joint Control Syst Soc & Instrumentat & Measurement Soc Chapter, IEEE Kolkata Sect, IEEE Commun Soc Calcutta Chapter, Govt India, CSIR Natl Aerosp Labs Aerosp Elect & Syst Div, Iowa State Univ, Dependable Comp & Networking Lab, Henan Univ Sci & Technol, Multimedia Content Secur Innovat Res Grp, Poznan Univ Technol Vis Lab	Natl Inst Technol Rourkela, Ctr Comp Vis & Pattern Recognit																				2194-5357	2194-5365	978-981-10-3376-6; 978-981-10-3375-9				2018	719						9	21		10.1007/978-981-10-3376-6_2							WOS:000453214400002						
C	Monika, R; Bala, AA; Suvarnamma, A		Dash, SS; Das, S; Panigrahi, BK		Monika, R.; Bala, A. Anilet; Suvarnamma, A.			Block Compressive Sampling and Wiener Curvelet Denoising Approach for Satellite Images	INTERNATIONAL CONFERENCE ON INTELLIGENT COMPUTING AND APPLICATIONS, ICICA 2016	Advances in Intelligent Systems and Computing				3rd International Conference on Intelligent Computing and Applications (ICICA)	DEC 21-22, 2016	D Y Patil Coll Engn, Akurdi, INDIA	IRD	D Y Patil Coll Engn							Rajendran, Monika/AAY-9133-2020	A, Anilet Bala/0000-0002-1038-7582; R, Monika/0000-0002-7814-6611												2194-5357	2194-5365	978-981-10-5520-1; 978-981-10-5519-5				2018	632						11	18		10.1007/978-981-10-5520-1_2							WOS:000436504300002						
C	Nowosielski, A; Frejlichowski, D; Forczmanski, P; Gosciewska, K; Hofman, R		Choras, RS		Nowosielski, Adam; Frejlichowski, Dariusz; Forczmanski, Pawel; Gosciewska, Katarzyna; Hofman, Radoslaw			Automatic Analysis of Vehicle Trajectory Applied to Visual Surveillance	IMAGE PROCESSING AND COMMUNICATIONS CHALLENGES 7	Advances in Intelligent Systems and Computing				8th International Conference on Image Processing and Communications (IP and C)	SEP 09-11, 2015	UTP Univ Sci & Technol, Bydgoszcz, POLAND		UTP Univ Sci & Technol							Frejlichowski, Dariusz/H-8107-2016; Forczmanski, Pawel/AAA-4978-2020; Gosciewska, Katarzyna/AAL-7671-2020; Forczmanski, Pawel/L-1055-2013; Nowosielski, Adam/D-7930-2016	Forczmanski, Pawel/0000-0002-3618-9146; Gosciewska, Katarzyna/0000-0002-6726-2174; Forczmanski, Pawel/0000-0002-3618-9146; Nowosielski, Adam/0000-0001-7729-7867												2194-5357	2194-5365	978-3-319-23814-2; 978-3-319-23813-5				2016	389						89	96		10.1007/978-3-319-23814-2_11							WOS:000369842100011						
C	Thanki, R; Borisagar, K		Thampi, SM; Bandyopadhyay, S; Krishnan, S; Li, KC; Mosin, S; Ma, M		Thanki, Rohit; Borisagar, Komal			Biometric Watermarking Technique Based on CS Theory and Fast Discrete Curvelet Transform for Face and Fingerprint Protection	ADVANCES IN SIGNAL PROCESSING AND INTELLIGENT RECOGNITION SYSTEMS (SIRS-2015)	Advances in Intelligent Systems and Computing				2nd International Symposium on Signal Processing and Intelligent Recognition Systems (SIRS)	DEC 16-19, 2015	Trivandrum, INDIA	Indian Inst Informat Technol & Management, ACM, Trivandrum Chapter, Int Neural Networks Soc India, Reg Chapter, TECHNOPARK, IUPRAI								Thanki, Rohit/Q-9029-2017	Thanki, Rohit/0000-0002-0645-6266												2194-5357	2194-5365	978-3-319-28658-7; 978-3-319-28656-3				2016	425						133	144		10.1007/978-3-319-28658-7_12							WOS:000384639900012						
C	Kubanek, M; Depta, F; Smorawa, D		Kobayashi, SY; Piegat, A; Pejas, J; ElFray, I; Kacprzyk, J		Kubanek, Mariusz; Depta, Filip; Smorawa, Dorota			System of Acoustic Assistance in Spatial Orientation for the Blind	HARD AND SOFT COMPUTING FOR ARTIFICIAL INTELLIGENCE, MULTIMEDIA AND SECURITY	Advances in Intelligent Systems and Computing				20th Conference on Advanced Computer System (ACS)	OCT 19-21, 2016	Miedzyzdroje, POLAND	W Pomeranian Univ Technol, Fac Comp Sci & Informat Technol, Warsaw Univ Technol, Fac Math & Informat Sci, AGH Univ Sci & Technol, Fac Phys & Appl Comp Sci, Polish Acad Sci, Inst Comp Sci, Ehime Univ									Kubanek, Mariusz/0000-0001-9651-9525												2194-5357		978-3-319-48429-7; 978-3-319-48428-0				2017	534						266	277		10.1007/978-3-319-48429-7_25							WOS:000405325600025						
S	Akbil, B; Ferre, G; Aboutajdine, D		Choras, RS		Akbil, Brahim; Ferre, Guillaume; Aboutajdine, Driss			Computational Complexity and Bandwidth Resource Analysis of NLM Interleaver in IDMA System	IMAGE PROCESSING AND COMMUNICATIONS CHALLENGES 4	Advances in Intelligent Systems and Computing															aboutajdine, driss/AAP-9051-2020													2194-5357	2194-5365	978-3-642-32383-6				2013	184						241	251			10.1007/978-3-642-32384-3						WOS:000312752300030						
C	Lazaro, MT; Grisetti, G; Iocchi, L; Fentanes, JP; Hanheide, M		Ollero, A; Sanfeliu, A; Montano, L; Lau, N; Cardeira, C		Lazaro, M. T.; Grisetti, G.; Iocchi, L.; Fentanes, J. P.; Hanheide, M.			A Lightweight Navigation System for Mobile Robots	ROBOT 2017: THIRD IBERIAN ROBOTICS CONFERENCE, VOL 2	Advances in Intelligent Systems and Computing				3rd Iberian Robotics Conference (Robot)	NOV 22-24, 2017	Seville, SPAIN									GRANON, MARIA TERESA LAZARO/AAI-6857-2021	GRANON, MARIA TERESA LAZARO/0000-0002-7742-2442; Grisetti, Giorgio/0000-0002-8038-9989												2194-5357	2194-5365	978-3-319-70836-2; 978-3-319-70835-5				2018	694						295	306		10.1007/978-3-319-70836-2_25							WOS:000436471400025						
C	Labus, M; Despotovic-Zrakic, M; Bogdanovic, Z		Rocha, A; Correia, AM; Adeli, H; Reis, LP; Costanzo, S		Labus, Milica; Despotovic-Zrakic, Marijana; Bogdanovic, Zorica			Introducing Adaptive E-Business Continuity Management	RECENT ADVANCES IN INFORMATION SYSTEMS AND TECHNOLOGIES, VOL 1	Advances in Intelligent Systems and Computing				World Conference on Information Systems and Technologies (WorldCIST)	APR 11-13, 2017	Madeira, PORTUGAL									Despotovic-Zrakic, Marijana/D-8617-2016; Bogdanovic, Zorica/O-9131-2018	Bogdanovic, Zorica/0000-0003-4799-1588; Despotovic-Zrakic, Marijana/0000-0002-6458-1575												2194-5357	2194-5365	978-3-319-56535-4; 978-3-319-56534-7				2017	569						628	637		10.1007/978-3-319-56535-4_62							WOS:000425543100062						
C	Kant, R; Pandey, V; Pattanaik, LN		Sahana, SK; Saha, SK		Kant, Rajeev; Pandey, Vijay; Pattanaik, L. N.			An NSGA II-Based Approach for Optimization of Reconfigurable Cellular Manufacturing System	ADVANCES IN COMPUTATIONAL INTELLIGENCE	Advances in Intelligent Systems and Computing				1st International Conference on Computational Intelligence (ICCI)	DEC 10-11, 2015	Birla Inst Technol, Ranchi, INDIA		Birla Inst Technol							Pattanaik, LN/L-9585-2017; Pandey, Vijay/M-6033-2017; Pandey, Vijay/V-8386-2019	Pattanaik, LN/0000-0002-4160-0745; Pandey, Vijay/0000-0002-1385-3358; Pandey, Vijay/0000-0002-1385-3358												2194-5357		978-981-10-2525-9; 978-981-10-2524-2				2017	509						57	66		10.1007/978-981-10-2525-9_6							WOS:000401112800006						
C	Gudadhe, SS; Thakare, AD; Dhote, CA		Dash, SS; Das, S; Panigrahi, BK		Gudadhe, Santwana S.; Thakare, A. D.; Dhote, C. A.			Parallel Palm Print Identification Using Fractional Coefficients of Palm Edge Transformed Images on GPU	INTERNATIONAL CONFERENCE ON INTELLIGENT COMPUTING AND APPLICATIONS, ICICA 2016	Advances in Intelligent Systems and Computing				3rd International Conference on Intelligent Computing and Applications (ICICA)	DEC 21-22, 2016	D Y Patil Coll Engn, Akurdi, INDIA	IRD	D Y Patil Coll Engn							Thakare, Anuradha/Z-3756-2019; University, Sant Gadge Baba Amravati/AAN-5820-2021; Dhote, Chandrashekhar/AAS-6510-2020	University, Sant Gadge Baba Amravati/0000-0002-3759-6755; Thakare, Anuradha/0000-0001-6281-8711												2194-5357	2194-5365	978-981-10-5520-1; 978-981-10-5519-5				2018	632						107	117		10.1007/978-981-10-5520-1_11							WOS:000436504300011						
C	Kajzer, W; Prajsnar, G; Kajzer, A; Rodak, L; Marciniak, J; Mielnik, M; Semenowicz, J; Hermanson, J; Koczy, B		Gzik, M; Tkacz, E; Paszenda, Z; Pietka, E		Kajzer, Wojciech; Prajsnar, Grzegorz; Kajzer, Anita; Rodak, Lukasz; Marciniak, Jan; Mielnik, Michal; Semenowicz, Jacek; Hermanson, Jacek; Koczy, Bogdan			Application of Dynamic Hip Screw System in Treatment of Intertrochanteric Fracture	INNOVATIONS IN BIOMEDICAL ENGINEERING	Advances in Intelligent Systems and Computing				Conference on Innovations in Biomedical Engineering (IBE)	OCT 16-18, 2016	Zabrze, POLAND									Kajzer, Anita/T-6459-2018; Kajzer, Wojciech/T-6422-2018	Kajzer, Anita/0000-0002-9609-6726; Kajzer, Wojciech/0000-0001-9285-1272												2194-5357	2194-5365	978-3-319-47154-9; 978-3-319-47153-2				2017	526						124	131		10.1007/978-3-319-47154-9_15							WOS:000455777500015						
