PT	AU	BA	BE	GP	AF	BF	CA	TI	SO	SE	BS	LA	DT	CT	CY	CL	SP	HO	DE	ID	AB	C1	RP	EM	RI	OI	FU	FX	CR	NR	TC	Z9	U1	U2	PU	PI	PA	SN	EI	BN	J9	JI	PD	PY	VL	IS	PN	SU	SI	MA	BP	EP	AR	DI	D2	EA	PG	WC	SC	GA	UT	PM	OA	HC	HP	DA
C	Gonge, SS; Ghatol, A		Thampi, SM; Bandyopadhyay, S; Krishnan, S; Li, KC; Mosin, S; Ma, M		Gonge, Sudhanshu Suhas; Ghatol, Ashok			A Cheque Watermarking System Using Singular Value Decomposition for Copyright Protection of Cheque Images	ADVANCES IN SIGNAL PROCESSING AND INTELLIGENT RECOGNITION SYSTEMS (SIRS-2015)	Advances in Intelligent Systems and Computing				2nd International Symposium on Signal Processing and Intelligent Recognition Systems (SIRS)	DEC 16-19, 2015	Trivandrum, INDIA	Indian Inst Informat Technol & Management, ACM, Trivandrum Chapter, Int Neural Networks Soc India, Reg Chapter, TECHNOPARK, IUPRAI								Gonge, Sudhanshu Suhas/U-2760-2017; , Sant Gadge Baba Amravati University/AAN-5820-2021	Gonge, Sudhanshu Suhas/0000-0002-4092-6874; , Sant Gadge Baba Amravati University/0000-0002-3759-6755												2194-5357	2194-5365	978-3-319-28658-7; 978-3-319-28656-3				2016	425						119	132		10.1007/978-3-319-28658-7_11							WOS:000384639900011						
C	Buslaev, A; Volkov, M		Zamojski, W; Mazurkiewicz, J; Sugier, J; Walkowiak, T; Kacprzyk, J		Buslaev, Alexander; Volkov, Mikhail			Optimization and Control of Transport Processes in the Distributed Systems	PROCEEDINGS OF THE NINTH INTERNATIONAL CONFERENCE ON DEPENDABILITY AND COMPLEX SYSTEMS DEPCOS-RELCOMEX	Advances in Intelligent Systems and Computing				9th International Conference on Dependability and Complex Systems (DepCoS-RELCOMEX)	JUN 30-JUL 04, 2014	Brunow, POLAND	Wroclaw Univ Technol, Inst Comp Engn Control & Robot								Buslaev, Alexander/K-9482-2013	Buslaev, Alexander/0000-0002-8818-9500												2194-5357		978-3-319-07013-1				2014	286						123	132		10.1007/978-3-319-07013-1_12							WOS:000363748100012						
C	Cal, P; Wozniak, M		Burduk, R; Jackowski, K; Kurzynski, M; Wozniak, M; Zolnierek, A		Cal, Piotr; Wozniak, Michal			Data Preprocessing with GPU for DBSCAN Algorithm	PROCEEDINGS OF THE 8TH INTERNATIONAL CONFERENCE ON COMPUTER RECOGNITION SYSTEMS CORES 2013	Advances in Intelligent Systems and Computing				8th International Conference on Computer Recognition Systems (CORES)	MAY 25-27, 2013	Wroclaw, POLAND									Wozniak, Michal/A-4806-2008	Wozniak, Michal/0000-0003-0146-4205												2194-5357		978-3-319-00969-8; 978-3-319-00968-1				2013	226						793	801		10.1007/978-3-319-00969-8_78							WOS:000354284200078						
C	Sangeetha, KS; Prakash, P		Suresh, LP; Dash, SS; Panigrahi, BK		Sangeetha, K. S.; Prakash, P.			Big Data and Cloud: A Survey	ARTIFICIAL INTELLIGENCE AND EVOLUTIONARY ALGORITHMS IN ENGINEERING SYSTEMS, VOL 2	Advances in Intelligent Systems and Computing				International Conference on Artificial Intelligence and Evolutionary Algorithms in Engineering Systems (ICAEES)	APR 22-23, 2014	Noorul Islam Univ, Noorul Islam Ctr Higher Educ, Kumaracoil, INDIA		Noorul Islam Univ, Noorul Islam Ctr Higher Educ							P, Prakash/ABI-6948-2020	Periyasamy, Prakash/0000-0001-9215-6122												2194-5357	2194-5365	978-81-322-2135-7; 978-81-322-2134-0				2015	325						773	778		10.1007/978-81-322-2135-7_81							WOS:000357378500081						
C	Iovanov, V; Buzgau, M; Bucerzan, D		Balas, VE; Jain, LC; Balas, MM		Iovanov, Vlad; Buzgau, Mihai; Bucerzan, Dominic			Containerizing Solution for a Highly Distributed Systems	SOFT COMPUTING APPLICATIONS, SOFA 2016, VOL 2	Advances in Intelligent Systems and Computing				7th International Workshop on Soft Computing Applications (SOFA)	AUG 24-26, 2016	Arad, ROMANIA	Aurel Vlaicu Univ Arad, Univ Belgrade, Romanian Acad, Iasi Branch, Inst Comp Sci, IEEE Romanian Sect, Romanian Soc Control Engn & Tech Informat, Arad Sect, Gen Assoc Engineers Romania, Arad Sect, BTM Resources Arad																					2194-5357	2194-5365	978-3-319-62524-9				2018	634						557	564		10.1007/978-3-319-62524-9_41							WOS:000433139800041						
C	Zhang, XH; Lin, S; Lin, MC		Cao, BY; Ma, SQ; Cao, HH		Zhang, Xiu-hong; Lin, Song; Lin, Mingcai			Research on Hainan Ecotourism System Early Warning	ECOSYSTEM ASSESSMENT AND FUZZY SYSTEMS MANAGEMENT	Advances in Intelligent Systems and Computing				3rd International Conference on Ecosystem Assessment Management / Workshop on the Construction of an Early Warning Platform for Eco-Tourism in Hainan	MAY 05-12, 2013	Haikou, PEOPLES R CHINA	Hainan Normal Univ, Univ Ottawa, Dept Land Environm & Resources Hainan Prov, ORSC, Fuzzy Informat & Engn Branch, Operat Res Soc Guangdong Prov																					2194-5357		978-3-319-03449-2; 978-3-319-03448-5				2014	254						81	85		10.1007/978-3-319-03449-2_9							WOS:000363268200009						
C	Turchenko, V		Omatu, S; Bersini, H; Corchado, JM; Rodriguez, S; Pawlewski, P; Bucciarelli, E		Turchenko, Volodymyr			Parallel Batch Pattern Training Algorithm for MLP with Two Hidden Layers on Many-Core System	DISTRIBUTED COMPUTING AND ARTIFICIAL INTELLIGENCE, 11TH INTERNATIONAL CONFERENCE	Advances in Intelligent Systems and Computing				11th International Symposium on Distributed Computing and Artificial Intelligence (DCAI)	JUN 04-06, 2014	Salamanca, SPAIN	Univ Salamanca, Bioinformat, Intelligent Syst & Educ Technol Res Grp, Ingn Software Avanzado S A, IBM, ICyL, IEEE Syst Man & Cybernet Soc Spain, Asociac Espanola Inteligencia Artificial, Assoc Portuguesa Para Inteligencia Artificial, Ctr Natl Rech Sci, Minist Economia & Competitividad								Turchenko, Volodymyr/AAH-5793-2019; Turchenko, Volodymyr/C-8688-2015	Turchenko, Volodymyr/0000-0003-3810-6970												2194-5357	2194-5365	978-3-319-07593-8; 978-3-319-07592-1				2014	290						537	544		10.1007/978-3-319-07593-8_62							WOS:000342905800062						
C	Chiuchisan, I; Chiuchisan, I; Geman, O; Milici, RM; Milici, LD		Balas, VE; Jain, LC; Balas, MM		Chiuchisan, Iuliana; Chiuchisan, Iulian; Geman, Oana; Milici, Rodica-Mariana; Milici, Laurentiu-Dan			Tremor Measurement System for Neurological Disorders Screening	SOFT COMPUTING APPLICATIONS, SOFA 2016, VOL 1	Advances in Intelligent Systems and Computing				7th International Workshop on Soft Computing Applications (SOFA)	AUG 24-26, 2016	Arad, ROMANIA	Aurel Vlaicu Univ Arad, Univ Belgrade, Romanian Acad, Iasi Branch, Inst Comp Sci, IEEE Romanian Sect, Romanian Soc Control Engn & Tech Informat, Arad Sect, Gen Assoc Engineers Romania, Arad Sect, BTM Resources Arad								Milici, L. Dan/AAI-4094-2021	Chiuchisan, Iuliana/0000-0002-4361-4884												2194-5357	2194-5365	978-3-319-62521-8				2018	633						339	348		10.1007/978-3-319-62521-8_28							WOS:000433138300028						
C	Przelaskowski, A; Sobieszczuk, E; Jozwiak, R; Zycka-Malesa, D; Mykhalevych, I; Sklinda, K; Sobkowicz, A		Pietka, E; Badura, P; Kawa, J; Wieclawek, W		Przelaskowski, Artur; Sobieszczuk, Ewa; Jozwiak, Rafal; Zycka-Malesa, Dominika; Mykhalevych, Ihor; Sklinda, Katarzyna; Sobkowicz, Antoni			Integrated System for Clinical Decision Support in Emergency Stroke Care	INFORMATION TECHNOLOGIES IN MEDICINE, ITIB 2016, VOL 1	Advances in Intelligent Systems and Computing				5th International Conference on Information Technologies in Biomedicine (ITIB)	JUN 20-22, 2016	Kamien Slaski, POLAND									Jozwiak, Rafal/AAZ-1948-2021; Jozwiak, Rafal/B-5398-2015; Przelaskowski, Artur/V-9712-2019	Jozwiak, Rafal/0000-0003-0753-7241; Jozwiak, Rafal/0000-0003-0753-7241; Przelaskowski, Artur/0000-0002-4452-9569; Zycka-Malesa, Dominika/0000-0001-9427-4472; Mykhalevych, Ihor/0000-0002-7244-5637; Sobkowicz, Antoni/0000-0003-4167-1241; Sklinda, Katarzyna/0000-0001-9214-0008												2194-5357	2194-5365	978-3-319-39796-2; 978-3-319-39795-5				2016	471						457	473		10.1007/978-3-319-39796-2_38							WOS:000382995900038						
C	Magana, VC; Organero, MM; Alvarez-Garcia, JA; Rodriguez, JYF		Lindgren, H; DePaz, JF; Novais, P; FernandezCaballero, A; Yoe, H; Ramirez, AJ; Villarrubia, G		Corcoba Magana, Victor; Munoz Organero, Mario; Antonio Alvarez-Garcia, Juan; Fernandez Rodriguez, Jorge Yago			Estimation of the Optimum Speed to Minimize the Driver Stress Based on the Previous Behavior	AMBIENT INTELLIGENCE - SOFTWARE AND APPLICATIONS (ISAMI 2016)	Advances in Intelligent Systems and Computing				7th International Symposium on Ambient Intelligence (ISAmI)	JUN 01-03, 2016	Univ Seville, Seville, SPAIN	IEEE Secc Espana, CNRS, AFIA, AEPIA, APPIA, AI*IA, Junta Castilla Leon, IBM, Escuela Tecnica Super Ingn Informatica, Umea Univ, Univ Minho, Inst Educacao, Indra, Fidetia, IEEE Syst Man & Cybernet Soc	Univ Seville							Garcia, Juan Antonio Alvarez/A-6223-2008; Magana, Victor Corcoba/AAZ-2273-2020; Munoz-Organero, Mario/F-6891-2016	Garcia, Juan Antonio Alvarez/0000-0002-4106-6044; Munoz-Organero, Mario/0000-0003-4199-2002												2194-5357	2194-5365	978-3-319-40114-0; 978-3-319-40113-3				2016	476						31	39		10.1007/978-3-319-40114-0_4							WOS:000382645900004						
C	Omran, LN; Ezzat, KA; Hassanien, AE		Hassanien, AE; Tolba, MF; Elhoseny, M; Mostafa, M		Omran, Lamia Nabil; Ezzat, Kadry Ali; Hassanien, Aboul Ella			Decision Support System for Determination of Forces Applied in Orthodontic Based on Fuzzy Logic	INTERNATIONAL CONFERENCE ON ADVANCED MACHINE LEARNING TECHNOLOGIES AND APPLICATIONS (AMLTA2018)	Advances in Intelligent Systems and Computing				3rd International Conference on Advanced Machine Learning Technologies and Applications (AMLTA)	FEB 22-24, 2018	Cairo, EGYPT										Hassanien, Aboul Ella/0000-0002-9989-6681												2194-5357	2194-5365	978-3-319-74690-6; 978-3-319-74689-0				2018	723						158	168		10.1007/978-3-319-74690-6_16							WOS:000552666500016						
C	Pillai, P; Supriya, M		Berretti, S; Thampi, SM; Dasgupta, S		Pillai, Parvathy; Supriya, M.			Real Time CO2 Monitoring and Alert System Based on Wireless Sensor Networks	INTELLIGENT SYSTEMS TECHNOLOGIES AND APPLICATIONS, VOL 2	Advances in Intelligent Systems and Computing				International Symposium on Intelligent Systems Technologies and Applications (ISTA)	AUG 10-13, 2015	SCMS Grp Inst, SCMS Sch Engn & Technol, Kochi, INDIA		SCMS Grp Inst, SCMS Sch Engn & Technol								M, Supriya/0000-0001-6147-7142												2194-5357	2194-5365	978-3-319-23258-4; 978-3-319-23257-7				2016	385						91	103		10.1007/978-3-319-23258-4_9							WOS:000381802900009						
C	Pinto, M		Rocha, A; Correia, AM; Wilson, T; Stroetmann, KA		Pinto, Mario			Knowledge Management Systems and Intellectual Capital Measurement in Portuguese Organizations: A Case Study	ADVANCES IN INFORMATION SYSTEMS AND TECHNOLOGIES	Advances in Intelligent Systems and Computing				World Conference on Information Systems and Technologies (WorldCIST)	MAR 27-30, 2013	Olhao, PORTUGAL	Iberian Assoc Informat Syst & Technologies																					2194-5357	2194-5365	978-3-642-36981-0				2013	206						23	32		10.1007/978-3-642-36981-0_3							WOS:000354617500003						
C	Zheng, Y; Guo, BL; Ma, J		Pan, JS; Snasel, V; Sung, TW; Wang, XD		Zheng, Yan; Guo, Baolong; Ma, Jing			Object Recognition Based on Superposition Proportion in Binary Images	INTELLIGENT DATA ANALYSIS AND APPLICATIONS, (ECC 2016)	Advances in Intelligent Systems and Computing				3rd Euro-China Conference on Intelligent Data Analysis and Applications (ECC)	NOV 07-09, 2016	Fujian Univ Technol, Fuzhou, PEOPLES R CHINA	Fujian Provincial Key Lab Big Data Mining & Applicat, VSB Techn Univ Ostrava, Taiwan Assoc Web Intelligence Consortium & Immers Co Ltd	Fujian Univ Technol																				2194-5357	2194-5365	978-3-319-48499-0; 978-3-319-48498-3				2017	535						69	76									WOS:000398625400009						
C	Ragunathan, T; Battula, SK; Vedika, J; NagaRatna, M		Satapathy, SC; Prasad, VK; Rani, BP; Udgata, SK; Raju, KS		Ragunathan, T.; Battula, Sudheer Kumar; Vedika, Jorika; NagaRatna, M.			Effective Visiting Schedule Generation in a Tourist Recommender System Using Hadoop	PROCEEDINGS OF THE FIRST INTERNATIONAL CONFERENCE ON COMPUTATIONAL INTELLIGENCE AND INFORMATICS, ICCII 2016	Advances in Intelligent Systems and Computing				1st International Conference on Computational Intelligence and Informatics (ICCII)	MAY 28-30, 2016	JNTUHCE, Dept Comp Sci & Engn, Hyderabad, INDIA	CSI, Div V Educ & Res	JNTUHCE, Dept Comp Sci & Engn							Battula, Sudheer Kumar/AAH-1952-2020; Ragunathan, T/T-2172-2019; Battula, Sudheer Kumar/AAA-1948-2019	Ragunathan, T/0000-0002-5598-0320; Battula, Sudheer Kumar/0000-0001-6597-252X												2194-5357	2194-5365	978-981-10-2471-9; 978-981-10-2470-2				2017	507						615	624		10.1007/978-981-10-2471-9_59							WOS:000417216000059						
C	Salinca, A; Rusu, SM; Pricochi, AM		Rocha, A; Correia, AM; Wilson, T; Stroetmann, KA		Salinca, Andreea; Rusu, Sorin Mircea; Pricochi, Ana-Maria			SOA - Based Authentication System for Dynamic Handwritten Signature	ADVANCES IN INFORMATION SYSTEMS AND TECHNOLOGIES	Advances in Intelligent Systems and Computing				World Conference on Information Systems and Technologies (WorldCIST)	MAR 27-30, 2013	Olhao, PORTUGAL	Iberian Assoc Informat Syst & Technologies																					2194-5357	2194-5365	978-3-642-36981-0				2013	206						735	744		10.1007/978-3-642-36981-0_68							WOS:000354617500068						
C	Mendes, J; Oliveira, O; Pereira, CS; Fernandes, P		Rocha, A; Correia, AM; Costanzo, S; Reis, LP		Mendes, Jaime; Oliveira, Oscar; Pereira, Carla Sofia; Fernandes, Pedro			An Information System for Management and Optimization of Materials in the Wood Industry	NEW CONTRIBUTIONS IN INFORMATION SYSTEMS AND TECHNOLOGIES, VOL 1, PT 1	Advances in Intelligent Systems and Computing				World Conference on Information Systems and Technologies (WorldCIST)	APR 01-03, 2015	Univ Azores, Ponta Delgada, PORTUGAL		Univ Azores							Oliveira, Oscar/A-9526-2019	Oliveira, Oscar/0000-0003-3807-7292												2194-5357		978-3-319-16486-1; 978-3-319-16485-4				2015	353		1				585	591		10.1007/978-3-319-16486-1_57							WOS:000381744400057						
C	Revathy, VR; Pillai, AS		Abraham, A; Cherukuri, AK; Madureira, AM; Muda, AK		Revathy, V. R.; Pillai, Anitha S.			Classification and Applications of Social Recommender Systems	PROCEEDINGS OF THE EIGHTH INTERNATIONAL CONFERENCE ON SOFT COMPUTING AND PATTERN RECOGNITION (SOCPAR 2016)	Advances in Intelligent Systems and Computing				8th International Conference on Soft Computing and Pattern Recognition (SoCPaR) / 8th International Conference on Computational Aspects of Social Networks (CASoN)	DEC 19-21, 2016	Vellore Inst Technol Univ, Vellore, INDIA	Machine Intelligence Research Labs	Vellore Inst Technol Univ							Pillai, Anitha S/B-4160-2015	Pillai, Anitha S/0000-0002-3883-8234												2194-5357	2194-5365	978-3-319-60618-7; 978-3-319-60617-0				2018	614						719	729		10.1007/978-3-319-60618-7_70							WOS:000454700100070						
C	Carvajal, L; Quesada, L; Lopez, G; Brenes, JA	Nunes, IL			Carvajal, Luis; Quesada, Luis; Lopez, Gustavo; Brenes, Jose A.	Nunes, IL		Developing a Proxy Service to Bring Naturality to Amazon's Personal Assistant "Alexa"	ADVANCES IN HUMAN FACTORS AND SYSTEMS INTERACTION	Advances in Intelligent Systems and Computing				AHFE International Conference on Human Factors and System Interactions	JUL 17-21, 2017	Los Angeles, CA										Brenes Carranza, Jose Antonio/0000-0001-9934-5508												2194-5357	2194-5365	978-3-319-60366-7; 978-3-319-60365-0				2018	592						260	270		10.1007/978-3-319-60366-7_25							WOS:000448246000025						
C	Grakovski, A; Pilipovecs, A		Zamojski, W; Mazurkiewicz, J; Sugier, J; Walkowiak, T; Kacprzyk, J		Grakovski, Alexander; Pilipovecs, Alexey			The Problem of Tyre Footprint Width Estimation by Fibre Optic WIM Sensors in Condition of Geometric Complexity	DEPENDABILITY ENGINEERING AND COMPLEX SYSTEMS	Advances in Intelligent Systems and Computing				11th International Conference on Dependability and Complex Systems (DepCoS-RELCOMEX)	JUN 27-JUL 01, 2016	Brunow, POLAND	Wroclaw Univ Sci & Technol, Dept Comp Engn									Grakovski, Alexander/0000-0002-4400-4973												2194-5357		978-3-319-39639-2; 978-3-319-39638-5				2016	470						219	227		10.1007/978-3-319-39639-2_19							WOS:000389636200019						
C	Bova, VV; Kravchenko, YA; Kureichik, VV		Silhavy, R; Senkerik, R; Oplatkova, ZK; Prokopova, Z; Silhavy, P		Bova, V. V.; Kravchenko, Y. A.; Kureichik, V. V.			Development of Distributed Information Systems: Ontological Approach	SOFTWARE ENGINEERING IN INTELLIGENT SYSTEMS (CSOC2015), VOL 3	Advances in Intelligent Systems and Computing				4th Computer Science On-line Conference (CSOC)	APR 27-30, 2015	CZECH REPUBLIC									Kravchenko, Yury/Q-9390-2016; Kureichik, Vladimir/C-4977-2011	Kureichik, Vladimir/0000-0002-6260-4286												2194-5357		978-3-319-18473-9; 978-3-319-18472-2				2015	349						113	122		10.1007/978-3-319-18473-9_12							WOS:000368088400012						
C	Zhao, H; Zheng, ZB; Swanson, A; Weitlauf, A; Warren, Z; Sarkar, N	Nunes, IL			Zhao, Huan; Zheng, Zhaobo; Swanson, Amy; Weitlauf, Amy; Warren, Zachary; Sarkar, Nilanjan	Nunes, IL		Design of a Haptic Virtual System for Improving Fine Motor Skills in Children with Autism	ADVANCES IN HUMAN FACTORS AND SYSTEMS INTERACTION	Advances in Intelligent Systems and Computing				AHFE International Conference on Human Factors and System Interactions	JUL 17-21, 2017	Los Angeles, CA																						2194-5357	2194-5365	978-3-319-60366-7; 978-3-319-60365-0				2018	592						204	216		10.1007/978-3-319-60366-7_20							WOS:000448246000020						
C	Gu, HJ		Du, ZY		Gu Hongjiu			The Application of Image Recognition Technique in Candidate's Identity Authentication System	INTELLIGENCE COMPUTATION AND EVOLUTIONARY COMPUTATION	Advances in Intelligent Systems and Computing				International Conference of Intelligence Computation and Evolutionary Computation (ICEC 2012)	JUL 07, 2012	Wuhan, PEOPLES R CHINA	Informat Technol & Ind Engn Res Ctr																					2194-5357		978-3-642-31655-5				2013	180						475	480									WOS:000316302700067						
C	Lopez, J; Perez, D; Vaamonde, I; Paz, E; Vaamonde, A; Cabaleiro, J		Reis, LP; Moreira, AP; Lima, PU; Montano, L; MunozMartinez, V		Lopez, Joaquin; Perez, Diego; Vaamonde, Iago; Paz, Enrique; Vaamonde, Alba; Cabaleiro, Jorge			Building a Warehouse Control System Using RIDE	ROBOT 2015: SECOND IBERIAN ROBOTICS CONFERENCE: ADVANCES IN ROBOTICS, VOL 2	Advances in Intelligent Systems and Computing				2nd Iberian Robotics Conference (ROBOT)	NOV 19-21, 2015	Lisbon, PORTUGAL	Portuguese Soc Robot, Spanish Soc Res & Dev Robot, CEA, Robot Themat Grp								Domonte, Enrique Paz/AAA-5860-2019													2194-5357	2194-5365	978-3-319-27149-1; 978-3-319-27148-4				2016	418						757	768		10.1007/978-3-319-27149-1_59							WOS:000370653400059						
C	Spagnuelo, D; Lenzini, G		Rocha, A; Correia, AM; Adeli, H; Reis, LP; Teixeira, MM		Spagnuelo, Dayana; Lenzini, Gabriele			Patient-Centred Transparency Requirements for Medical Data Sharing Systems	NEW ADVANCES IN INFORMATION SYSTEMS AND TECHNOLOGIES, VOL 1	Advances in Intelligent Systems and Computing				World Conference on Information Systems and Technologies (WorldCIST)	MAR 22-24, 2016	Recife, BRAZIL										Spagnuelo, Dayana/0000-0001-6882-6480; Lenzini, Gabriele/0000-0001-8229-3270												2194-5357	2194-5365	978-3-319-31232-3; 978-3-319-31231-6				2016	444						1073	1083		10.1007/978-3-319-31232-3_102							WOS:000417258700102						
C	Gortz, M; do Nascimento, DE; Merkle, LE; Amaral, MA; Almeida, LDA		Ahram, T; Falcao, C		Gortz, Manuela; do Nascimento, Decio Estevao; Merkle, Luiz Ernesto; Amaral, Marilia Abrahao; Anhol Almeida, Leonelo Dell			Is Uber "Wild"? A Study of a Car Sharing Product-Service System (PSS) Under the Perspective of Cognition in the Wild	ADVANCES IN USABILITY AND USER EXPERIENCE, AHFE 2017	Advances in Intelligent Systems and Computing				International Conference on Usability and User Experience/8th International Conference on Applied Human Factors and Ergonomics (AHFE)	JUL 17-21, 2017	Los Angeles, CA									Amaral, Marilia A./D-2717-2009; Gortz, Manuela/AAK-8803-2021; merkle, luiz ernesto/C-6878-2014	Almeida, Leonelo/0000-0002-0222-9138; Abrahao Amaral, Marilia/0000-0001-9327-223X												2194-5357	2194-5365	978-3-319-60492-3; 978-3-319-60491-6				2018	607						392	404		10.1007/978-3-319-60492-3_38							WOS:000449661400038						
C	Alexandre, C; Balsa, J		Rocha, A; Correia, AM; Adeli, H; Reis, LP; Teixeira, MM		Alexandre, Claudio; Balsa, Joao			Integrating Client Profiling in an Anti-Money Laundering Multi-Agent Based System	NEW ADVANCES IN INFORMATION SYSTEMS AND TECHNOLOGIES, VOL 1	Advances in Intelligent Systems and Computing				World Conference on Information Systems and Technologies (WorldCIST)	MAR 22-24, 2016	Recife, BRAZIL									Alexandre, Claudio/U-6663-2017	Alexandre, Claudio/0000-0002-8852-2932												2194-5357	2194-5365	978-3-319-31232-3; 978-3-319-31231-6				2016	444						931	941		10.1007/978-3-319-31232-3_88							WOS:000417258700088						
C	Gonul-Sezer, ED; Ocak, Z		Obaidat, MS; Kacprzyk, J; Oren, T; Filipe, J		Gonul-Sezer, Eylul Damla; Ocak, Zeynep			Comparison of System Dynamics and Discrete Event Simulation Approaches	SIMULATION AND MODELING METHODOLOGIES, TECHNOLOGIES AND APPLICATIONS (SIMULTECH 2015)	Advances in Intelligent Systems and Computing				5th International Conference on Simulation and Modeling Methodologies, Technologies and Applications (SIMULTECH)	JUL 21-23, 2015	Colmar, FRANCE	Inst Syst & Technologies Informat Control & Commun, Univ Haute Alsace, Liophant Simulat & Simulat Team																					2194-5357	2194-5365	978-3-319-31295-8; 978-3-319-31294-1				2016	442						69	81		10.1007/978-3-319-31295-8_5							WOS:000386915200005						
C	Shinde, KD; Tarannum, S; Veerabhadrappa, T; Gagan, E; Kumar, PV		Saeed, K; Chaki, N; Pati, B; Bakshi, S; Mohapatra, DP		Shinde, Kunjan D.; Tarannum, Sayera; Veerabhadrappa, T.; Gagan, E.; Kumar, P. Vinay			Implementation of Low Cost, Reliable, and Advanced Control with Head Movement, Wheelchair for Physically Challenged People	PROGRESS IN ADVANCED COMPUTING AND INTELLIGENT ENGINEERING, VOL 2	Advances in Intelligent Systems and Computing				International Conference on Advanced Computing and Intelligent Engineering (ICACIE)	DEC 23-25, 2016	C.V. Raman Coll Engn, Bhubaneswar, INDIA	DRDO	C.V. Raman Coll Engn								Shinde, Kunjan/0000-0002-0064-2981												2194-5357	2194-5365	978-981-10-6875-1; 978-981-10-6874-4				2018	564						313	328		10.1007/978-981-10-6875-1_31							WOS:000452453900031						
C	Santos-Buitrago, B; Riesco, A; Knapp, M; Santos-Garcia, G; Talcott, C		FdezRiverola, F; Mohamad, MS; Rocha, M; DePaz, JF; Pinto, T		Santos-Buitrago, Beatriz; Riesco, Adrian; Knapp, Merrill; Santos-Garcia, Gustavo; Talcott, Carolyn			Reverse Inference in Symbolic Systems Biology	11TH INTERNATIONAL CONFERENCE ON PRACTICAL APPLICATIONS OF COMPUTATIONAL BIOLOGY & BIOINFORMATICS	Advances in Intelligent Systems and Computing				11th International Conference on Practical Applications of Computational Biology and Bioinformatics (PACBB)	JUN 21-23, 2017	Polytechn Porto, Porto, PORTUGAL	IBM, Univ Sevilla, Escuela Tecnica Super Ingn Informatica, Ingn Software Avanzado S A, Fundac Investigac Desarrollo Tecnologias Informac Andalucia, Univ Vigo, Univ Minho, Inst Educacao, Indra, IEEE Secc Espana, IEEE Syst, Man & Cybernet Soc, Portuguese Assoc Artificial Intelligence	Polytechn Porto							Riesco, Adrian/I-5959-2016	Riesco, Adrian/0000-0002-9716-4612												2194-5357	2194-5365	978-3-319-60816-7; 978-3-319-60815-0				2017	616						101	109		10.1007/978-3-319-60816-7_13							WOS:000465514300013						
C	Chen, J		Du, ZY		Chen, Juan			Analysis of Security Mechanism in Web Database Application System	INTELLIGENCE COMPUTATION AND EVOLUTIONARY COMPUTATION	Advances in Intelligent Systems and Computing				International Conference of Intelligence Computation and Evolutionary Computation (ICEC 2012)	JUL 07, 2012	Wuhan, PEOPLES R CHINA	Informat Technol & Ind Engn Res Ctr																					2194-5357		978-3-642-31655-5				2013	180						499	503									WOS:000316302700071						
C	Parera, N; Sanchez, D; Fornells, A; Boix, E; Molina, R		Stanton, NA; Landry, S; DiBucchianico, G; Vallicelli, A		Parera, Nuria; Sanchez, Daniel; Fornells, Alba; Boix, Eloi; Molina, Rene			Crash Testing High-Power Portable Traction System Device	ADVANCES IN HUMAN ASPECTS OF TRANSPORTATION	Advances in Intelligent Systems and Computing				International Conference on Human Factors in Transportation	JUL 27-31, 2016	FL																						2194-5357		978-3-319-41682-3; 978-3-319-41681-6				2017	484						1117	1127		10.1007/978-3-319-41682-3_91							WOS:000390836900091						
C	Al-Mahfoudh, MS; Gopalakrishnan, G; Stutsman, R		Rubin, SH; BouabanaTebibel, T		Al-Mahfoudh, Mohammed S.; Gopalakrishnan, Ganesh; Stutsman, Ryan			Operational Semantics for the Rigorous Analysis of Distributed Systems	QUALITY SOFTWARE THROUGH REUSE AND INTEGRATION	Advances in Intelligent Systems and Computing				4th IEEE International Workshop on Formal Methods Integration (FMi) held at 17th IEEE International Conference on Information Reuse and Integration (IRI)	JUL 27-30, 2016	Pittsburgh, PA	IEEE																					2194-5357	2194-5365	978-3-319-56157-8; 978-3-319-56156-1				2018	561						209	231		10.1007/978-3-319-56157-8_10							WOS:000457159200010						
