PT	AU	BA	BE	GP	AF	BF	CA	TI	SO	SE	BS	LA	DT	CT	CY	CL	SP	HO	DE	ID	AB	C1	RP	EM	RI	OI	FU	FX	CR	NR	TC	Z9	U1	U2	PU	PI	PA	SN	EI	BN	J9	JI	PD	PY	VL	IS	PN	SU	SI	MA	BP	EP	AR	DI	D2	EA	PG	WC	SC	GA	UT	PM	OA	HC	HP	DA
C	Zhang, J; Luo, DY		Du, Z		Zhang Jun; Luo Da-yong			Modeling and Application in Networked Control System Based on Predictive Functional Control with Incremented Weight	PROCEEDINGS OF THE 2012 INTERNATIONAL CONFERENCE OF MODERN COMPUTER SCIENCE AND APPLICATIONS	Advances in Intelligent Systems and Computing				International Conference of Modern Computer Science and Applications (MCSA 2012)	SEP 08, 2012	Wuhan, PEOPLES R CHINA	Informat Technol & Ind Engn Res Ctr																					2194-5357	2194-5365	978-3-642-33029-2; 978-3-642-33030-8				2013	191						151	158									WOS:000313841400025						
C	Rodda, S		Bhateja, V; LeNguyen, B; Nguyen, NG; Satapathy, SC; Le, DN		Rodda, Sireesha			Network Intrusion Detection Systems Using Neural Networks	INFORMATION SYSTEMS DESIGN AND INTELLIGENT APPLICATIONS, INDIA 2017	Advances in Intelligent Systems and Computing				4th International Conference on Information Systems Design and Intelligent Applications (INDIA)	JUN 15-17, 2017	Duy Tan Univ, Da Nang, VIETNAM		Duy Tan Univ							Jolugbo, Olajide/D-3216-2017; Rodda, Sireesha/AAK-3238-2021	Jolugbo, Olajide/0000-0001-6512-4117; Rodda, Sireesha/0000-0002-2776-1745												2194-5357	2194-5365	978-981-10-7512-4; 978-981-10-7511-7				2018	672						903	908		10.1007/978-981-10-7512-4_89							WOS:000456194600089						
C	Jain, Y; Juneja, M		Saeed, K; Chaki, N; Pati, B; Bakshi, S; Mohapatra, DP		Jain, Yakshita; Juneja, Mamta			A Novel Approach for Multimodal Biometric System Using Iris and PalmPrint	PROGRESS IN ADVANCED COMPUTING AND INTELLIGENT ENGINEERING, PROCEEDINGS OF ICACIE 2016, VOLUME 1	Advances in Intelligent Systems and Computing				International Conference on Advanced Computing and Intelligent Engineering (ICACIE)	DEC 23-25, 2016	C.V. Raman Coll Engn, Bhubaneswar, INDIA	DRDO	C.V. Raman Coll Engn								Juneja, Mamta/0000-0002-2611-9005												2194-5357	2194-5365	978-981-10-6872-0; 978-981-10-6871-3				2018	563						79	88		10.1007/978-981-10-6872-0_8							WOS:000450831300008						
C	Benjamen, LHY; Ang, MH		Lee, S; Cho, HS; Yoon, KJ; Lee, JM		Benjamen, Lim Han Yang; Ang, Marcelo H., Jr.			Design of a Sensing Limited Autonomous Robotic System	INTELLIGENT AUTONOMOUS SYSTEMS 12, VOL 1	Advances in Intelligent Systems and Computing				12th International Conference of Intelligent Autonomous Systems	JUN 26-29, 2012	Jeju, SOUTH KOREA									Ang, Marcelo H/B-4469-2010	Ang, Marcelo H/0000-0001-8277-6408												2194-5357		978-3-642-33925-7; 978-3-642-33926-4				2013	193						641	+									WOS:000313842700061						
C	Zou, H; Zhang, XP; Yang, YX; Wang, X		Du, ZY		Zou Huan; Zhang Xueping; Yang Yanxin; Wang Xin			The Demonstrating and Monitoring Software of Robot Control System	INTELLIGENCE COMPUTATION AND EVOLUTIONARY COMPUTATION	Advances in Intelligent Systems and Computing				International Conference of Intelligence Computation and Evolutionary Computation (ICEC 2012)	JUL 07, 2012	Wuhan, PEOPLES R CHINA	Informat Technol & Ind Engn Res Ctr																					2194-5357		978-3-642-31655-5				2013	180						117	123									WOS:000316302700017						
C	Saber, M; El Farissi, I; Chadli, S; Emharraf, M; Belkasmi, MG		Rocha, A; Serrhini, M; Felgueiras, C		Saber, Mohammed; El Farissi, Ilhame; Chadli, Sara; Emharraf, Mohamed; Belkasmi, Mohammed Ghaouth			Performance Analysis of an Intrusion Detection Systems Based of Artificial Neural Network	EUROPE AND MENA COOPERATION ADVANCES IN INFORMATION AND COMMUNICATION TECHNOLOGIES	Advances in Intelligent Systems and Computing				Europe, Middle East and North Africa Conference on Technology and Security to Support Learning (EMENA-TSSL)	OCT 03-05, 2016	Oujda, MOROCCO									emharraf, mohamed/ABG-3384-2020; BELKASMI, Mohammed Ghaouth/P-4061-2015; FARISSI, Ilhame EL/D-4110-2016; SABER, Mohammed/L-7821-2014; CHADLI, Sara/B-2534-2017	emharraf, mohamed/0000-0002-9361-3927; BELKASMI, Mohammed Ghaouth/0000-0002-2623-4484; FARISSI, Ilhame EL/0000-0003-4645-2355; SABER, Mohammed/0000-0002-6537-4359; CHADLI, Sara/0000-0001-9442-2703												2194-5357		978-3-319-46568-5; 978-3-319-46567-8				2017	520						511	521		10.1007/978-3-319-46568-5_52							WOS:000392196900052						
C	Jayaraman, M; Sreedevi, VT		Dash, SS; Das, S; Panigrahi, BK		Jayaraman, Meenakshi; Sreedevi, V. T.			FPGA Implementation of a Passive Filter for Harmonic Reduction in Inverter Outputs in PV-Based Renewable Energy Systems	INTERNATIONAL CONFERENCE ON INTELLIGENT COMPUTING AND APPLICATIONS, ICICA 2016	Advances in Intelligent Systems and Computing				3rd International Conference on Intelligent Computing and Applications (ICICA)	DEC 21-22, 2016	D Y Patil Coll Engn, Akurdi, INDIA	IRD	D Y Patil Coll Engn							Jayaraman, Meenakshi/AAC-1183-2021													2194-5357	2194-5365	978-981-10-5520-1; 978-981-10-5519-5				2018	632						501	514		10.1007/978-981-10-5520-1_46							WOS:000436504300046						
C	Kabashkin, I		Zamojski, W; Mazurkiewicz, J; Sugier, J; Walkowiak, T; Kacprzyk, J		Kabashkin, Igor			Effectiveness of Redundancy in Communication Network of Air Traffic Management System	DEPENDABILITY ENGINEERING AND COMPLEX SYSTEMS	Advances in Intelligent Systems and Computing				11th International Conference on Dependability and Complex Systems (DepCoS-RELCOMEX)	JUN 27-JUL 01, 2016	Brunow, POLAND	Wroclaw Univ Sci & Technol, Dept Comp Engn								Kabashkin, Igor/F-8927-2011	Kabashkin, Igor/0000-0003-4004-6620												2194-5357	2194-5365	978-3-319-39639-2; 978-3-319-39638-5				2016	470						257	265		10.1007/978-3-319-39639-2_22							WOS:000389636200022						
C	Brogan, DS; Basu, D; Lohani, VK		Auer, ME; Kim, KS		Brogan, Daniel S.; Basu, Debarati; Lohani, Vinod K.			A Virtual Learning System in Environmental Monitoring	ENGINEERING EDUCATION FOR A SMART SOCIETY	Advances in Intelligent Systems and Computing				World Engineering Education Forum (WEEF) / Global Engineering Deans Council (GEDC)	NOV 06-10, 2016	Seoul, SOUTH KOREA	Korea Soc Engn Educ, Korea Engn Deans Council																					2194-5357	2194-5365	978-3-319-60937-9; 978-3-319-60936-2				2018	627						352	367		10.1007/978-3-319-60937-9_27							WOS:000451586800027						
C	Naveen, S; Moni, RS		Berretti, S; Thampi, SM; Srivastava, PR		Naveen, S.; Moni, R. S.			Contourlet and Fourier Transform Features Based 3D Face Recognition System	INTELLIGENT SYSTEMS TECHNOLOGIES AND APPLICATIONS, VOL 1	Advances in Intelligent Systems and Computing				International Symposium on Intelligent Systems Technologies and Applications (ISTA)	AUG 10-13, 2015	SCMS Grp Inst, SCMS Sch Engn & Technol, Kochi, INDIA		SCMS Grp Inst, SCMS Sch Engn & Technol																				2194-5357	2194-5365	978-3-319-23036-8; 978-3-319-23035-1				2016	384						411	425		10.1007/978-3-319-23036-8_36							WOS:000381427400036						
C	Kupriyashin, MA; Borzunov, GI		Samsonovich, AV; Klimov, VV		Kupriyashin, Mikhail A.; Borzunov, Georgii I.			Algorithmic Foundation for Benchmarking of Computational Platforms Running Asymmetric Cipher Systems	BIOLOGICALLY INSPIRED COGNITIVE ARCHITECTURES (BICA) FOR YOUNG SCIENTISTS	Advances in Intelligent Systems and Computing				1st International Early Research Career Enhancement School on Biologically Inspired Cognitive Architectures and Cybersecurity (FIERCES)	AUG 01-06, 2017	Moscow, RUSSIA	BICA Soc, Russian Assoc Artificial Intelligence																					2194-5357	2194-5365	978-3-319-63940-6; 978-3-319-63939-0				2018	636						276	281		10.1007/978-3-319-63940-6_39							WOS:000454681600039						
C	Epelde, G; Mujika, A; Leskovsky, P; De Mauro, A		Herrero, A; Baruque, B; Sedano, J; Quintian, H; Corchado, E		Epelde, Gorka; Mujika, Andoni; Leskovsky, Peter; De Mauro, Alessandro			Public Access Architecture Design of an FPGA-Hardware-Based Nervous System Emulation Remote Lab	INTERNATIONAL JOINT CONFERENCE: CISIS'15 AND ICEUTE'15	Advances in Intelligent Systems and Computing				8th International Conf on Computational Intelligence in Security for Information Systems / 6th International Conf on EUropean Transnational Education	JUN, 2015	Burgos, SPAIN	IEEE Spain Sect, IEEE Syst, Man & Cybernet Spanish Chapter, Int Federat Computat Log								Leskovsky, Peter/J-2474-2019; Unanue, Gorka Epelde/B-8899-2018	Leskovsky, Peter/0000-0003-4215-051X; Epelde, Gorka/0000-0002-5179-415X; De Mauro, Alessandro/0000-0003-3314-197X												2194-5357	2194-5365	978-3-319-19713-5; 978-3-319-19712-8				2015	369						559	569		10.1007/978-3-319-19713-5_49							WOS:000365128500049						
C	Tudoroiu, N; Elefterie, L; Tudoroiu, ER; Kecs, W; Dobritoiu, M; Ilias, N		Swiatek, J; Wilimowska, Z; Borzemski, L; Grzech, A		Tudoroiu, Nicolae; Elefterie, Liana; Tudoroiu, Elena-Roxana; Kecs, Wilhelm; Dobritoiu, Maria; Ilias, Nicolae			Real-Time Sliding Mode Observer Estimator Integration in Hybrid Electric Vehicles Battery Management Systems	INFORMATION SYSTEMS ARCHITECTURE AND TECHNOLOGY - ISAT 2016 - PT III	Advances in Intelligent Systems and Computing				37th International Conference on Information Systems Architecture and Technology (ISAT)	SEP 18-20, 2016	Karpacz, POLAND	Wroclaw Univ Sci & Technol, Dept Comp Sci, Wroclaw Univ Sci & Technol, Dept Management Syst								Andras, Iosif/AAC-5607-2019; Dobritoiu, Maria/AAC-5338-2019; Tudoroiu, Nicolae/A-4678-2008; Nikolae, Ilias/P-2065-2018	Andras, Iosif/0000-0003-0903-7611; Dobritoiu, Maria/0000-0003-4606-2613; Nikolae, Ilias/0000-0001-7514-0129												2194-5357	2194-5365	978-3-319-46589-0; 978-3-319-46588-3				2017	523						15	28		10.1007/978-3-319-46589-0_2							WOS:000392269500002						
C	Schlette, C; Rossmann, J		Rodic, A; Borangiu, T		Schlette, Christian; Rossmann, Juergen			Model-Based Development of Robotic Systems and Services in Construction Robotics	ADVANCES IN ROBOT DESIGN AND INTELLIGENT CONTROL	Advances in Intelligent Systems and Computing				25th International Conference on Robotics in Alpe-Adria-Danube Region (RAAD)	JUN 30-JUL 02, 2016	Belgrade, SERBIA									Schlette, Christian/R-8662-2018	Schlette, Christian/0000-0003-1676-4374												2194-5357		978-3-319-49058-8; 978-3-319-49057-1				2017	540						560	567		10.1007/978-3-319-49058-8_61							WOS:000413022000061						
C	Mannepalli, K; Sastry, PN; Suman, M		Satapathy, SC; Bhateja, V; Udgata, SK; Pattnaik, PK		Mannepalli, Kasiprasad; Sastry, Panyam Narahari; Suman, Maloji			Accent Recognition System Using Deep Belief Networks for Telugu Speech Signals	PROCEEDINGS OF THE 5TH INTERNATIONAL CONFERENCE ON FRONTIERS IN INTELLIGENT COMPUTING: THEORY AND APPLICATIONS, FICTA 2016, VOL 1	Advances in Intelligent Systems and Computing				5th International Conference on Frontiers in Intelligent Computing - Theory and Applications (FICTA)	SEP 16-17, 2016	KIIT Univ, Sch Comp Engn, Bhubaneswar, INDIA		KIIT Univ, Sch Comp Engn							mannepalli, kasiprasad/AAG-3197-2019; Mannepalli, kasiprasad/U-5190-2018; Sastry, Panyam/AAO-7032-2020	mannepalli, kasiprasad/0000-0003-1500-7718; Mannepalli, kasiprasad/0000-0003-1500-7718; Sastry, Panyam/0000-0001-5679-2674												2194-5357	2194-5365	978-981-10-3153-3; 978-981-10-3152-6				2017	515						99	105		10.1007/978-981-10-3153-3_10							WOS:000425536200010						
C	Wnuk, M; Przesmycki, R		Arezes, P		Wnuk, Marian; Przesmycki, Rafal			Soldier Protection of Staying in the Radiated Field Generated by Antenna of Selected Military Communications Systems	ADVANCES IN SAFETY MANAGEMENT AND HUMAN FACTORS, AHFE 2017	Advances in Intelligent Systems and Computing				8th International Conference on Applied Human Factors and Ergonomics and the Affiliated Conferences (AHFE) / International Conference on Safety Management and Human Factors	JUL 17-21, 2017	Los Angeles, CA									Przesmycki, Rafal/U-9532-2018	Przesmycki, Rafal/0000-0003-0396-2451; Wnuk, Marian/0000-0003-4576-4023												2194-5357	2194-5365	978-3-319-60525-8; 978-3-319-60524-1				2018	604						236	247		10.1007/978-3-319-60525-8_25							WOS:000465512600025						
C	Sowmya, BJ; Chetan; Kumar, DP; Srinivasa, KG		Satapathy, SC; Bhateja, V; Udgata, SK; Pattnaik, PK		Sowmya, B. J.; Chetan; Kumar, D. Pradeep; Srinivasa, K. G.			Paving the Future of Vehicle Maintenance, Breakdown Assistance and Weather Prediction Using IoT in Automobiles	PROCEEDINGS OF THE 5TH INTERNATIONAL CONFERENCE ON FRONTIERS IN INTELLIGENT COMPUTING: THEORY AND APPLICATIONS, FICTA 2016, VOL 1	Advances in Intelligent Systems and Computing				5th International Conference on Frontiers in Intelligent Computing - Theory and Applications (FICTA)	SEP 16-17, 2016	KIIT Univ, Sch Comp Engn, Bhubaneswar, INDIA		KIIT Univ, Sch Comp Engn							BJ, Sowmya/AAD-2709-2021; D, Pradeep Kumar/AAD-5337-2021	BJ, Sowmya/0000-0003-2080-8325; KG, Srinivasa/0000-0003-1022-8431												2194-5357	2194-5365	978-981-10-3153-3; 978-981-10-3152-6				2017	515						693	702		10.1007/978-981-10-3153-3_69							WOS:000425536200069						
C	Gagolewski, M; Lasek, J		Filev, D; Jablkowski, J; Kacprzyk, J; Krawczak, M; Popchev, I; Rutkowski, L; Sgurev, V; Sotirova, E; Szynkarczyk, P; Zadrozny, S		Gagolewski, Marek; Lasek, Jan			The Use of Fuzzy Relations in the Assessment of Information Resources Producers' Performance	INTELLIGENT SYSTEMS'2014, VOL 2: TOOLS, ARCHITECTURES, SYSTEMS, APPLICATIONS	Advances in Intelligent Systems and Computing				7th IEEE International Conference on Intelligent Systems (IEEE IS)	SEP 24-26, 2014	Warsaw, POLAND	Polish Acad Sci, Syst Res Inst, Polish Acad Sci, Dept IV Engn Sci, Ind Inst Automat & Measurements, Inst Elect & Elect Engineers, Poland Sect, Computat Intelligence Soc, Polish Operat & Syst Res Soc, Inst Elect Elect Engineers Syst, Man & Cybernet Soc, Inst Elect Elect Engineers Computat Intelligence Soc, Polish Neural Network Soc, Polish Assoc Artificial Intelligence, Inst Elect Elect Engineers								Gagolewski, Marek/C-3575-2012	Gagolewski, Marek/0000-0003-0637-6028												2194-5357		978-3-319-11309-8				2015	323						289	300		10.1007/978-3-319-11310-4_25							WOS:000360203500025						
C	Yeo, H; Lau, PY; Park, SK		PhonAmnuaisuk, S; Au, TW; Omar, S		Yeo, Hexi; Lau, Phooi Yee; Park, Sung-Kwon			Mobile mBus System Using Near Field Communication	COMPUTATIONAL INTELLIGENCE IN INFORMATION SYSTEMS, CIIS 2016	Advances in Intelligent Systems and Computing				Conference on Computational Intelligence in Information Systems (CIIS)	2016	BRUNEI	Univ Teknologi Brunei, Sch Comp & Informat, Int Neural Network Soc, KAIST, Brain Sci Res Ctr, Asia Pacific Neural Network Soc, CISCO, Google Developer Grp Brunei, BAG Networks								Park, Sungkwon/AAJ-2209-2021													2194-5357		978-3-319-48517-1; 978-3-319-48516-4				2017	532						72	80		10.1007/978-3-319-48517-1_7							WOS:000405210000007						
C	Fass, D; Gechter, F	Nunes, IL			Fass, Didier; Gechter, Franck	Nunes, IL		Virtual Environments Integrative Design - From Human-in-the-Loop to Bio-Cyber-Physical Systems	ADVANCES IN HUMAN FACTORS AND SYSTEMS INTERACTION	Advances in Intelligent Systems and Computing				AHFE International Conference on Human Factors and System Interactions	JUL 17-21, 2017	Los Angeles, CA																						2194-5357	2194-5365	978-3-319-60366-7; 978-3-319-60365-0				2018	592						168	176		10.1007/978-3-319-60366-7_16							WOS:000448246000016						
C	Chen, K; Zhou, LJ; Yuan, CH		Xhafa, F; Patnaik, S; Yu, Z		Chen Kai; Zhou Lujun; Yuan Chenghong			Information Navigation System of Pulse Radar Employing Augmented Reality	RECENT DEVELOPMENTS IN INTELLIGENT SYSTEMS AND INTERACTIVE APPLICATIONS (IISA2016)	Advances in Intelligent Systems and Computing				International Conference on Intelligent and Interactive Systems and Applications (IISA)	JUN 25-26, 2016	Shanghai, PEOPLES R CHINA																						2194-5357		978-3-319-49568-2; 978-3-319-49567-5				2017	541						460	465		10.1007/978-3-319-49568-2_65							WOS:000400685600065						
C	Garipova, J; Georgiev, A; Papanchev, T; Nikolov, N; Zlatev, D		Abraham, A; Kovalev, S; Tarassov, V; Snasel, V; Vasileva, M; Sukhanov, A		Garipova, Julia; Georgiev, Anton; Papanchev, Toncho; Nikolov, Nikolay; Zlatev, Dimitar			Operational Reliability Assessment of Systems Containing Electronic Elements	PROCEEDINGS OF THE SECOND INTERNATIONAL SCIENTIFIC CONFERENCE INTELLIGENT INFORMATION TECHNOLOGIES FOR INDUSTRY (IITI'17), VOL 2	Advances in Intelligent Systems and Computing				2nd International Scientific Conference on Intelligent Information Technologies for Industry (IITI)	SEP 14-16, 2017	Varna, BULGARIA	Tech Univ Varna, Tech Univ Sofia, VSB Tech Univ Ostrava, Rostov State Transport Univ								Papanchev, Toncho/V-5682-2017	Papanchev, Toncho/0000-0003-0672-3309; Georgiev, Anton/0000-0003-4363-2852; Garipova, Julia/0000-0002-1218-7197												2194-5357	2194-5365	978-3-319-68324-9				2018	680						340	348		10.1007/978-3-319-68324-9_37							WOS:000585075400037						
C	Sahu, RK; Rout, UK; Panda, S		Satapathy, SC; Udgata, SK; Biswal, BN		Sahu, Rabindra Kumar; Rout, Umesh Kumar; Panda, Sidhartha			Sensitivity Analysis of Load-Frequency Control of Power System Using Gravitational Search Algorithm	PROCEEDINGS OF THE INTERNATIONAL CONFERENCE ON FRONTIERS OF INTELLIGENT COMPUTING: THEORY AND APPLICATIONS (FICTA) 2013	Advances in Intelligent Systems and Computing				2nd International Conference on Frontiers in Intelligent Computing - Theory and Applications (FICTA)	NOV 14-16, 2013	Bhubaneswar, INDIA	Bhubaneswar Engn Coll									Panda, Sidhartha/0000-0003-0673-8615; Sahu, Rabindra Kumar/0000-0002-2873-8133												2194-5357	2194-5365	978-3-319-02931-3; 978-3-319-02930-6				2014	247						249	258		10.1007/978-3-319-02931-3_28							WOS:000339490600028						
C	Jasinski, M; Maczak, J; Szulim, P; Radkowski, S		Szewczyk, R; Zielinski, C; Kaliczynska, M		Jasinski, Marcin; Maczak, Jedrzej; Szulim, Przemyslaw; Radkowski, Stanislaw			Autonomous Agricultural Robot - Testing of the Vision System for Plants/Weed Classification	AUTOMATION 2018: ADVANCES IN AUTOMATION, ROBOTICS AND MEASUREMENT TECHNIQUES	Advances in Intelligent Systems and Computing				International Conference on Automation	MAR 21-23, 2018	Warsaw, POLAND									Maczak, Jedrzej/F-1178-2013; Jasinski, Marcin/T-3113-2018	Maczak, Jedrzej/0000-0002-5460-5588; Szulim, Przemyslaw/0000-0002-1052-3900; Jasinski, Marcin/0000-0002-4434-8856												2194-5357	2194-5365	978-3-319-77179-3; 978-3-319-77178-6				2018	743						473	482		10.1007/978-3-319-77179-3_44							WOS:000462745200044						
C	Walek, B; Pektor, O; Farana, R		Silhavy, R; Senkerik, R; Oplatkova, ZK; Silhavy, P; Prokopova, Z		Walek, Bogdan; Pektor, Ondrej; Farana, Radim			Proposal of the Web Application for Selection of Suitable Job Applicants Using Expert System	SOFTWARE ENGINEERING PERSPECTIVES AND APPLICATION IN INTELLIGENT SYSTEMS, VOL 2	Advances in Intelligent Systems and Computing				5th Computer Science On-line Conference (CSOC)	APR 27-30, 2016	Prague, ELECTR NETWORK									Farana, Radim/D-6856-2014	Farana, Radim/0000-0002-1930-4560; Walek, Bogdan/0000-0003-1119-0420												2194-5357		978-3-319-33622-0; 978-3-319-33620-6				2016	465						363	373		10.1007/978-3-319-33622-0_33							WOS:000385788200033						
C	Vishwakarma, DK; Gautam, J; Singh, K		Reddy, MS; Viswanath, K; Prasad, KMS		Vishwakarma, Dinesh Kumar; Gautam, Jaya; Singh, Kuldeep			A Robust Framework for the Recognition of Human Action and Activity Using Spatial Distribution Gradients and Gabor Wavelet	INTERNATIONAL PROCEEDINGS ON ADVANCES IN SOFT COMPUTING, INTELLIGENT SYSTEMS AND APPLICATIONS, ASISA 2016	Advances in Intelligent Systems and Computing				International Conference on Advances in Soft Computing, Intelligent Systems and Applications (ASISA)	2016	Bangalore, INDIA	R L Jalappa Inst Technol, ARPVGSI, IEEE Robot & Automat Soc								Vishwakarma, Dinesh/L-3815-2018	Vishwakarma, Dinesh/0000-0002-1026-0047												2194-5357	2194-5365	978-981-10-5272-9; 978-981-10-5271-2				2018	628						103	113		10.1007/978-981-10-5272-9_10							WOS:000451046800010						
C	Kemper, P; Tetzlaff, T; Witkowski, U; Zandian, R; Mamrot, M; Marchlewitz, S; Nicklas, JP; Winzer, P		Kim, JH; Karray, F; Jo, J; Sincak, P; Myung, H		Kemper, Philipp; Tetzlaff, Thomas; Witkowski, Ulf; Zandian, Reza; Mamrot, Michel; Marchlewitz, Stefan; Nicklas, Jan-Peter; Winzer, Petra			Small-Size Robot Platform as Test and Validation Tool for the Development of Mechatronic Systems	ROBOT INTELLIGENCE TECHNOLOGY AND APPLICATIONS 4	Advances in Intelligent Systems and Computing				4th International Conference on Robot Intelligence Technology and Applications (RiTA)	DEC 14-16, 2015	Bucheon, SOUTH KOREA																						2194-5357	2194-5365	978-3-319-31293-4; 978-3-319-31291-0				2017	447						383	396		10.1007/978-3-319-31293-4_31							WOS:000386604600031						
C	Kumar, LVS; Kumar, GVN; Anusha, D		Behera, HS; Mohapatra, DP		Kumar, L. V. Suresh; Kumar, G. V. Nagesh; Anusha, D.			PSO Based Tuning of a Integral and Proportional Integral Controller for a Closed Loop Stand Alone Multi Wind Energy System	COMPUTATIONAL INTELLIGENCE IN DATA MINING, VOL 1, CIDM 2015	Advances in Intelligent Systems and Computing				2nd International Conference on Computational Intelligence in Data Mining (ICCIDM)	DEC 05-06, 2015	Bhubaneswar, INDIA	Roland Inst Technol								Gundavarapu, Venkata Nagesh Kumar/H-5111-2016	Gundavarapu, Venkata Nagesh Kumar/0000-0002-9298-7708												2194-5357	2194-5365	978-81-322-2734-2; 978-81-322-2732-8				2016	410						399	409		10.1007/978-81-322-2734-2_40							WOS:000369718100040						
C	Mahmoud, R; El-Bendary, N; Mokhtar, HMO; Hassanien, AE; Shaheen, HA		Abraham, A; Jiang, XH; Snasel, V; Pan, JS		Mahmoud, Rehab; El-Bendary, Nashwa; Mokhtar, Hoda M. O.; Hassanien, Aboul Ella; Shaheen, Hala A.			Machine Learning-Based Measurement System for Spinal Cord Injuries Rehabilitation Length of Stay	INTELLIGENT DATA ANALYSIS AND APPLICATIONS	Advances in Intelligent Systems and Computing				2nd Euro-China Conference on Intelligent Data Analysis and Applications (ECC)	2015	Tech Univ Ostrava, Ostrava, CZECH REPUBLIC	Fujian Univ Technol	Tech Univ Ostrava							Hassanien, Aboul ella/O-5672-2014; Mokhtar, Hoda/ABC-7225-2020	Hassanien, Aboul ella/0000-0002-9989-6681; El-Bendary, Nashwa/0000-0001-6553-4159												2194-5357	2194-5365	978-3-319-21206-7; 978-3-319-21205-0				2015	370						523	534		10.1007/978-3-319-21206-7_45							WOS:000365130300045						
C	Badidi, E; Routaib, H		Silhavy, R; Silhavy, P; Prokopova, Z		Badidi, Elarbi; Routaib, Hayat			A DaaS Based Framework for IoT Data Provisioning	CYBERNETICS APPROACHES IN INTELLIGENT SYSTEMS: COMPUTATIONAL METHODS IN SYSTEMS AND SOFTWARE 2017, VOL. 1	Advances in Intelligent Systems and Computing				Conference on Computational Methods in Systems and Software (CoMeSySo)	SEP 12-14, 2017	Vsetin, CZECH REPUBLIC	OpenPublish eu s r o									Badidi, Elarbi/0000-0001-9121-8766												2194-5357	2194-5365	978-3-319-67618-0				2018	661						369	379		10.1007/978-3-319-67618-0_34							WOS:000430738700034						
C	Pancerz, K		Burduk, R; Jackowski, K; Kurzynski, M; Wozniak, M; Zolnierek, A		Pancerz, Krzysztof			Decision Rules in Simple Decision Systems over Ontological Graphs	PROCEEDINGS OF THE 8TH INTERNATIONAL CONFERENCE ON COMPUTER RECOGNITION SYSTEMS CORES 2013	Advances in Intelligent Systems and Computing				8th International Conference on Computer Recognition Systems (CORES)	MAY 25-27, 2013	Wroclaw, POLAND										Pancerz, Krzysztof/0000-0002-5452-6310												2194-5357	2194-5365	978-3-319-00969-8; 978-3-319-00968-1				2013	226						111	120		10.1007/978-3-319-00969-8_11							WOS:000354284200011						
C	Kociszewski, R		Szewczyk, R; Zielinski, C; Kaliczynska, M		Kociszewski, Rafal			Output Controllability Problem of Fractional Discrete-Time Systems with Multiple Delays in State and Control Vector	AUTOMATION 2018: ADVANCES IN AUTOMATION, ROBOTICS AND MEASUREMENT TECHNIQUES	Advances in Intelligent Systems and Computing				International Conference on Automation	MAR 21-23, 2018	Warsaw, POLAND																						2194-5357	2194-5365	978-3-319-77179-3; 978-3-319-77178-6				2018	743						203	212		10.1007/978-3-319-77179-3_19							WOS:000462745200019						
C	Sharma, KR; Honc, D; Dusek, F		Abraham, A; Jiang, XH; Snasel, V; Pan, JS		Sharma, K. Rahul; Honc, Daniel; Dusek, Frantisek			Model Predictive Control of Trajectory Tracking of Differentially Steered Mobile Robot	INTELLIGENT DATA ANALYSIS AND APPLICATIONS	Advances in Intelligent Systems and Computing				2nd Euro-China Conference on Intelligent Data Analysis and Applications (ECC)	2015	Tech Univ Ostrava, Ostrava, CZECH REPUBLIC	Fujian Univ Technol	Tech Univ Ostrava							Dusek, Frantisek/T-1365-2018	Dusek, Frantisek/0000-0002-6549-3112; Sharma K., Rahul/0000-0003-2240-7576												2194-5357	2194-5365	978-3-319-21206-7; 978-3-319-21205-0				2015	370						85	95		10.1007/978-3-319-21206-7_8							WOS:000365130300008						
C	Iqbal, M; Ngo, TD		Menegatti, E; Michael, N; Berns, K; Yamaguchi, H		Iqbal, Muhammad; Trung Dung Ngo			On the Formation Control of Multiagent Systems Under Nearly Cyclic Pursuit	INTELLIGENT AUTONOMOUS SYSTEMS 13	Advances in Intelligent Systems and Computing				13th International Conference on Intelligent Autonomous Systems (IAS)	JUL 15-18, 2014	Centro Congressi Padova, Padova, ITALY	Univ Padova	Centro Congressi Padova																				2194-5357		978-3-319-08338-4; 978-3-319-08337-7				2016	302						551	562		10.1007/978-3-319-08338-4_41							WOS:000377956900041						
