PT	AU	BA	BE	GP	AF	BF	CA	TI	SO	SE	BS	LA	DT	CT	CY	CL	SP	HO	DE	ID	AB	C1	RP	EM	RI	OI	FU	FX	CR	NR	TC	Z9	U1	U2	PU	PI	PA	SN	EI	BN	J9	JI	PD	PY	VL	IS	PN	SU	SI	MA	BP	EP	AR	DI	D2	EA	PG	WC	SC	GA	UT	PM	OA	HC	HP	DA
C	Katin, V; Kosygin, V; Akhtiamov, M; Vol'khin, I		Murgul, V; Popovic, Z		Katin, Viktor; Kosygin, Vladimir; Akhtiamov, Midkhat; Vol'khin, Igor			Mathematical Models of the Output of Major Pollutants in the Process of Burning Water Fuel Oil Emulsions in Boiler Plants	INTERNATIONAL SCIENTIFIC CONFERENCE ENERGY MANAGEMENT OF MUNICIPAL TRANSPORTATION FACILITIES AND TRANSPORT, EMMFT 2017	Advances in Intelligent Systems and Computing				19th International Scientific Conference on Energy Management of Municipal Transportation Facilities and Transport (EMMFT)	APR 10-13, 2017	Far Eastern State Transport Univ, Khabarovsk, RUSSIA		Far Eastern State Transport Univ							Kosygin, Vladimir/O-7830-2019; Kosygin, Vladimir/J-3188-2018	Kosygin, Vladimir/0000-0003-0550-9845												2194-5357	2194-5365	978-3-319-70987-1; 978-3-319-70986-4				2018	692						987	997		10.1007/978-3-319-70987-1_107							WOS:000436502300107						
C	Mustapha, Z; Aigbavboa, C; Thwala, W		Arezes, P		Mustapha, Zakari; Aigbavboa, Clinton; Thwala, Wellington			Examination of Occupational Health and Safety Practices in Ghana	ADVANCES IN SAFETY MANAGEMENT AND HUMAN FACTORS, AHFE 2017	Advances in Intelligent Systems and Computing				8th International Conference on Applied Human Factors and Ergonomics and the Affiliated Conferences (AHFE) / International Conference on Safety Management and Human Factors	JUL 17-21, 2017	Los Angeles, CA									Aigbavboa, Clinton/AAS-6493-2020; Mustapha, Zakari/AAT-6902-2020	Aigbavboa, Clinton/0000-0003-2866-3706; Thwala, Wellington Didibhuku/0000-0002-8848-7823												2194-5357	2194-5365	978-3-319-60525-8; 978-3-319-60524-1				2018	604						403	409		10.1007/978-3-319-60525-8_42							WOS:000465512600042						
C	Fernandes, RAS; Deus, LO; Gomes, L; Valel, Z		Omatu, S; Rodriguez, S; Villarrubia, G; Faria, P; Sitek, P; Prieto, J		Fernandes, R. A. S.; Deus, L. O.; Gomes, L.; Valel, Z.			Statistics-Based Approach to Enable Consumer Profile Definition for Demand Response Programs	DISTRIBUTED COMPUTING AND ARTIFICIAL INTELLIGENCE	Advances in Intelligent Systems and Computing				14th International Symposium on Distributed Computing and Artificial Intelligence (DCAI)	JUN 21-23, 2017	Porto, PORTUGAL	Osaka Inst Technol, Polytechn Porto, Univ Salamanca, IBM, Indra, IEEE Syst Man & Cybernet Soc Spain								Fernandes, Ricardo Augusto Souza/Q-9771-2019; ZitaVale, Zita-mail/AAW-9088-2021; Vale, Zita/N-1643-2019	Fernandes, Ricardo Augusto Souza/0000-0003-2361-6505; Vale, Zita/0000-0002-4560-9544; Gomes, Luis/0000-0002-8597-3383												2194-5357	2194-5365	978-3-319-62410-5				2018	620						63	70		10.1007/978-3-319-62410-5_8							WOS:000426343700008						
C	Janardhanan, MN; Li, ZX; Nielsen, P; Tang, QH		Omatu, S; Rodriguez, S; Villarrubia, G; Faria, P; Sitek, P; Prieto, J		Janardhanan, Mukund Nilakantan; Li, Zixiang; Nielsen, Peter; Tang, Qiuhua			Artificial bee colony algorithms for two-sided assembly line worker assignment and balancing problem	DISTRIBUTED COMPUTING AND ARTIFICIAL INTELLIGENCE	Advances in Intelligent Systems and Computing				14th International Symposium on Distributed Computing and Artificial Intelligence (DCAI)	JUN 21-23, 2017	Porto, PORTUGAL	Osaka Inst Technol, Polytechn Porto, Univ Salamanca, IBM, Indra, IEEE Syst Man & Cybernet Soc Spain								Li, Zixiang/AAY-6080-2020	Li, Zixiang/0000-0002-8570-8862; Janardhanan, Mukund Nilakantan/0000-0002-8170-2738; Nielsen, Peter/0000-0002-4882-7942												2194-5357	2194-5365	978-3-319-62410-5				2018	620						11	18		10.1007/978-3-319-62410-5_2							WOS:000426343700002						
C	Zhang, MZ; Andrew, S; Warnaby, G; Gill, S		Rebelo, F; Soares, M		Zhang, Minzhi; Andrew, Sonja; Warnaby, Gary; Gill, Simeon			Exploring the Impact of Lifestyle on Fashion Consumption Behaviour for Older Chinese Women	ADVANCES IN ERGONOMICS IN DESIGN	Advances in Intelligent Systems and Computing				International Conference on Ergonomics in Design	JUL 27-31, 2016	FL										Gill, Simeon/0000-0002-5719-7516												2194-5357	2194-5365	978-3-319-41983-1; 978-3-319-41982-4				2016	485						345	357		10.1007/978-3-319-41983-1_31							WOS:000389646200031						
C	Costa, P; Lima, J; Pereira, AI; Costa, P; Pinto, A		Abraham, A; WegrzynWolska, K; Hassanien, AE; Snasel, V; Alimi, AM		Costa, Paulo; Lima, Jose; Pereira, Ana I.; Costa, Pedro; Pinto, Andry			An Optimization Approach for the Inverse Kinematics of a Highly Redundant Robot	PROCEEDINGS OF THE SECOND INTERNATIONAL AFRO-EUROPEAN CONFERENCE FOR INDUSTRIAL ADVANCEMENT (AECIA 2015)	Advances in Intelligent Systems and Computing				2nd International Afro-European Conference for Industrial Advancement (AECIA)	SEP 09-11, 2015	Engn Sch Digital Sci, AllianSTIC Lab, Villejuif, FRANCE	Tech Univ Ostrava, Dept Comp Sci, Univ Sfax, Res Grp Intelligent Machines	Engn Sch Digital Sci, AllianSTIC Lab							Pereira, Ana I./F-3168-2010; Lima, Jose SM/L-3370-2014; Costa, Pedro G./L-4108-2014	Pereira, Ana I./0000-0003-3803-2043; Lima, Jose SM/0000-0001-7902-1207; Costa, Pedro G./0000-0002-0435-8419; Pinto, Andry Maykol Gomes/0000-0003-2465-5813; Costa, Paulo/0000-0002-4846-271X												2194-5357	2194-5365	978-3-319-29504-6; 978-3-319-29503-9				2016	427						433	442		10.1007/978-3-319-29504-6_41							WOS:000371912400041						
C	BolaBola, JZ; Wang, Y; Wu, S; Qin, H; Niu, JW		Goonetilleke, R; Karwowski, W		BolaBola, Joelle Zita; Wang, Yao; Wu, Shuang; Qin, Hua; Niu, Jianwei			Application of Hidden Markov Model in Human Motion Recognition by Using Motion Capture Data	ADVANCES IN PHYSICAL ERGONOMICS AND HUMAN FACTORS	Advances in Intelligent Systems and Computing				International Conference on Physical Ergonomics and Human Factors	JUL 27-31, 2016	FL																						2194-5357		978-3-319-41694-6; 978-3-319-41693-9				2016	489						21	28		10.1007/978-3-319-41694-6_3							WOS:000389642400003						
C	Sipes, C; McGonigle, D; Hunter, K; Hebda, T; Hill, T; Lamblin, J		Rocha, A; Correia, AM; Costanzo, S; Reis, LP		Sipes, Carolyn; McGonigle, Dee; Hunter, Kathleen; Hebda, Toni; Hill, Taryn; Lamblin, Jean			Collaboration with AORN to Develop the Technology in the OR (TOR) Tool: How Does Technology Affect the Nature of Surgeries for PeriOperative Nurses - A Research Study	NEW CONTRIBUTIONS IN INFORMATION SYSTEMS AND TECHNOLOGIES, VOL 1, PT 1	Advances in Intelligent Systems and Computing				World Conference on Information Systems and Technologies (WorldCIST)	APR 01-03, 2015	Univ Azores, Ponta Delgada, PORTUGAL		Univ Azores																				2194-5357	2194-5365	978-3-319-16486-1; 978-3-319-16485-4				2015	353		1				203	207		10.1007/978-3-319-16486-1_20							WOS:000381744400020						
C	Juneja, K		Choudhary, RK; Mandal, JK; Auluck, N; Nagarajaram, HA		Juneja, Kapil			MFAST Processing Model for Occlusion and Illumination Invariant Facial Recognition	ADVANCED COMPUTING AND COMMUNICATION TECHNOLOGIES	Advances in Intelligent Systems and Computing				9th International Conference on Advanced Computing and Communication Technologies (ICACCT)	NOV 28-29, 2015	Asia Pacific Inst Informat Technol, Panipat, INDIA	Inst Elect & Telecommunicat Engineers, Comp Soc India	Asia Pacific Inst Informat Technol							juneja, Kapil/Q-6686-2017	juneja, Kapil/0000-0002-6351-3351												2194-5357		978-981-10-1023-1; 978-981-10-1021-7				2016	452						161	170		10.1007/978-981-10-1023-1_16							WOS:000387180900016						
S	Trocan, M		Zgrzywa, A; Choros, K; Sieminski, A		Trocan, Maria			A Sparse Reconstruction Approach to Video Deinterlacing	MULTIMEDIA AND INTERNET SYSTEMS: THEORY AND PRACTICE	Advances in Intelligent Systems and Computing																												2194-5357	2194-5365	978-3-642-32334-8; 978-3-642-32335-5				2013	183						25	33			10.1007/978-3-642-32335-5						WOS:000315746000003						
C	Bhatt, N; Chauhan, NR		Choudhary, RK; Mandal, JK; Auluck, N; Nagarajaram, HA		Bhatt, Nisha; Chauhan, Nathi Ram			Design of a Two Fingered Friction Gripper for a Wheel Mobile Robot	ADVANCED COMPUTING AND COMMUNICATION TECHNOLOGIES	Advances in Intelligent Systems and Computing				9th International Conference on Advanced Computing and Communication Technologies (ICACCT)	NOV 28-29, 2015	Asia Pacific Inst Informat Technol, Panipat, INDIA	Inst Elect & Telecommunicat Engineers, Comp Soc India	Asia Pacific Inst Informat Technol								bhatt, nisha/0000-0002-4690-4289												2194-5357		978-981-10-1023-1; 978-981-10-1021-7				2016	452						195	203		10.1007/978-981-10-1023-1_20							WOS:000387180900020						
C	Paszkiel, S; Hunek, W; Shylenko, A		Szewczyk, R; Zielinski, C; Kaliczynska, M		Paszkiel, Szczepan; Hunek, Wojciech; Shylenko, Andrew			Project and Simulation of a Portable Device for Measuring Bioelectrical Signals from the Brain for States Consciousness Verification with Visualization on LEDs	CHALLENGES IN AUTOMATION, ROBOTICS AND MEASUREMENT TECHNIQUES	Advances in Intelligent Systems and Computing				International Conference Challenges in Automation, Robotics and Measurement Techniques (Automation)	MAR 02-04, 2016	Warsaw, POLAND									Hunek, Wojciech/AAF-9838-2019; Paszkiel, Szczepan/Y-3624-2018; Hunek, Wojciech Przemyslaw/P-2141-2014	Hunek, Wojciech/0000-0002-8210-9776; Paszkiel, Szczepan/0000-0002-4917-5712; Hunek, Wojciech Przemyslaw/0000-0002-8210-9776												2194-5357		978-3-319-29357-8; 978-3-319-29356-1				2016	440						25	35		10.1007/978-3-319-29357-8_3							WOS:000381924400003						
C	Ishii, N; Takano, Y; Muraki, M		Obaidat, MS; Oren, T; Merkuryev, Y		Ishii, Nobuaki; Takano, Yuichi; Muraki, Masaaki			A Simulation-Based Dynamic Scheduling Method in Project Cost Estimation Process	SIMULATION AND MODELING METHODOLOGIES, TECHNOLOGIES AND APPLICATIONS, SIMULTECH 2016	Advances in Intelligent Systems and Computing				6th International Conference on Simulation and Modeling Methodologies, Technologies and Applications (SIMULTECH)	JUL 29-31, 2016	Lisbon, PORTUGAL									Ishii, Nobuaki/AAJ-3950-2020	Ishii, Nobuaki/0000-0003-1718-1664												2194-5357	2194-5365	978-3-319-69832-8; 978-3-319-69831-1				2018	676						261	279		10.1007/978-3-319-69832-8_15							WOS:000437042300015						
C	Pratima, N; Anil, N		Choudhary, RK; Mandal, JK; Auluck, N; Nagarajaram, HA		Pratima, Nirmal; Anil, Nandgaonkar			A Compact H Shaped MIMO Antenna with an Improved Isolation for WLAN Applications	ADVANCED COMPUTING AND COMMUNICATION TECHNOLOGIES	Advances in Intelligent Systems and Computing				9th International Conference on Advanced Computing and Communication Technologies (ICACCT)	NOV 28-29, 2015	Asia Pacific Inst Informat Technol, Panipat, INDIA	Inst Elect & Telecommunicat Engineers, Comp Soc India	Asia Pacific Inst Informat Technol																				2194-5357	2194-5365	978-981-10-1023-1; 978-981-10-1021-7				2016	452						493	501		10.1007/978-981-10-1023-1_49							WOS:000387180900049						
C	Doroz, R; Wrobel, K; Porwik, P; Safaverdi, H		Kurzynski, M; Wozniak, M; Burduk, R		Doroz, Rafal; Wrobel, Krzysztof; Porwik, Piotr; Safaverdi, Hossein			The Method of Person Verification by Use of Finger Knuckle Images	PROCEEDINGS OF THE 10TH INTERNATIONAL CONFERENCE ON COMPUTER RECOGNITION SYSTEMS CORES 2017	Advances in Intelligent Systems and Computing				10th International Conference on Computer Recognition Systems (CORES)	MAY 22-24, 2017	Polanica Zdroj, POLAND									Porwik, Piotr/I-3141-2013; Wrobel, Krzysztof KW/Q-5406-2018; Doroz, Rafal/H-2449-2014	Porwik, Piotr/0000-0001-8989-9478; Wrobel, Krzysztof KW/0000-0001-7339-1100; Doroz, Rafal/0000-0001-6103-1175												2194-5357	2194-5365	978-3-319-59162-9				2018	578						248	257		10.1007/978-3-319-59162-9_26							WOS:000432569000026						
C	Koca, E; Kaya, O		Rebelo, F; Soares, M		Koca, Emine; Kaya, Ozlem			A Research on Ergonomic Approaches of Apparel Designers	ADVANCES IN ERGONOMICS IN DESIGN	Advances in Intelligent Systems and Computing				International Conference on Ergonomics in Design	JUL 27-31, 2016	FL									KOCA, Emine/I-4975-2019													2194-5357		978-3-319-41983-1; 978-3-319-41982-4				2016	485						323	335		10.1007/978-3-319-41983-1_29							WOS:000389646200029						
C	Onar, SC; Oztaysi, B; Kahraman, C		Kacprzyk, J; Szmidt, E; Zadrozny, S; Atanassov, KT; Krawczak, M		Onar, Sezi Cevik; Oztaysi, Basar; Kahraman, Cengiz			Dynamic Intuitionistic Fuzzy Evaluation of Entrepreneurial Support in Countries	ADVANCES IN FUZZY LOGIC AND TECHNOLOGY 2017, VOL 3	Advances in Intelligent Systems and Computing				10th Conference of the European-Society-for-Fuzzy-Logic-and-Technology (EUSFLAT) / 16th International Workshop on Intuitionistic Fuzzy Sets and Generalized Nets (IWIFSGN)	SEP 11-15, 2017	Warsaw, POLAND	European Soc Fuzzy Log & Technol, Polish Acad Sci, Dept IV Engn Sci, Polish Acad Sci, Syst Res Inst, Polish Operat & Syst Res Soc								Oztaysi, Basar/K-7498-2013; kahraman, cengiz/N-9259-2013; Cevik Onar, Sezi/B-4146-2015	Oztaysi, Basar/0000-0002-1090-7963; kahraman, cengiz/0000-0001-6168-8185; Cevik Onar, Sezi/0000-0001-6451-6709												2194-5357	2194-5365	978-3-319-66827-7; 978-3-319-66826-0				2018	643						38	47		10.1007/978-3-319-66827-7_4							WOS:000431389900004						
C	Pavlyuk, D		Zamojski, W; Mazurkiewicz, J; Sugier, J; Walkowiak, T; Kacprzyk, J		Pavlyuk, Dmitry			On Application of Regime-Switching Models for Short-Term Traffic Flow Forecasting	ADVANCES IN DEPENDABILITY ENGINEERING OF COMPLEX SYSTEMS	Advances in Intelligent Systems and Computing				12th International Conference on Dependability and Complex Systems (DepCoS-RELCOMEX)	JUL 02-06, 2017	Brunow, POLAND	Wroclaw Univ Sci & Technol, Dept Comp Engn								Pavlyuk, Dmitry/P-9943-2018	Pavlyuk, Dmitry/0000-0003-3710-9678												2194-5357	2194-5365	978-3-319-59415-6; 978-3-319-59414-9				2018	582						340	349		10.1007/978-3-319-59415-6_33							WOS:000441189200033						
C	Soni, R; Mathai, KJ		Choudhary, RK; Mandal, JK; Auluck, N; Nagarajaram, HA		Soni, Rishabh; Mathai, K. James			An Innovative 'Cluster-then-Predict' Approach for Improved Sentiment Prediction	ADVANCED COMPUTING AND COMMUNICATION TECHNOLOGIES	Advances in Intelligent Systems and Computing				9th International Conference on Advanced Computing and Communication Technologies (ICACCT)	NOV 28-29, 2015	Asia Pacific Inst Informat Technol, Panipat, INDIA	Inst Elect & Telecommunicat Engineers, Comp Soc India	Asia Pacific Inst Informat Technol																				2194-5357	2194-5365	978-981-10-1023-1; 978-981-10-1021-7				2016	452						131	140		10.1007/978-981-10-1023-1_13							WOS:000387180900013						
C	Panshin, IV		Popkova, EG		Panshin, Ilya, V			Effects of Differences of Regional Economy's Dynamics: A Resource Aspect	IMPACT OF INFORMATION ON MODERN HUMANS	Advances in Intelligent Systems and Computing				Scientific and Practical Conference on Humans as an Object of Study by Modern Science	NOV 23-24, 2017	Nizhny Novgorod, RUSSIA	Kozma Minin Nizhny Novgorod State Pedagog Univ, Inst Sci Commun								Panshin, Ilya/AAW-4192-2021	Panshin, Ilya/0000-0001-5246-1966												2194-5357	2194-5365	978-3-319-75383-6; 978-3-319-75382-9				2018	622						727	735		10.1007/978-3-319-75383-6_93							WOS:000570135200092						
C	Wang, C; Chen, XY		Yang, G		Wang Chao; Chen Xingyuan			An United Security Model for Multi-Class-IS	PROCEEDINGS OF THE 2012 INTERNATIONAL CONFERENCE ON COMMUNICATION, ELECTRONICS AND AUTOMATION ENGINEERING	Advances in Intelligent Systems and Computing				International Conference on Communications, Electronics and Automation Engineering	AUG 23-25, 2012	Xian, PEOPLES R CHINA	Xian Technol Univ, Shaanxi Network & Monitoring Control Engn Lab, Missouri Western State Univ																					2194-5357	2194-5365	978-3-642-31697-5				2013	181						473	478									WOS:000315538000067						
C	Bautista, AM; Feliu, TS		Mejia, J; Munoz, M; Rocha, A; CalvoManzano, J		Bautista, Ana M.; San Feliu, Tomas			Defect Prediction in Software Repositories with Artificial Neural Networks	TRENDS AND APPLICATIONS IN SOFTWARE ENGINEERING	Advances in Intelligent Systems and Computing				4th International Conference on Software Process Improvement (CIMPS)	OCT 28-30, 2015	Autonomous Univ Sinaloa, Fac Informatic Mazatlan, Culiacan, MEXICO		Autonomous Univ Sinaloa, Fac Informatic Mazatlan							San Feliu, Tomas/B-4515-2011	San Feliu, Tomas/0000-0002-6104-7430												2194-5357	2194-5365	978-3-319-26285-7; 978-3-319-26283-3				2016	405						165	174		10.1007/978-3-319-26285-7_14							WOS:000377501300014						
C	Bhirugnath-Bhookhun, M; Kitada, M		Kantola, JI; Barath, T; Nazir, S; Andre, T		Bhirugnath-Bhookhun, Meenaksi; Kitada, Momoko			Is the Sky the Limit?: Leadership and Socio-economic Development of Women in the Maritime Sector in the Eastern and Southern Africa	ADVANCES IN HUMAN FACTORS, BUSINESS MANAGEMENT, TRAINING AND EDUCATION	Advances in Intelligent Systems and Computing				International Conference on Human Factors, Business Management and Society	JUL 27-31, 2016	FL									Kitada, Momoko/AAK-1904-2021													2194-5357	2194-5365	978-3-319-42070-7; 978-3-319-42069-1				2017	498						1229	1238		10.1007/978-3-319-42070-7_111							WOS:000390893100111						
C	Shindarev, N; Bagretsov, G; Abramov, M; Tulupyeva, T; Suvorova, A		Abraham, A; Kovalev, S; Tarassov, V; Snasel, V; Vasileva, M; Sukhanov, A		Shindarev, Nikita; Bagretsov, Georgiy; Abramov, Maksim; Tulupyeva, Tatiana; Suvorova, Alena			Approach to Identifying of Employees Profiles in Websites of Social Networks Aimed to Analyze Social Engineering Vulnerabilities	PROCEEDINGS OF THE SECOND INTERNATIONAL SCIENTIFIC CONFERENCE INTELLIGENT INFORMATION TECHNOLOGIES FOR INDUSTRY (IITI'17), VOL 1	Advances in Intelligent Systems and Computing				2nd International Scientific Conference on Intelligent Information Technologies for Industry (IITI)	SEP 14-16, 2017	Varna, BULGARIA	Tech Univ Varna, Tech Univ Sofia, VSB Tech Univ Ostrava, Rostov State Transport Univ									Tulupyeva, Tatiana/0000-0003-3630-7971												2194-5357	2194-5365	978-3-319-68321-8				2018	679						441	447		10.1007/978-3-319-68321-8_45							WOS:000585070600045						
C	Fan, ZE; Shi, XJ; Pan, CP; Gu, WJ		Du, ZY		Fan, Zuo-e; Shi, Xian-jun; Pan, Chang-peng; Gu, Wen-jin			A Finite-Time Convergent Variable Structure Guidance Law with Impact Angle Constraint	INTELLIGENCE COMPUTATION AND EVOLUTIONARY COMPUTATION	Advances in Intelligent Systems and Computing				International Conference of Intelligence Computation and Evolutionary Computation (ICEC 2012)	JUL 07, 2012	Wuhan, PEOPLES R CHINA	Informat Technol & Ind Engn Res Ctr																					2194-5357		978-3-642-31655-5				2013	180						513	519									WOS:000316302700073						
C	Sheikh, JA; Zafar, B; Pervez, A; Bhutta, ZI		Rebelo, F; Soares, M		Sheikh, Javed Anjum; Zafar, Beenish; Pervez, Anam; Bhutta, Zunaira Ilyas			Smartphone Ergonomics: A Proposal for Older People	ADVANCES IN ERGONOMICS IN DESIGN	Advances in Intelligent Systems and Computing				International Conference on Ergonomics in Design	JUL 27-31, 2016	FL									Sheikh, javed/ABC-3922-2020; Sheikh, Javed/AAW-2822-2021	Sheikh, Javed/0000-0001-7254-5585												2194-5357	2194-5365	978-3-319-41983-1; 978-3-319-41982-4				2016	485						831	841		10.1007/978-3-319-41983-1_75							WOS:000389646200075						
C	Laita, A; Belaissaoui, M		Rocha, A; Serrhini, M; Felgueiras, C		Laita, Amine; Belaissaoui, Mustapha			Information Technology Governance in Public Sector Organizations	EUROPE AND MENA COOPERATION ADVANCES IN INFORMATION AND COMMUNICATION TECHNOLOGIES	Advances in Intelligent Systems and Computing				Europe, Middle East and North Africa Conference on Technology and Security to Support Learning (EMENA-TSSL)	OCT 03-05, 2016	Oujda, MOROCCO									BELAISSAOUI, Mustapha/ABC-9706-2020	BELAISSAOUI, Mustapha/0000-0003-3877-9235; , Mustapha/0000-0002-5089-7288												2194-5357		978-3-319-46568-5; 978-3-319-46567-8				2017	520						331	340		10.1007/978-3-319-46568-5_34							WOS:000392196900034						
C	Yang, AP; Fu, WY; Cheng, G; Zhang, X; Hu, HM		Goonetilleke, R; Karwowski, W		Yang, Ai-ping; Fu, Wen-yu; Cheng, Guang; Zhang, Xin; Hu, Hui-min			Comfort Posture and Position of Push-Pull Operation of the Sagittal Plane in Standing	ADVANCES IN PHYSICAL ERGONOMICS AND HUMAN FACTORS	Advances in Intelligent Systems and Computing				International Conference on Physical Ergonomics and Human Factors	JUL 27-31, 2016	FL																						2194-5357	2194-5365	978-3-319-41694-6; 978-3-319-41693-9				2016	489						205	212		10.1007/978-3-319-41694-6_21							WOS:000389642400021						
C	Bobrowski, L; Topczewska, M		Burduk, R; Jackowski, K; Kurzynski, M; Wozniak, M; Zolnierek, A		Bobrowski, Leon; Topczewska, Magdalena			Separable Linearization of Learning Sets by Ranked Layer of Radial Binary Classifiers	PROCEEDINGS OF THE 8TH INTERNATIONAL CONFERENCE ON COMPUTER RECOGNITION SYSTEMS CORES 2013	Advances in Intelligent Systems and Computing				8th International Conference on Computer Recognition Systems (CORES)	MAY 25-27, 2013	Wroclaw, POLAND									Bobrowski, Leon/T-9230-2018	Bobrowski, Leon/0000-0003-4735-2460												2194-5357	2194-5365	978-3-319-00969-8; 978-3-319-00968-1				2013	226						131	140		10.1007/978-3-319-00969-8_13							WOS:000354284200013						
C	Andrysiak, T; Saganowski, L; Maszewski, M; Marchewka, A		Zamojski, W; Mazurkiewicz, J; Sugier, J; Walkowiak, T; Kacprzyk, J		Andrysiak, Tomasz; Saganowski, Lukasz; Maszewski, Miroslaw; Marchewka, Adam			Detection of Network Attacks Using Hybrid ARIMA-GARCH Model	ADVANCES IN DEPENDABILITY ENGINEERING OF COMPLEX SYSTEMS	Advances in Intelligent Systems and Computing				12th International Conference on Dependability and Complex Systems (DepCoS-RELCOMEX)	JUL 02-06, 2017	Brunow, POLAND	Wroclaw Univ Sci & Technol, Dept Comp Engn								Marchewka, Adam/W-1647-2018; MASZEWSKI, MIROSLAW/W-1649-2018	Marchewka, Adam/0000-0002-0651-3208; MASZEWSKI, MIROSLAW/0000-0002-5461-9998; Saganowski, Lukasz/0000-0002-7535-5653												2194-5357	2194-5365	978-3-319-59415-6; 978-3-319-59414-9				2018	582						1	12		10.1007/978-3-319-59415-6_1							WOS:000441189200001						
C	Bogdanovics, R; Borodinecs, A; Zajacs, A; Steinerte, K		Murgul, V; Popovic, Z		Bogdanovics, Raimonds; Borodinecs, Anatolijs; Zajacs, Aleksandrs; Steinerte, Kristine			Review of Heat Pumps Application Potential in Cold Climate	INTERNATIONAL SCIENTIFIC CONFERENCE ENERGY MANAGEMENT OF MUNICIPAL TRANSPORTATION FACILITIES AND TRANSPORT, EMMFT 2017	Advances in Intelligent Systems and Computing				19th International Scientific Conference on Energy Management of Municipal Transportation Facilities and Transport (EMMFT)	APR 10-13, 2017	Far Eastern State Transport Univ, Khabarovsk, RUSSIA		Far Eastern State Transport Univ							Borodinecs, Anatolijs/AAV-2280-2020	Borodinecs, Anatolijs/0000-0001-9004-7889; Zajacs, Aleksandrs/0000-0002-3583-5978; Bogdanovics, Raimonds/0000-0002-1864-3739												2194-5357	2194-5365	978-3-319-70987-1; 978-3-319-70986-4				2018	692						543	554		10.1007/978-3-319-70987-1_58							WOS:000436502300058						
C	de Oliveira, ST; Bozo, JV; Okimoto, MLLR		Rebelo, F; Soares, M		de Oliveira, Sabrina Talita; Bozo, Julia Vieira; Leite Ribeiro Okimoto, Maria Lucia			Assistive Technology for People with Low Vision: Equipment for Accessibility of Visual Information	ADVANCES IN ERGONOMICS IN DESIGN	Advances in Intelligent Systems and Computing				International Conference on Ergonomics in Design	JUL 27-31, 2016	FL									Okimoto, Maria Lucia Leite Ribeiro/L-6836-2016													2194-5357		978-3-319-41983-1; 978-3-319-41982-4				2016	485						701	710		10.1007/978-3-319-41983-1_63							WOS:000389646200063						
C	Balogun, OA; Ansary, N		Kantola, JI; Barath, T; Nazir, S		Balogun, Olanrewaju Abdul; Ansary, Nazzem			Determinants of Business Overdraft Accessibility Within Small and Medium-Sized Enterprises in the South African Construction Industry: A Case of Gauteng Province	ADVANCES IN HUMAN FACTORS, BUSINESS MANAGEMENT AND LEADERSHIP, AHFE 2017	Advances in Intelligent Systems and Computing				International Conferences on Human Factors in Management and Leadership, and Business Management and Society / 8th International Conference on Applied Human Factors and Ergonomics (AHFE)	JUL 17-21, 2017	Los Angeles, CA																						2194-5357	2194-5365	978-3-319-60372-8; 978-3-319-60371-1				2018	594						229	240		10.1007/978-3-319-60372-8_22							WOS:000451075900022						
S	Peksinski, J; Mikolajczak, G; Kowalski, JP		Zgrzywa, A; Choros, K; Sieminski, A		Peksinski, Jakub; Mikolajczak, Grzegorz; Kowalski, Janusz Pawel			Estimation of the Level of Disturbance in Time Series Using a Median Filter	NEW RESEARCH IN MULTIMEDIA AND INTERNET SYSTEMS	Advances in Intelligent Systems and Computing															Mikolajczak, Grzegorz/J-6226-2016; Peksinski, Jakub/G-6846-2016													2194-5357	2194-5365	978-3-319-10382-2				2015	314						91	99		10.1007/978-3-319-10383-9_9	10.1007/978-3-319-10383-9						WOS:000348199400010						
C	Returi, KD; Mohan, VM; Radhika, Y		Satapathy, SC; Raju, KS; Mandal, JK; Bhateja, V		Returi, Kanaka Durga; Mohan, Vaka Murali; Radhika, Y.			A Novel Approach for Speaker Recognition by Using Wavelet Analysis and Support Vector Machines	PROCEEDINGS OF THE SECOND INTERNATIONAL CONFERENCE ON COMPUTER AND COMMUNICATION TECHNOLOGIES, IC3T 2015, VOL 1	Advances in Intelligent Systems and Computing				2nd International Conference on Computer and Communication Technologies	JUL 24-26, 2015	CMR Tech Campus, Hyderabad, INDIA	CSI, Div V Educ & Res	CMR Tech Campus							MOHAN, VAKA MURALI/N-7165-2016; DURGA, RETURI KANAKA/AAJ-4424-2020	MOHAN, VAKA MURALI/0000-0003-1026-3894; DURGA, RETURI KANAKA/0000-0002-7268-5446												2194-5357	2194-5365	978-81-322-2517-1; 978-81-322-2516-4				2016	379						163	174		10.1007/978-81-322-2517-1_17							WOS:000377858400017						
