PT	AU	BA	BE	GP	AF	BF	CA	TI	SO	SE	BS	LA	DT	CT	CY	CL	SP	HO	DE	ID	AB	C1	RP	EM	RI	OI	FU	FX	CR	NR	TC	Z9	U1	U2	PU	PI	PA	SN	EI	BN	J9	JI	PD	PY	VL	IS	PN	SU	SI	MA	BP	EP	AR	DI	D2	EA	PG	WC	SC	GA	UT	PM	OA	HC	HP	DA
C	Garg, D; Sidhu, J		Singh, R; Choudhury, S; Gehlot, A		Garg, Deepak; Sidhu, Jagpreet			Survey on Implementation of Security in Cloud	INTELLIGENT COMMUNICATION, CONTROL AND DEVICES, ICICCD 2017	Advances in Intelligent Systems and Computing				2nd International Conference on Intelligent Communication, Control and Devices (ICICCD)	APR 15-16, 2017	Dehradun, INDIA	Univ Petr & Energy Studies Engn, Dept Elect, Instrumentat & Control Engn								garg, deepak/N-5617-2017	garg, deepak/0000-0001-5755-2752												2194-5357	2194-5365	978-981-10-5903-2; 978-981-10-5902-5				2018	624						1587	1594		10.1007/978-981-10-5903-2_164							WOS:000553697500164						
C	Aust, ML; Brostrom, R; Lindvall, S		Stanton, NA		Aust, Mikael Ljung; Brostrom, Robert; Lindvall, Sofia			Assessing In-Vehicle Secondary Tasks with the NHTSA Visual-Manual Guidelines Occlusion Method	ADVANCES IN HUMAN ASPECTS OF TRANSPORTATION	Advances in Intelligent Systems and Computing				AHFE International Conference on Human Factors in Transportation	JUL 17-21, 2017	Los Angeles, CA																						2194-5357	2194-5365	978-3-319-60441-1; 978-3-319-60440-4				2018	597						373	382		10.1007/978-3-319-60441-1_37							WOS:000448241200037						
C	Brandejsky, T; Zelinka, I		Zelinka, I; Rossler, OE; Snasel, V; Abraham, A; Corchado, ES		Brandejsky, Tomas; Zelinka, Ivan			Specific Behaviour of GPA-ES Evolutionary System Observed in Deterministic Chaos Regression	NOSTRADAMUS: MODERN METHODS OF PREDICTION, MODELING AND ANALYSIS OF NONLINEAR SYSTEMS	Advances in Intelligent Systems and Computing				Nostradamus Conference	SEP, 2012	Ostrava, CZECH REPUBLIC	IT4 Innovat, VSB Tech Univ Ostrava, MIR Lab, Ctr Chaos & Complex Networks, Journal Unconvent Comp									Brandejsky, Tomas/0000-0001-8647-9849												2194-5357	2194-5365	978-3-642-33226-5				2013	192						73	+									WOS:000313767300010						
C	Gour, S; Kumar, S		Suresh, LP; Panigrahi, BK		Gour, Sapna; Kumar, Saket			Reduction of Optical Background Noise Impact in Light-Emitting Diode (LED)-Based Optical Wireless Communication Systems by Hadamard Codes	PROCEEDINGS OF THE INTERNATIONAL CONFERENCE ON SOFT COMPUTING SYSTEMS, ICSCS 2015, VOL 1	Advances in Intelligent Systems and Computing				International Conference On Soft Computing Systems (ICSCS)	APR 20-21, 2015	Noorul Islam Univ, Noorul Islam Ctr Higher Educ, Kumaracoil, INDIA		Noorul Islam Univ, Noorul Islam Ctr Higher Educ																				2194-5357	2194-5365	978-81-322-2671-0; 978-81-322-2669-7				2016	397						919	927		10.1007/978-81-322-2671-0_87							WOS:000377539600087						
C	Marino, R; Mastrogiovanni, F; Sgorbissa, A; Zaccaria, R		Menegatti, E; Michael, N; Berns, K; Yamaguchi, H		Marino, Roberto; Mastrogiovanni, Fulvio; Sgorbissa, Antonio; Zaccaria, Renato			A Minimalistic Quadrotor Navigation Strategy for Indoor Multi-floor Scenarios	INTELLIGENT AUTONOMOUS SYSTEMS 13	Advances in Intelligent Systems and Computing				13th International Conference on Intelligent Autonomous Systems (IAS)	JUL 15-18, 2014	Centro Congressi Padova, Padova, ITALY	Univ Padova	Centro Congressi Padova																				2194-5357	2194-5365	978-3-319-08338-4; 978-3-319-08337-7				2016	302						1561	1570		10.1007/978-3-319-08338-4_112							WOS:000377956900112						
C	Revuelta, J; Villarrubia, G; Barriuso, AL; Hernandez, D; Lozano, A; Gonzalez, MAD		DeLaPrieta, F; Escalona, MJ; Corchuelo, R; Mathieu, P; Vale, Z; Campbell, AT; Rossi, S; Adam, E; JimenezLopez, MD; Navarro, EM; Moreno, MN		Revuelta, Jorge; Villarrubia, Gabriel; Lopez Barriuso, Alberto; Hernandez, Daniel; Lozano, Alvaro; de la Serna Gonzalez, Marco Antonio			New Architecture for Electric Bikes Control Based on Smartphones and Wireless Sensors	TRENDS IN PRACTICAL APPLICATIONS OF SCALABLE MULTI-AGENT SYSTEMS, THE PAAMS COLLECTION	Advances in Intelligent Systems and Computing				14th International Conference on Practical Applications of Agents and Multi-Agent Systems (PAAMS)	JUN 01-03, 2016	Sevilla, SPAIN	IEEE Syst Man Cybernet Soc Spain, IBM, AEPIA, AFIA, APPIA, Polytechn Univ Madrid, Univ Seville, CNRS, Ingn Software Avanzado S A, Indra, Portuguese Assoc Artificial Intelligence, Assoc Francaise Intelligence Artificielle, IEEE Secc Espana, Fundac Investigac Desarrollo Tecnologias Informac Andalucia, Escuela Tecnica Super Ingn Informatica								Lopez Barriuso, Alberto/B-1898-2016; Villarrubia Gonzalez, Gabriel/I-2834-2015; Gonzalez, Gabriel Villarrubia/AAS-8172-2021; Lozano Murciego, Alvaro/P-4392-2014	Lopez Barriuso, Alberto/0000-0001-6216-3591; Villarrubia Gonzalez, Gabriel/0000-0002-6536-2251; Gonzalez, Gabriel Villarrubia/0000-0002-6536-2251; Lozano Murciego, Alvaro/0000-0002-0493-4471												2194-5357		978-3-319-40159-1; 978-3-319-40158-4				2016	473						125	134		10.1007/978-3-319-40159-1_10							WOS:000389807600010						
C	Patti, D; Palesi, M; Catania, V		Silhavy, R; Senkerik, R; Oplatkova, ZK; Silhavy, P; Prokopova, Z		Patti, Davide; Palesi, Maurizio; Catania, Vincenzo			Merging Compilation and Microarchitectural Configuration Spaces for Performance/Power Optimization in VLIW-Based Systems	MODERN TRENDS AND TECHNIQUES IN COMPUTER SCIENCE (CSOC 2014)	Advances in Intelligent Systems and Computing				3rd Computer Science On-line Conference (CSOC)	APR, 2014	ELECTR NETWORK									Patti, Davide/P-5851-2014	Patti, Davide/0000-0003-0874-7793												2194-5357		978-3-319-06740-7				2014	285						203	212		10.1007/978-3-319-06740-7_18							WOS:000370620000018						
C	Josten, J; Schmidt, T; Philipsen, R; Eckstein, L; Ziefle, M		Stanton, NA		Josten, Johanna; Schmidt, Teresa; Philipsen, Ralf; Eckstein, Lutz; Ziefle, Martina			What to Expect of Automated Driving: Expectations and Anticipation of System Behavior	ADVANCES IN HUMAN ASPECTS OF TRANSPORTATION	Advances in Intelligent Systems and Computing				AHFE International Conference on Human Factors in Transportation	JUL 17-21, 2017	Los Angeles, CA									Philipsen, Ralf/AAE-8716-2020	Philipsen, Ralf/0000-0002-8922-8604; Brell, Teresa/0000-0003-1081-8992												2194-5357	2194-5365	978-3-319-60441-1; 978-3-319-60440-4				2018	597						606	617		10.1007/978-3-319-60441-1_59							WOS:000448241200059						
C	Witczak, M; Witczak, P		Korbicz, J; Kowal, M		Witczak, Marcin; Witczak, Piotr			Efficient Predictive Fault-Tolerant Control for Non-linear Systems	INTELLIGENT SYSTEMS IN TECHNICAL AND MEDICAL DIAGNOSTICS	Advances in Intelligent Systems and Computing				11th International Conference on Diagnostics of Processes and Systems (DPS)	SEP 08-11, 2013	Lagow Lubuski, POLAND	Univ Zielona Gora, Inst Control & Computat Engn, Warsaw Univ Technol, Lubuskie Sci Soc, Polish Minist Sci & Higher Educ, Polish Acad Sci, Comm Automat Control & Robot, Gdansk Univ Technol								Witczak, Marcin/F-7947-2014; Witczak, Piotr K/L-9336-2014; Witczak, Piotr/AAC-4743-2019	Witczak, Piotr K/0000-0003-4696-2304; Witczak, Piotr/0000-0003-4696-2304; Witczak, Marcin/0000-0002-0031-0004												2194-5357	2194-5365	978-3-642-39881-0; 978-3-642-39880-3				2014	230						65	76		10.1007/978-3-642-39881-0_5							WOS:000329201800005						
C	Nag, A; Choudhary, S; Dawn, S; Basu, S		Mandal, JK; Satapathy, SC; Sanyal, MK; Bhateja, V		Nag, Amitava; Choudhary, Soni; Dawn, Subham; Basu, Suryadip			Secure Data Outsourcing in the Cloud Using Multi-secret Sharing Scheme (MSSS)	PROCEEDINGS OF THE FIRST INTERNATIONAL CONFERENCE ON INTELLIGENT COMPUTING AND COMMUNICATION	Advances in Intelligent Systems and Computing				1st International Conference on Intelligent Computing and Communication, (ICIC2)	FEB 18-19, 2016	Univ Kalyani, Kalyani, INDIA	Univ Kalyani, Fac Engn, Technol & Management, Kalyani Univ, DST PURSE Program Govt India, UGC, Comp Soc India Div V	Univ Kalyani								Nag, Dr. Amitava/0000-0003-4408-7307												2194-5357	2194-5365	978-981-10-2035-3; 978-981-10-2034-6				2017	458						337	343		10.1007/978-981-10-2035-3_34							WOS:000401109800034						
C	Zielinski, C; Winiarski, T; Kornuta, T		Mitkowski, W; Kacprzyk, J; Oprzedkiewicz, K; Skruch, P		Zielinski, Cezary; Winiarski, Tomasz; Kornuta, Tomasz			Agent-Based Structures of Robot Systems	TRENDS IN ADVANCED INTELLIGENT CONTROL, OPTIMIZATION AND AUTOMATION	Advances in Intelligent Systems and Computing				19th Polish Control Conference (KKA)	JUN 18-21, 2017	Krakow, POLAND	AGH Univ Sci & Technol, Fac Elect Engn, Automat, Comp Sci & Biomed Engn, Dept Automat & Biomed Engn, Polish Acad Sci, Comm Automat Control & Robot, Polish Acad Arts & Sci, Commiss Engn Sci								; Zielinski, Cezary/F-3842-2015	Kornuta, Tomasz/0000-0002-5173-2696; Winiarski, Tomasz/0000-0002-9316-3284; Zielinski, Cezary/0000-0001-7604-8834												2194-5357	2194-5365	978-3-319-60699-6				2017	577						493	502		10.1007/978-3-319-60699-6_48							WOS:000470009800048						
C	Nehru, EI; Mukherjee, S; Kumar, A		Suresh, LP; Dash, SS; Panigrahi, BK		Nehru, E. Iniya; Mukherjee, Saswati; Kumar, Abhishek			Deadline-based Priority Management in Cloud	ARTIFICIAL INTELLIGENCE AND EVOLUTIONARY ALGORITHMS IN ENGINEERING SYSTEMS, VOL 2	Advances in Intelligent Systems and Computing				International Conference on Artificial Intelligence and Evolutionary Algorithms in Engineering Systems (ICAEES)	APR 22-23, 2014	Noorul Islam Univ, Noorul Islam Ctr Higher Educ, Kumaracoil, INDIA		Noorul Islam Univ, Noorul Islam Ctr Higher Educ																				2194-5357		978-81-322-2135-7; 978-81-322-2134-0				2015	325						745	751		10.1007/978-81-322-2135-7_78							WOS:000357378500078						
C	Costanzo, S; Di Massa, G; Costanzo, A; Borgia, A; Raffo, A; Viggiani, G; Versace, P		Rocha, A; Correia, AM; Adeli, H; Reis, LP; Teixeira, MM		Costanzo, Sandra; Di Massa, Giuseppe; Costanzo, Antonio; Borgia, Antonio; Raffo, Antonio; Viggiani, Giuseppe; Versace, Pasquale			Software-Defined Radar System for Landslides Monitoring	NEW ADVANCES IN INFORMATION SYSTEMS AND TECHNOLOGIES, VOL 2	Advances in Intelligent Systems and Computing				World Conference on Information Systems and Technologies (WorldCIST)	MAR 22-24, 2016	Recife, BRAZIL									Di Massa, Giuseppe/D-4603-2015	Di Massa, Giuseppe/0000-0003-0523-2890; Costanzo, Antonio/0000-0002-8656-6501												2194-5357	2194-5365	978-3-319-31307-8; 978-3-319-31306-1				2016	445						325	331		10.1007/978-3-319-31307-8_34							WOS:000417260200034						
C	Cichy, B; Augusta, P; Galkowski, K; Rogers, E		Mitkowski, W; Kacprzyk, J; Oprzedkiewicz, K; Skruch, P		Cichy, Blazej; Augusta, Petr; Galkowski, Krzysztof; Rogers, Eric			Iterative Learning Control for a class of spatially interconnected systems	TRENDS IN ADVANCED INTELLIGENT CONTROL, OPTIMIZATION AND AUTOMATION	Advances in Intelligent Systems and Computing				19th Polish Control Conference (KKA)	JUN 18-21, 2017	Krakow, POLAND	AGH Univ Sci & Technol, Fac Elect Engn, Automat, Comp Sci & Biomed Engn, Dept Automat & Biomed Engn, Polish Acad Sci, Comm Automat Control & Robot, Polish Acad Arts & Sci, Commiss Engn Sci								Galkowski, Krzysztof/H-1043-2014	Galkowski, Krzysztof/0000-0003-4470-2162; Rogers, Eric/0000-0003-0179-9398												2194-5357	2194-5365	978-3-319-60699-6				2017	577						734	743		10.1007/978-3-319-60699-6_71							WOS:000470009800071						
C	Shabani, I; Cico, B; Hyseni, D; Halilaj, F		Trajkovik, V; Mishev, A		Shabani, Isak; Cico, Betim; Hyseni, Dhurate; Halilaj, Fatos			End-User Software Reliability in the Case of the Inventory Tracking System in University of Prishtina	ICT INNOVATIONS 2013: ICT INNOVATIONS AND EDUCATION	Advances in Intelligent Systems and Computing				5th ICT Innovations Conference	SEP 12-15, 2013	Ohrid, MACEDONIA	Macedonian Soc Informat & Commun Technol								CICO, BETIM/N-4797-2019; Cico, Betim/ABH-8348-2020; Hyseni, Dhurate/AAH-1504-2020	CICO, BETIM/0000-0001-9078-6147; 												2194-5357		978-3-319-01465-4				2014	231						243	252		10.1007/978-3-319-01466-1_23							WOS:000324078400023						
C	Nam, DP; Phuoc, ND; Huong, NTV		Akagi, M; Nguyen, TT; Vu, DT; Phung, TN; Huynh, VN		Dao Phuong Nam; Nguyen Doan Phuoc; Nguyen Thi Viet Huong			Adaptive Robust Ability of High Order Sliding Mode Control for a 3-D Overhead Crane System	ADVANCES IN INFORMATION AND COMMUNICATION TECHNOLOGY	Advances in Intelligent Systems and Computing				International Conference on Advances in Information and Communication Technology (ICTA)	DEC 12-13, 2016	Thai Nguyen, VIETNAM	Thai Nguyen Univ Informat & Commun Technol, Inst Informat Technol, Vietnam Acad Sci, Fengchia Univ, Japan Adv Inst Sci & Technol, National Chung Cheng Univ									Dao, Phuong Nam/0000-0002-8333-5572												2194-5357		978-3-319-49073-1; 978-3-319-49072-4				2017	538						113	122		10.1007/978-3-319-49073-1_14							WOS:000404236200011						
C	Wolk, K; Wolk, A; Marasek, K		Zgrzywa, A; Choros, K; Sieminski, A		Wolk, Krzysztof; Wolk, Agnieszka; Marasek, Krzysztof			Implementing Statistical Machine Translation into Mobile Augmented Reality Systems	MULTIMEDIA AND NETWORK INFORMATION SYSTEMS, MISSI 2016	Advances in Intelligent Systems and Computing				10th International on Conference Multimedia and Network Information Systems (MISSI)	SEP 14-16, 2016	POLAND	Wroclaw Univ Sci & Technol								Wolk, Krzysztof/E-9957-2015; Marasek, Krzysztof/H-9949-2014	Wolk, Krzysztof/0000-0001-5030-334X; Wolk, Agnieszka/0000-0002-9667-2068; Marasek, Krzysztof/0000-0003-1344-3524												2194-5357	2194-5365	978-3-319-43982-2; 978-3-319-43981-5				2017	506						61	73		10.1007/978-3-319-43982-2_6							WOS:000398736400006						
C	Drias, Y; Kechid, S		Rocha, A; Correia, AM; Costanzo, S; Reis, LP		Drias, Yassine; Kechid, Samir			A Multi-agent Framework for Web Information Foraging: Application to MedlinePlus	NEW CONTRIBUTIONS IN INFORMATION SYSTEMS AND TECHNOLOGIES, VOL 1, PT 1	Advances in Intelligent Systems and Computing				World Conference on Information Systems and Technologies (WorldCIST)	APR 01-03, 2015	Univ Azores, Ponta Delgada, PORTUGAL		Univ Azores							Kechid, Samir/AAD-5580-2019; Drias, Yassine/AAD-4014-2019	Kechid, Samir/0000-0002-2687-2398; Drias, Yassine/0000-0002-8896-6170												2194-5357	2194-5365	978-3-319-16486-1; 978-3-319-16485-4				2015	353		1				247	256		10.1007/978-3-319-16486-1_25							WOS:000381744400025						
C	Rahimi, M; Shen, YT		Chen, W; Hosoda, K; Menegatti, E; Shimizu, M; Wang, H		Rahimi, Mehdi; Shen, Yantao			Accelerated Adaptive Local Scanning of Complicated Micro Objects for the PSD Scanning Microscopy: Methods and Implementation	INTELLIGENT AUTONOMOUS SYSTEMS 14	Advances in Intelligent Systems and Computing				14th International Conference on Intelligent Autonomous Systems (IAS)	JUL 03-07, 2016	Shanghai Jiao Tong Univ, Shanghai, PEOPLES R CHINA		Shanghai Jiao Tong Univ																				2194-5357		978-3-319-48036-7; 978-3-319-48035-0				2017	531						511	521		10.1007/978-3-319-48036-7_37							WOS:000406996500037						
C	Fourgeau, E; Gomez, E; Hagege, M		Cardin, MA; Fong, SH; Krob, D; Lui, PC; Tan, YH		Fourgeau, Eliane; Gomez, Emilio; Hagege, Michel			Managing the Embedded Systems Development Process with Product LifeCycle Management	COMPLEX SYSTEMS DESIGN & MANAGEMENT ASIA: SMART NATIONS - SUSTAINING AND DESIGNING, CSD&M ASIA 2016	Advances in Intelligent Systems and Computing				2nd International Asia-Pacific Conference on Complex Systems Design and Management (CSD and M)	FEB 24-26, 2016	Singapore Univ Technol & Design, Singapore, SINGAPORE	Accenture Technol Labs Beijing, Dassault Systemes, DSO Natl Labs, Def Sci & Technol Agcy Singapore, Electricite France, Int Council Syst Engn, IRT SystemX, JTC Corp, Mega Int, Obeo, Project Performance Int, Sembcorp, Surbana Jurong, Thales, Ctr Excellence Syst Architecture, Management, Econ & Strategy, Ecole Polytechnique, Natl Univ Singapore	Singapore Univ Technol & Design																				2194-5357		978-3-319-29643-2; 978-3-319-29642-5				2016	426						147	158		10.1007/978-3-319-29643-2_11							WOS:000373003500011						
C	Singun, AP		Auer, ME; Guralnick, D; Simonics, I		Singun, Amando Pimentel, Jr.			Heuristics Discovered from Prototyping an Interactive System	TEACHING AND LEARNING IN A DIGITAL WORLD	Advances in Intelligent Systems and Computing				20th International Conference on Interactive Collaborative Learning (ICL) - Teaching and Learning in a Digital World	SEP 27-29, 2017	Budapest, HUNGARY									Singun, Amando P./S-5136-2018	Singun, Amando P./0000-0002-9009-2564												2194-5357	2194-5365	978-3-319-73204-6; 978-3-319-73203-9				2018	716						99	109		10.1007/978-3-319-73204-6_13							WOS:000546474900013						
C	Bennajeh, A; Hachicha, H		Silhavy, R; Senkerik, R; Oplatkova, ZK; Prokopova, Z; Silhavy, P		Bennajeh, Anouer; Hachicha, Hela			Web Service Composition Based on a Multi-agent System	SOFTWARE ENGINEERING IN INTELLIGENT SYSTEMS (CSOC2015), VOL 3	Advances in Intelligent Systems and Computing				4th Computer Science On-line Conference (CSOC)	APR 27-30, 2015	CZECH REPUBLIC										BENNAJEH, ANOUER/0000-0001-9041-0115												2194-5357	2194-5365	978-3-319-18473-9; 978-3-319-18472-2				2015	349						295	305		10.1007/978-3-319-18473-9_29							WOS:000368088400029						
C	Raif, P; Tkacz, E		Gzik, M; Tkacz, E; Paszenda, Z; Pietka, E		Raif, Pawel; Tkacz, Ewaryst			The Face Tracking System for Rehabilitation Robotics Applications	INNOVATIONS IN BIOMEDICAL ENGINEERING	Advances in Intelligent Systems and Computing				Innovations in Biomedical Engineering (IBE) Conference	OCT 19-20, 2017	Zabrze, POLAND									Tkacz, Ewaryst/AAE-7061-2021; Raif, Pawel/H-3270-2011	Raif, Pawel/0000-0002-7810-7479												2194-5357	2194-5365	978-3-319-70063-2; 978-3-319-70062-5				2018	623						185	192		10.1007/978-3-319-70063-2_20							WOS:000451438000020						
C	Rad, AE; Amin, IB; Rahim, MSM; Kolivand, H		PhonAmnuaisuk, S; Au, TW		Rad, Abdolvahab Ehsani; Amin, Ismail Bin Mat; Rahim, Mohd Shafry Mohd; Kolivand, Hoshang			Computer-Aided Dental Caries Detection System from X-Ray Images	COMPUTATIONAL INTELLIGENCE IN INFORMATION SYSTEMS	Advances in Intelligent Systems and Computing				4th INNS Symposia on Computational Intelligence in Information Systems (INNS-CIIS)	NOV 07-09, 2014	Inst Teknologi Brunei, Bandar Seri Begawan, BRUNEI	Bank Islam Brunei Darussalam, DST, Int Neural Network Soc	Inst Teknologi Brunei							Mohd Rahim, Mohd Shafry/B-7552-2016; Kolivand, Hoshang/B-2501-2016	Kolivand, Hoshang/0000-0001-5460-5679												2194-5357	2194-5365	978-3-319-13153-5; 978-3-319-13152-8				2015	331						233	243		10.1007/978-3-319-13153-5_23							WOS:000358277600023						
C	Huang, YF; Tan, TH; Lee, YS; Chen, HC		Barolli, L; Enokido, T		Huang, Yung-Fa; Tan, Tan-Hsu; Lee, Yu-Shing; Chen, Hsing-Chung			Performance of Power Allocation of Relay Stations for Cognitive Radio Based Cooperative Communication Systems	INNOVATIVE MOBILE AND INTERNET SERVICES IN UBIQUITOUS COMPUTING, IMIS-2017	Advances in Intelligent Systems and Computing				11th International Conference on Innovative Mobile and Internet Services in Ubiquitous Computing (IMIS)	JUL 10-12, 2017	Ist Superiore Mario Boella, Torino, ITALY		Ist Superiore Mario Boella								Huang, Yung-Fa/0000-0003-3337-3551												2194-5357	2194-5365	978-3-319-61542-4; 978-3-319-61541-7				2018	612						539	546		10.1007/978-3-319-61542-4_52							WOS:000559732300052						
C	Ray, PK; Saha, E		Duffy, VG; Lightner, N		Ray, Pradip Kumar; Saha, Esha			Ergonomic Performance Measurement and Evaluation for Worksystems in Healthcare	ADVANCES IN HUMAN FACTORS AND ERGONOMICS IN HEALTHCARE	Advances in Intelligent Systems and Computing				7th International Conference on Applied Human Factors and Ergonomics / International Conference on Human Factors and Ergonomics in Healthcare	JUL 27-31, 2016	Bay Lake, FL										Saha, Esha/0000-0002-3262-4876												2194-5357		978-3-319-41652-6; 978-3-319-41651-9				2017	482						329	342		10.1007/978-3-319-41652-6_31							WOS:000390838700031						
C	Amador-Angulo, L; Castillo, O		Melin, P; Castillo, O; Kacprzyk, J; Reformat, M; Melek, W		Amador-Angulo, Leticia; Castillo, Oscar			Comparative Study of Metrics That Affect in the Performance of the Bee Colony Optimization Algorithm Through Interval Type-2 Fuzzy Logic Systems	FUZZY LOGIC IN INTELLIGENT SYSTEM DESIGN: THEORY AND APPLICATIONS	Advances in Intelligent Systems and Computing				Annual Conference of the North-American-Fuzzy-Information-Processing-Society (NAFIPS)	OCT 16-18, 2017	Cancun, MEXICO	N Amer Fuzzy Informat Proc Soc								Castillo, Oscar/I-5578-2019; Melin, Patricia/B-3611-2013	Castillo, Oscar/0000-0002-7385-5689; Melin, Patricia/0000-0001-5798-1426												2194-5357	2194-5365	978-3-319-67137-6; 978-3-319-67136-9				2018	648						61	72		10.1007/978-3-319-67137-6_7							WOS:000431389800007						
C	Nabwey, HA		Kacprzyk, J; Szmidt, E; Zadrozny, S; Atanassov, KT; Krawczak, M		Nabwey, Hossam A.			A Hybrid Approach for Extracting Classification Rules Based on Rough Set Methodology and Fuzzy Inference System and Its Application in Groundwater Quality Assessment	ADVANCES IN FUZZY LOGIC AND TECHNOLOGY 2017, VOL 2	Advances in Intelligent Systems and Computing				10th Conference of the European-Society-for-Fuzzy-Logic-and-Technology (EUSFLAT) / 16th International Workshop on Intuitionistic Fuzzy Sets and Generalized Nets (IWIFSGN)	SEP 11-15, 2017	Warsaw, POLAND	European Soc Fuzzy Log & Technol, Polish Acad Sci, Dept IV Engn Sci, Polish Acad Sci, Syst Res Inst, Polish Operat & Syst Res Soc								Nabwey, Hossam A./M-3649-2018	Nabwey, Hossam A./0000-0002-7167-3822												2194-5357	2194-5365	978-3-319-66824-6; 978-3-319-66823-9				2018	642						611	625		10.1007/978-3-319-66824-6_54							WOS:000432807900054						
S	Mian, ZB; Bottaci, L; Papadopoulos, Y; Sharvia, S; Mahmud, N		Zamojski, W; Sugier, J		Mian, Zhibao; Bottaci, Leonardo; Papadopoulos, Yiannis; Sharvia, Septavera; Mahmud, Nidhal			Model Transformation for Multi-objective Architecture Optimisation of Dependable Systems	DEPENDABILITY PROBLEMS OF COMPLEX INFORMATION SYSTEMS	Advances in Intelligent Systems and Computing															Mahmud, Nidhal/G-3361-2016	Mahmud, Nidhal/0000-0003-0908-5963												2194-5357	2194-5365	978-3-319-08964-5; 978-3-319-08963-8				2015	307						91	110		10.1007/978-3-319-08964-5_6	10.1007/978-3-319-08964-5						WOS:000360128500007						
C	Frejlichowski, D; Gosciewska, K; Forczmanski, P; Nowosielski, A; Hofman, R		Choras, RS		Frejlichowski, Dariusz; Gosciewska, Katarzyna; Forczmanski, Pawel; Nowosielski, Adam; Hofman, Radoslaw			Applying Image Features and AdaBoost Classification for Vehicle Detection in the 'SM4Public' System	IMAGE PROCESSING AND COMMUNICATIONS CHALLENGES 7	Advances in Intelligent Systems and Computing				8th International Conference on Image Processing and Communications (IP and C)	SEP 09-11, 2015	UTP Univ Sci & Technol, Bydgoszcz, POLAND		UTP Univ Sci & Technol							Forczmanski, Pawel/L-1055-2013; Gosciewska, Katarzyna/AAL-7671-2020; Forczmanski, Pawel/AAA-4978-2020; Nowosielski, Adam/D-7930-2016; Frejlichowski, Dariusz/H-8107-2016	Forczmanski, Pawel/0000-0002-3618-9146; Gosciewska, Katarzyna/0000-0002-6726-2174; Forczmanski, Pawel/0000-0002-3618-9146; Nowosielski, Adam/0000-0001-7729-7867; 												2194-5357	2194-5365	978-3-319-23814-2; 978-3-319-23813-5				2016	389						81	88		10.1007/978-3-319-23814-2_10							WOS:000369842100010						
C	Simoes, D; Abreu, PH; Silva, DC		Rocha, A; Correia, AM; Tan, FB; Stroetmann, KA		Simoes, Delfim; Abreu, Pedro Henriques; Silva, Daniel Castro			MusE Central: A Data Aggregation System for Music Events	NEW PERSPECTIVES IN INFORMATION SYSTEMS AND TECHNOLOGIES, VOL 2	Advances in Intelligent Systems and Computing				World Conference on Information Systems and Technologies (WorldCIST)	APR 15-18, 2014	Funchal, PORTUGAL									Abreu, Pedro Henriques/ABE-1698-2020; Castro Silva, Daniel/O-3205-2013	Abreu, Pedro Henriques/0000-0002-9278-8194; Castro Silva, Daniel/0000-0001-9293-0341												2194-5357		978-3-319-05948-8; 978-3-319-05947-1				2014	276						187	197		10.1007/978-3-319-05948-8_18							WOS:000354299300018						
C	Krishna, BV; Aparna, K		Dash, SS; Naidu, PCB; Bayindir, R; Das, S		Krishna, B. Vamsi; Aparna, K.			IoT-Based Indoor Navigation Wearable System for Blind People	ARTIFICIAL INTELLIGENCE AND EVOLUTIONARY COMPUTATIONS IN ENGINEERING SYSTEMS, ICAIECES 2017	Advances in Intelligent Systems and Computing				International Conference on Artificial Intelligence and Evolutionary Computations in Engineering Systems (ICAIECES)	APR 27-29, 2017	Madanapalle Inst Technol & Sci, Madanapalle, INDIA		Madanapalle Inst Technol & Sci																				2194-5357	2194-5365	978-981-10-7868-2; 978-981-10-7867-5				2018	668						413	421		10.1007/978-981-10-7868-2_40							WOS:000550312800040						
C	Raju, BKSPK; Geethakumari, G		Sa, PK; Sahoo, MN; Murugappan, M; Wu, Y; Majhi, B		Raju, B. K. S. P. Kumar; Geethakumari, G.			Timeline-Based Cloud Event Reconstruction Framework for Virtual Machine Artifacts	PROGRESS IN INTELLIGENT COMPUTING TECHNIQUES: THEORY, PRACTICE, AND APPLICATIONS, VOL 2	Advances in Intelligent Systems and Computing				4th International Conference on Advanced Computing, Networking and Informatics (ICACNI)	SEP 22-24, 2016	Natl Inst Technol Rourkela, Ctr Comp Vis & Pattern Recognit, Rourkela, INDIA	Joint Control Syst Soc & Instrumentat & Measurement Soc Chapter, IEEE Kolkata Sect, IEEE Commun Soc Calcutta Chapter, Govt India, CSIR Natl Aerosp Labs Aerosp Elect & Syst Div, Iowa State Univ, Dependable Comp & Networking Lab, Henan Univ Sci & Technol, Multimedia Content Secur Innovat Res Grp, Poznan Univ Technol Vis Lab	Natl Inst Technol Rourkela, Ctr Comp Vis & Pattern Recognit																				2194-5357	2194-5365	978-981-10-3376-6; 978-981-10-3375-9				2018	719						31	42		10.1007/978-981-10-3376-6_4							WOS:000453214400004						
