PT	AU	BA	BE	GP	AF	BF	CA	TI	SO	SE	BS	LA	DT	CT	CY	CL	SP	HO	DE	ID	AB	C1	RP	EM	RI	OI	FU	FX	CR	NR	TC	Z9	U1	U2	PU	PI	PA	SN	EI	BN	J9	JI	PD	PY	VL	IS	PN	SU	SI	MA	BP	EP	AR	DI	D2	EA	PG	WC	SC	GA	UT	PM	OA	HC	HP	DA
C	Oliveira, P; Portela, F; Santos, MF; Machado, J; Abelha, A; Silva, A; Rua, F		Rocha, A; Correia, AM; Adeli, H; Reis, LP; Teixeira, MM		Oliveira, Pedro; Portela, Filipe; Santos, Manuel F.; Machado, Jose; Abelha, Antonio; Silva, Alvaro; Rua, Fernando			Optimization techniques to detect early ventilation extubation in Intensive Care Units	NEW ADVANCES IN INFORMATION SYSTEMS AND TECHNOLOGIES, VOL 2	Advances in Intelligent Systems and Computing				World Conference on Information Systems and Technologies (WorldCIST)	MAR 22-24, 2016	Recife, BRAZIL									Machado, Jose/B-5887-2009; Portela, Filipe/G-5324-2012; Santos, Manuel F/I-8250-2015; Santos, Manuel/ABD-3467-2020; Abelha, Antonio/B-6470-2009	Machado, Jose/0000-0003-4121-6169; Portela, Filipe/0000-0003-2181-6837; Santos, Manuel F/0000-0002-5441-3316; Santos, Manuel/0000-0002-5441-3316; Abelha, Antonio/0000-0001-6457-0756; Silva, Alvaro/0000-0002-2773-3365; Oliveira, Pedro/0000-0002-9220-3336												2194-5357	2194-5365	978-3-319-31307-8; 978-3-319-31306-1				2016	445						599	608		10.1007/978-3-319-31307-8_62							WOS:000417260200062						
C	Georgieva, T; Demirova, S; Zlateva, P		Abraham, A; Kovalev, S; Tarassov, V; Snasel, V; Vasileva, M; Sukhanov, A		Georgieva, Todorka; Demirova, Siyka; Zlateva, Penka			An Approach for Monitoring Transport and Delivery Chain of Liquid Fuels in Bulgaria	PROCEEDINGS OF THE SECOND INTERNATIONAL SCIENTIFIC CONFERENCE INTELLIGENT INFORMATION TECHNOLOGIES FOR INDUSTRY (IITI'17), VOL 2	Advances in Intelligent Systems and Computing				2nd International Scientific Conference on Intelligent Information Technologies for Industry (IITI)	SEP 14-16, 2017	Varna, BULGARIA	Tech Univ Varna, Tech Univ Sofia, VSB Tech Univ Ostrava, Rostov State Transport Univ								Demirova, Siyka D/V-4825-2017; Zlateva, Penka P/V-8971-2017; Demirova, Siyka/H-1776-2017	Demirova, Siyka D/0000-0001-6557-7407; Zlateva, Penka P/0000-0002-8615-4208; Demirova, Siyka/0000-0001-6557-7407												2194-5357	2194-5365	978-3-319-68324-9				2018	680						271	279		10.1007/978-3-319-68324-9_30							WOS:000585075400030						
C	Talantsev, A; Larsson, A; Kivunike, FN; Sundgren, D		Rocha, A; Correia, AM; Tan, FB; Stroetmann, KA		Talantsev, Anton; Larsson, Aron; Kivunike, Florence Nameere; Sundgren, David			Quantitative Scenario-Based Assessment of Contextual Factors for ICT4D Projects: Design and Implementation in a Web Based Tool	NEW PERSPECTIVES IN INFORMATION SYSTEMS AND TECHNOLOGIES, VOL 1	Advances in Intelligent Systems and Computing				World Conference on Information Systems and Technologies (WorldCIST)	APR 15-18, 2014	Funchal, PORTUGAL																						2194-5357		978-3-319-05951-8; 978-3-319-05950-1				2014	275						477	490		10.1007/978-3-319-05951-8_45							WOS:000354297600045						
C	Ksieniewicz, P; Wozniak, M		Burduk, R; Jackowski, K; Kurzynski, M; Wozniak, M; Zolnierek, A		Ksieniewicz, Pawel; Wozniak, Michal			Artificial Photoreceptors for Ensemble Classification of Hyperspectral Images	PROCEEDINGS OF THE 9TH INTERNATIONAL CONFERENCE ON COMPUTER RECOGNITION SYSTEMS, CORES 2015	Advances in Intelligent Systems and Computing				9th International Conference on Computer Recognition Systems (CORES)	MAY 25-27, 2015	Wroclaw, POLAND	Wroclaw Univ Technol, Dept Syst & Comp Networks								Wozniak, Michal/A-4806-2008; Ksieniewicz, Pawel/AAD-3318-2019	Wozniak, Michal/0000-0003-0146-4205; Ksieniewicz, Pawel/0000-0001-9578-8395												2194-5357	2194-5365	978-3-319-26227-7; 978-3-319-26225-3				2016	403						471	479		10.1007/978-3-319-26227-7_44							WOS:000408649300044						
C	Ferreira, A; Portela, F; Santos, MF		Rocha, A; Correia, AM; Costanzo, S; Reis, LP		Ferreira, Andreia; Portela, Filipe; Santos, Manuel Filipe			Pervasive Business Intelligence Platform to Improve the Quality of Decision Process in Primary and Secondary Education - A Portuguese Case Study	NEW CONTRIBUTIONS IN INFORMATION SYSTEMS AND TECHNOLOGIES, VOL 2	Advances in Intelligent Systems and Computing				World Conference on Information Systems and Technologies (WorldCIST)	APR 01-03, 2015	Univ Azores, Ponta Delgada, PORTUGAL		Univ Azores							Santos, Manuel F/I-8250-2015; Santos, Manuel/ABD-3467-2020; Portela, Filipe/G-5324-2012	Santos, Manuel F/0000-0002-5441-3316; Santos, Manuel/0000-0002-5441-3316; Portela, Filipe/0000-0003-2181-6837												2194-5357	2194-5365	978-3-319-16528-8; 978-3-319-16527-1				2015	354						167	176		10.1007/978-3-319-16528-8_16							WOS:000482882400016						
C	Alqahtani, SM; Alanazi, S; McAuley, D		Zamojski, W; Mazurkiewicz, J; Sugier, J; Walkowiak, T; Kacprzyk, J		Alqahtani, Saeed M.; Alanazi, Sultan; McAuley, Derek			The Role of Enterprise Social Networking (ESN) on Business: Five Effective Recommendations for ESN	PROCEEDINGS OF THE NINTH INTERNATIONAL CONFERENCE ON DEPENDABILITY AND COMPLEX SYSTEMS DEPCOS-RELCOMEX	Advances in Intelligent Systems and Computing				9th International Conference on Dependability and Complex Systems (DepCoS-RELCOMEX)	JUN 30-JUL 04, 2014	Brunow, POLAND	Wroclaw Univ Technol, Inst Comp Engn Control & Robot								Alanazi, Sultan/AAZ-1801-2021	McAuley, Derek/0000-0001-9159-9933												2194-5357		978-3-319-07013-1				2014	286						23	36		10.1007/978-3-319-07013-1_3							WOS:000363748100003						
C	Chauhan, K; Sharma, S		Satapathy, SC; Mandal, JK; Udgata, SK; Bhateja, V		Chauhan, Kavita; Sharma, Shanu			Analysis and Optimization of Feature Extraction Techniques for Content Based Image Retrieval	INFORMATION SYSTEMS DESIGN AND INTELLIGENT APPLICATIONS, VOL 3, INDIA 2016	Advances in Intelligent Systems and Computing				3rd International Conference on Information System Design and Intelligent Applications (INDIA)	JAN 08-09, 2016	ANITS Campus, Visakhapatnam, INDIA	Anil Neerukonda Inst Technol & Sci, Det CSE, ANITS CSI Student Branch	ANITS Campus							Sharma, Shanu/AAI-5940-2020	sharma, shanu/0000-0003-0384-7832												2194-5357	2194-5365	978-81-322-2757-1; 978-81-322-2756-4				2016	435						357	365		10.1007/978-81-322-2757-1_36							WOS:000373011500036						
C	Krawczyk, H; Zima, D		Zamojski, W; Mazurkiewicz, J; Sugier, J; Walkowiak, T; Kacprzyk, J		Krawczyk, Henryk; Zima, Dawid			Extending Continuous Integration with Post-mortem Debug Automation of Unhandled Exceptions Occurred in Kernel or User Mode Applications	ADVANCES IN DEPENDABILITY ENGINEERING OF COMPLEX SYSTEMS	Advances in Intelligent Systems and Computing				12th International Conference on Dependability and Complex Systems (DepCoS-RELCOMEX)	JUL 02-06, 2017	Brunow, POLAND	Wroclaw Univ Sci & Technol, Dept Comp Engn																					2194-5357	2194-5365	978-3-319-59415-6; 978-3-319-59414-9				2018	582						205	214		10.1007/978-3-319-59415-6_20							WOS:000441189200020						
S	Jelinek, HF; Miosevic, NT; Karperien, A; Krstonosic, B		Dumitrache, I		Jelinek, Herbert F.; Miosevic, Nebojsa T.; Karperien, Audrey; Krstonosic, Bojana			Box-Counting and Multifractal Analysis in Neuronal and Glial Classification	ADVANCES IN INTELLIGENT CONTROL SYSTEMS AND COMPUTER SCIENCE	Advances in Intelligent Systems and Computing															Jelinek, Herbert/AAQ-6825-2020; Jelinek, Herbert F/S-6779-2019; Karperien, Audrey/H-2142-2013	Jelinek, Herbert F/0000-0001-5457-6193; Karperien, Audrey/0000-0002-8190-6327												2194-5357	2194-5365	978-3-642-32547-2				2013	187						177	189			10.1007/978-3-642-32548-9						WOS:000312752500013						
C	Kiran, P; Jibukumar, MG		Satapathy, SC; Raju, KS; Mandal, JK; Bhateja, V		Kiran, P.; Jibukumar, M. G.			Dynamic Multiuser Scheduling with Interference Mitigation in SC-FDMA-Based Communication Systems	PROCEEDINGS OF THE SECOND INTERNATIONAL CONFERENCE ON COMPUTER AND COMMUNICATION TECHNOLOGIES, IC3T 2015, VOL 2	Advances in Intelligent Systems and Computing				2nd International Conference on Computer and Communication Technologies	JUL 24-26, 2015	CMR Tech Campus, Hyderabad, INDIA	CSI, Div V Educ & Res	CMR Tech Campus							Jibukumar, M./U-2453-2019													2194-5357	2194-5365	978-81-322-2523-2; 978-81-322-2522-5				2016	380						289	297		10.1007/978-81-322-2523-2_27							WOS:000378023800027						
C	Paul, M; Das, A		Mishra, DK; Azar, AT; Joshi, A		Paul, Mridul; Das, Ajanta			Provisioning of Healthcare Service in Cloud	INFORMATION AND COMMUNICATION TECHNOLOGY (ICICT 2016)	Advances in Intelligent Systems and Computing				2nd International Congress on Information and Communication Technology (ICICT)	DEC 12-13, 2016	Bangkok, THAILAND	G R Fdn, Comp Soc India Div IV Commun & Div V Educ & Res																					2194-5357	2194-5365	978-981-10-5508-9; 978-981-10-5507-2				2018	625						259	268		10.1007/978-981-10-5508-9_25							WOS:000448462400025						
C	Hernandez-Saucedo, AL; Mejia, J		Mejia, J; Munoz, M; Rocha, A; CalvoManzano, J		Hernandez-Saucedo, Ana L.; Mejia, Jezreel			Proposal of a Hybrid Process to Manage Vulnerabilities in Web Applications	TRENDS AND APPLICATIONS IN SOFTWARE ENGINEERING	Advances in Intelligent Systems and Computing				4th International Conference on Software Process Improvement (CIMPS)	OCT 28-30, 2015	Autonomous Univ Sinaloa, Fac Informatic Mazatlan, Culiacan, MEXICO		Autonomous Univ Sinaloa, Fac Informatic Mazatlan																				2194-5357		978-3-319-26285-7; 978-3-319-26283-3				2016	405						59	69		10.1007/978-3-319-26285-7_6							WOS:000377501300006						
S	Campos-Rebelo, R; Costa, A; Gomes, L		Hippe, ZS; Kulikowski, JL; Mroczek, T; Wtorek, J		Campos-Rebelo, R.; Costa, A.; Gomes, L.			Enhanced Event Modeling for Human-System Interactions Using IOPT Petri Nets	HUMAN-COMPUTER SYSTEMS INTERACTION: BACKGROUNDS AND APPLICATIONS 3	Advances in Intelligent Systems and Computing															Costa, Aniko/A-7067-2012; Rebelo, Rogerio Campos/D-1015-2012; Campos-Rebelo, Rogerio/AAG-8247-2019	Costa, Aniko/0000-0001-8147-028X; Rebelo, Rogerio Campos/0000-0001-7177-7966; Campos-Rebelo, Rogerio/0000-0001-7177-7966; Gomes, Luis/0000-0003-4299-8270												2194-5357	2194-5365	978-3-319-08491-6; 978-3-319-08490-9				2014	300						39	50		10.1007/978-3-319-08491-6_4	10.1007/978-3-319-08491-6						WOS:000360129800004						
C	Lazarenko, AL; Orlova, SA; Rykova, IA; Golaydo, IM; Uvarova, EE		Popkova, EG		Lazarenko, Alla L.; Orlova, Svetlana A.; Rykova, Irina A.; Golaydo, Irina M.; Uvarova, Elena E.			Increase of Effectiveness of Public Welfare Through Improvement of the System of Investment Management	IMPACT OF INFORMATION ON MODERN HUMANS	Advances in Intelligent Systems and Computing				Scientific and Practical Conference on Humans as an Object of Study by Modern Science	NOV 23-24, 2017	Nizhny Novgorod, RUSSIA	Kozma Minin Nizhny Novgorod State Pedagog Univ, Inst Sci Commun																					2194-5357	2194-5365	978-3-319-75383-6; 978-3-319-75382-9				2018	622						16	29		10.1007/978-3-319-75383-6_2							WOS:000570135200002						
C	Birjali, M; Beni-Hssane, A; Erritali, M		Abraham, A; Haqiq, A; Alimi, AM; Mezzour, G; Rokbani, N; Muda, AK		Birjali, Marouane; Beni-Hssane, Abderrahim; Erritali, Mohammed			A Method Proposed for Estimating Depressed Feeling Tendencies of Social Media Users Utilizing Their Data	PROCEEDINGS OF THE 16TH INTERNATIONAL CONFERENCE ON HYBRID INTELLIGENT SYSTEMS (HIS 2016)	Advances in Intelligent Systems and Computing				16th International Conference on Hybrid Intelligent Systems (HIS) / 8th World Congress on Nature and Biologically Inspired Computing (NaBIC)	NOV 21-23, 2016	Marrakech, MOROCCO	Machine Intelligence Res Labs, Hassan 1st Univ, Univ Sfax, Fac Sci Tech Settat, e ngn org, Assoc Grand Atlas, Groupement Format Continue, Univ Int Rabat, Lab Informatique Reseaux Mobilite & Modelisat, Res Grp Intelligent Machines Lab								Birjali, Marouane/N-3519-2017	Birjali, Marouane/0000-0001-9792-6034; ERRITALI, MOHAMMED/0000-0002-1672-8085												2194-5357	2194-5365	978-3-319-52941-7; 978-3-319-52940-0				2017	552						413	420		10.1007/978-3-319-52941-7_41							WOS:000418854600041						
C	Martinez-Martin, E; del Pobil, AP		Lee, S; Cho, HS; Yoon, KJ; Lee, JM		Martinez-Martin, Ester; del Pobil, Angel P.			Robust Object Recognition in Unstructured Environments	INTELLIGENT AUTONOMOUS SYSTEMS 12, VOL 1	Advances in Intelligent Systems and Computing				12th International Conference of Intelligent Autonomous Systems	JUN 26-29, 2012	Jeju, SOUTH KOREA									Martinez-Martin, Ester/M-7374-2016	Martinez-Martin, Ester/0000-0003-4495-6912; del Pobil, Angel P./0000-0001-6227-3758												2194-5357	2194-5365	978-3-642-33925-7; 978-3-642-33926-4				2013	193						705	+									WOS:000313842700067						
C	Taran, V; Trofimenko, V		Abraham, A; Kovalev, S; Tarassov, V; Snasel, V; Vasileva, M; Sukhanov, A		Taran, Vladimir; Trofimenko, Vladimir			Transport Systems Intellectualization Based on Analytical Control Synthesis of Angular Velocities for the Axisymmetric Spacecraft	PROCEEDINGS OF THE SECOND INTERNATIONAL SCIENTIFIC CONFERENCE INTELLIGENT INFORMATION TECHNOLOGIES FOR INDUSTRY (IITI'17), VOL 2	Advances in Intelligent Systems and Computing				2nd International Scientific Conference on Intelligent Information Technologies for Industry (IITI)	SEP 14-16, 2017	Varna, BULGARIA	Tech Univ Varna, Tech Univ Sofia, VSB Tech Univ Ostrava, Rostov State Transport Univ								Taran, Vladimir/AAK-1890-2021; Trofimenko, Vladimir/AAK-1875-2021	Taran, Vladimir/0000-0002-1308-3883; 												2194-5357	2194-5365	978-3-319-68324-9				2018	680						154	160		10.1007/978-3-319-68324-9_17							WOS:000585075400017						
C	de Carvalho, CEP; de Oliveira, PPB		Rocha, A; Correia, AM; Costanzo, S; Reis, LP		de Carvalho, Carlos E. P.; de Oliveira, Pedro P. B.			Sorting with One-Dimensional Cellular Automata Using Odd-Even Transposition	NEW CONTRIBUTIONS IN INFORMATION SYSTEMS AND TECHNOLOGIES, VOL 1, PT 1	Advances in Intelligent Systems and Computing				World Conference on Information Systems and Technologies (WorldCIST)	APR 01-03, 2015	Univ Azores, Ponta Delgada, PORTUGAL		Univ Azores							de Oliveira, Pedro P.B./C-2489-2012	de Oliveira, Pedro P.B./0000-0002-6022-0270												2194-5357		978-3-319-16486-1; 978-3-319-16485-4				2015	353		1				523	532		10.1007/978-3-319-16486-1_51							WOS:000381744400051						
C	Khouri, S; Bellatreche, L; Berkani, N		Morzy, T; Harder, T; Wrembel, R		Khouri, Selma; Bellatreche, Ladjel; Berkani, Nabila			Generic Conceptual Framework for Handling Schema Diversity during Source Integration Semantic Database Case Study	ADVANCES IN DATABASES AND INFORMATION SYSTEMS	Advances in Intelligent Systems and Computing				16th East-European Conference on Advances in Databases and Information Systems (ADBIS 2012)	SEP 17-21, 2012	Poznan, POLAND	Allegro Grp, POZnan, IBM, Microsoft, Roche, Targit, Samsung, Edge Solut, Itelligence																					2194-5357	2194-5365	978-3-642-32740-7				2013	186						149	+									WOS:000313020600014						
C	Wang, JQ; Huang, ZP		Balas, VE; Jain, LC; Zhao, X		Wang, Jianqiang; Huang, Zhipeng			Analysis and Forecast of Regional Freight Characteristics in the Silk Road Economic Belt	INFORMATION TECHNOLOGY AND INTELLIGENT TRANSPORTATION SYSTEMS, VOL 2	Advances in Intelligent Systems and Computing				International Conference on Information Technology and Intelligent Transportation Systems (ITITS)	DEC 12-13, 2015	Xian, PEOPLES R CHINA	Shaanxi Comp Soc, Changan Univ, Xian Univ Technol, NW Poly Tech Univ, Shaanxi Sirui Ind Co Ltd, CAS									Wang, Jianqiang/0000-0002-1087-5762												2194-5357	2194-5365	978-3-319-38771-0; 978-3-319-38769-7				2017	455		2				53	63		10.1007/978-3-319-38771-0_6							WOS:000452856700006						
C	Chovanec, M; Cechovic, L; Mandak, L		Merdan, M; Lepuschitz, W; Koppensteiner, G; Balogh, R		Chovanec, Michal; Cechovic, Lukas; Mandak, Lukas			Aeris-Robots Laboratory with Dynamic Environment	ROBOTICS IN EDUCATION: RESEARCH AND PRACTICES FOR ROBOTICS IN STEM EDUCATION	Advances in Intelligent Systems and Computing				7th International Conference on Robotics in Education (RiE)	APR 14-15, 2016	Vienna, AUSTRIA																						2194-5357		978-3-319-42975-5; 978-3-319-42974-8				2017	457						169	180		10.1007/978-3-319-42975-5_16							WOS:000401107000016						
C	Bhowmik, S; Sarkar, R; Nasipuri, M		Mandal, JK; Satapathy, SC; Sanyal, MK; Bhateja, V		Bhowmik, Showmik; Sarkar, Ram; Nasipuri, Mita			Text and Non-text Separation in Handwritten Document Images Using Local Binary Pattern Operator	PROCEEDINGS OF THE FIRST INTERNATIONAL CONFERENCE ON INTELLIGENT COMPUTING AND COMMUNICATION	Advances in Intelligent Systems and Computing				1st International Conference on Intelligent Computing and Communication, (ICIC2)	FEB 18-19, 2016	Univ Kalyani, Kalyani, INDIA	Univ Kalyani, Fac Engn, Technol & Management, Kalyani Univ, DST PURSE Program Govt India, UGC, Comp Soc India Div V	Univ Kalyani							Sarkar, Ram/AAX-3822-2020	Sarkar, Ram/0000-0001-8813-4086												2194-5357	2194-5365	978-981-10-2035-3; 978-981-10-2034-6				2017	458						507	515		10.1007/978-981-10-2035-3_52							WOS:000401109800052						
C	Sabarish, K; Shaji, RS		Suresh, LP; Panigrahi, BK		Sabarish, K.; Shaji, R. S.			Mobile Governance Framework for Emergency Management	PROCEEDINGS OF THE INTERNATIONAL CONFERENCE ON SOFT COMPUTING SYSTEMS, ICSCS 2015, VOL 1	Advances in Intelligent Systems and Computing				International Conference On Soft Computing Systems (ICSCS)	APR 20-21, 2015	Noorul Islam Univ, Noorul Islam Ctr Higher Educ, Kumaracoil, INDIA		Noorul Islam Univ, Noorul Islam Ctr Higher Educ							Shaji, R S/I-3531-2014	r s, shaji/0000-0003-1903-0237												2194-5357	2194-5365	978-81-322-2671-0; 978-81-322-2669-7				2016	397						957	973		10.1007/978-81-322-2671-0_91							WOS:000377539600091						
C	Lubomski, P; Krawczyk, H		Zamojski, W; Mazurkiewicz, J; Sugier, J; Walkowiak, T; Kacprzyk, J		Lubomski, Pawel; Krawczyk, Henryk			Clustering Context Items into User Trust Levels	DEPENDABILITY ENGINEERING AND COMPLEX SYSTEMS	Advances in Intelligent Systems and Computing				11th International Conference on Dependability and Complex Systems (DepCoS-RELCOMEX)	JUN 27-JUL 01, 2016	Brunow, POLAND	Wroclaw Univ Sci & Technol, Dept Comp Engn								Krawczyk, Henryk/G-9508-2017; Lubomski, Pawel/U-7347-2017	Krawczyk, Henryk/0000-0003-0436-6264; Lubomski, Pawel/0000-0002-1533-229X												2194-5357	2194-5365	978-3-319-39639-2; 978-3-319-39638-5				2016	470						333	342		10.1007/978-3-319-39639-2_29							WOS:000389636200029						
C	Elhozmari, M; Ettalbi, A		Abraham, A; Haqiq, A; Muda, AK; Gandhi, N		Elhozmari, Majda; Ettalbi, Ahmed			Straightforward MAAS to Ensure Interoperability in Heterogeneous Environment	INNOVATIONS IN BIO-INSPIRED COMPUTING AND APPLICATIONS, IBICA 2017	Advances in Intelligent Systems and Computing				8th International Conference on Innovations in Bio-Inspired Computing and Applications (IBICA)	DEC 11-13, 2017	Marrakech, MOROCCO	Machine Intelligence Res Labs, Hassan 1 Univ, Fac Sci & Tech																					2194-5357	2194-5365	978-3-319-76354-5; 978-3-319-76353-8				2018	735						211	220		10.1007/978-3-319-76354-5_19							WOS:000542694300019						
C	Shen, ZH; Burnham, KJ; Smalov, L		Selvaraj, H; Zydek, D; Chmaj, G		Shen, Zhonghua; Burnham, Keith J.; Smalov, Leonid			Optimised Job-Shop Scheduling via Genetic Algorithm for a Manufacturing Production System	PROGRESS IN SYSTEMS ENGINEERING	Advances in Intelligent Systems and Computing				23rd International Conference on Systems Engineering	AUG 19-21, 2014	Las Vegas, NV	Univ Nevada Las Vegas, ALDEC, NVEnergy																					2194-5357		978-3-319-08421-3				2015	366						89	92		10.1007/978-3-319-08422-0_13							WOS:000360214900013						
C	Mustafiz, S; Barroca, B; Gomes, C; Vangheluwe, H		Latifi, S		Mustafiz, Sadaf; Barroca, Bruno; Gomes, Claudio; Vangheluwe, Hans			Towards Modular Language Design Using Language Fragments: The Hybrid Systems Case Study	INFORMATION TECHNOLOGY: NEW GENERATIONS	Advances in Intelligent Systems and Computing				13th International Conference on Information Technology - New Generations (ITNG)	APR 11-13, 2016	Las Vegas, NV									Vangheluwe, Hans/H-9884-2016	Vangheluwe, Hans/0000-0003-2079-6643; Gomes, Claudio/0000-0003-2692-9742												2194-5357	2194-5365	978-3-319-32467-8; 978-3-319-32466-1				2016	448						785	797		10.1007/978-3-319-32467-8_68							WOS:000385289400068						
C	Jackowski, K; Jankowski, D; Quintian, H; Corchado, E; Wozniak, M		Burduk, R; Jackowski, K; Kurzynski, M; Wozniak, M; Zolnierek, A		Jackowski, Konrad; Jankowski, Dariusz; Quintian, Hector; Corchado, Emilio; Wozniak, Michal			Modelling Dental Milling Process with Machine Learning-Based Regression Algorithms	PROCEEDINGS OF THE 9TH INTERNATIONAL CONFERENCE ON COMPUTER RECOGNITION SYSTEMS, CORES 2015	Advances in Intelligent Systems and Computing				9th International Conference on Computer Recognition Systems (CORES)	MAY 25-27, 2015	Wroclaw, POLAND	Wroclaw Univ Technol, Dept Syst & Comp Networks								Wozniak, Michal/A-4806-2008; Quintian, Hector/G-4609-2015	Wozniak, Michal/0000-0003-0146-4205; Quintian, Hector/0000-0002-0268-7999												2194-5357	2194-5365	978-3-319-26227-7; 978-3-319-26225-3				2016	403						701	711		10.1007/778-3-319-26227-7_66							WOS:000408649300066						
C	Senthil, K; Arun, A; Sowmya, KS		Sa, PK; Sahoo, MN; Murugappan, M; Wu, Y; Majhi, B		Senthil, Karthik; Arun, Abhi; Sowmya, Kamath S.			A Content-Based Visual Information Retrieval Approach for Automated Image Annotation	PROGRESS IN INTELLIGENT COMPUTING TECHNIQUES: THEORY, PRACTICE, AND APPLICATIONS, VOL 1	Advances in Intelligent Systems and Computing				4th International Conference on Advanced Computing, Networking and Informatics (ICACNI)	SEP 22-24, 2016	Natl Inst Technol Rourkela, Ctr Comp Vis & Pattern Recognit, Rourkela, INDIA	Joint Control Syst Soc & Instrumentat & Measurement Soc Chapter, IEEE Kolkata Sect, IEEE Commun Soc Calcutta Chapter, Govt India, CSIR Natl Aerosp Labs Aerosp Elect & Syst Div, Iowa State Univ, Dependable Comp & Networking Lab, Henan Univ Sci & Technol, Multimedia Content Secur Innovat Res Grp, Poznan Univ Technol Vis Lab	Natl Inst Technol Rourkela, Ctr Comp Vis & Pattern Recognit								Kamath S, Sowmya/0000-0002-0888-7238												2194-5357	2194-5365	978-981-10-3373-5; 978-981-10-3372-8				2018	518						69	80		10.1007/978-981-10-3373-5_6							WOS:000450399000006						
C	Rautray, R; Balabantaray, RC		Dash, SS; Vijayakumar, K; Panigrahi, BK; Das, S		Rautray, Rasmita; Balabantaray, Rakesh Chandra			CSTS: Cuckoo Search Based Model for Text Summarization	ARTIFICIAL INTELLIGENCE AND EVOLUTIONARY COMPUTATIONS IN ENGINEERING SYSTEMS, ICAIECES 2016	Advances in Intelligent Systems and Computing				International Conference on Artificial Intelligence and Evolutionary Computations in Engineering Systems (ICAIECES)	MAY 19-21, 2016	SRM Univ, Chennai, INDIA		SRM Univ							Balabantaray, Rakesh Chandra/D-4935-2016													2194-5357	2194-5365	978-981-10-3174-8; 978-981-10-3173-1				2017	517						141	150		10.1007/978-981-10-3174-8_13							WOS:000432221400013						
C	Cvejn, J; Tvrdik, J		Silhavy, R; Senkerik, R; Oplatkova, ZK; Prokopova, Z; Silhavy, P		Cvejn, Jan; Tvrdik, Jiri			Adaptive Control System of a Robot Manipulator Based on a Decentralized Position-Dependent PID Controller	CYBERNETICS AND MATHEMATICS APPLICATIONS IN INTELLIGENT SYSTEMS, CSOC2017, VOL 2	Advances in Intelligent Systems and Computing				6th Computer Science On-Line Conference (CSOC)	APR, 2017	Zlin, CZECH REPUBLIC	OpenPublish eu s r o																					2194-5357	2194-5365	978-3-319-57264-2				2017	574						100	109		10.1007/978-3-319-57264-2_10							WOS:000405339200010						
C	Buslaev, AP; Tatashev, AG; Yashina, MV		Zamojski, W; Mazurkiewicz, J; Sugier, J; Walkowiak, T; Kacprzyk, J		Buslaev, Alexander P.; Tatashev, Alexander G.; Yashina, Marina V.			On Irrational Oscillations of a Bipendulum	THEORY AND ENGINEERING OF COMPLEX SYSTEMS AND DEPENDABILITY	Advances in Intelligent Systems and Computing				10th International Conference on Dependability and Complex Systems (DepCoS-RELCOMEX)	JUN 29-JUL 03, 2015	Brunow, POLAND	Wroclaw Univ Technol, Dept Comp Engn								Tatashev, Alexander/F-5643-2019; Yashina, Marina V/N-3346-2013; Buslaev, Alexander/K-9482-2013	Yashina, Marina V/0000-0001-8810-918X; Buslaev, Alexander/0000-0002-8818-9500												2194-5357		978-3-319-19216-1; 978-3-319-19215-4				2015	365						57	63		10.1007/978-3-319-19216-1_6							WOS:000365127100006						
C	Akbar, A; Basha, SM; Sattar, SA		Satapathy, SC; Mandal, JK; Udgata, SK; Bhateja, V		Akbar, Abdullah; Basha, S. Mahaboob; Sattar, Syed Abdul			A Comparative Study on Load Balancing Algorithms for SIP Servers	INFORMATION SYSTEMS DESIGN AND INTELLIGENT APPLICATIONS, VOL 3, INDIA 2016	Advances in Intelligent Systems and Computing				3rd International Conference on Information System Design and Intelligent Applications (INDIA)	JAN 08-09, 2016	ANITS Campus, Visakhapatnam, INDIA	Anil Neerukonda Inst Technol & Sci, Det CSE, ANITS CSI Student Branch	ANITS Campus																				2194-5357	2194-5365	978-81-322-2757-1; 978-81-322-2756-4				2016	435						79	88		10.1007/978-81-322-2757-1_9							WOS:000373011500009						
