PT	AU	BA	BE	GP	AF	BF	CA	TI	SO	SE	BS	LA	DT	CT	CY	CL	SP	HO	DE	ID	AB	C1	RP	EM	RI	OI	FU	FX	CR	NR	TC	Z9	U1	U2	PU	PI	PA	SN	EI	BN	J9	JI	PD	PY	VL	IS	PN	SU	SI	MA	BP	EP	AR	DI	D2	EA	PG	WC	SC	GA	UT	PM	OA	HC	HP	DA
S	Gkiokas, A; Tsardoulias, EG; Mitkas, PA		Szewczyk, R; Zielinski, C; Kaliczynska, M		Gkiokas, Alexandros; Tsardoulias, Emmanouil G.; Mitkas, Pericles A.			Hive Collective Intelligence for Cloud Robotics: A Hybrid Distributed Robotic Controller Design for Learning and Adaptation	PROGRESS IN AUTOMATION, ROBOTICS AND MEASURING TECHNIQUES: VOL 2 ROBOTICS	Advances in Intelligent Systems and Computing															Tsardoulias, Manos/AAE-5144-2020	Tsardoulias, Manos/0000-0001-9034-4832												2194-5357	2194-5365	978-3-319-15847-1				2015	351						65	78		10.1007/978-3-319-15847-1_7	10.1007/978-3-319-15847-1						WOS:000400259000008						
C	Szczypta, J; Lapa, K		Borzemski, L; Grzech, A; Swiatek, J; Wilimowska, Z		Szczypta, Jacek; Lapa, Krystian			Aspects of Structure Selection and Parameters Tuning of Control Systems Using Hybrid Genetic-Fruit Fly Algorithm	INFORMATION SYSTEMS ARCHITECTURE AND TECHNOLOGY, ISAT 2015, PT I	Advances in Intelligent Systems and Computing				36th International Conference on Information Systems Architecture and Technology (ISAT)	SEP 20-22, 2015	Karpacz, POLAND	Wroclaw Univ Technol, Fac Comp Sci & Management, Dept Comp Sci, Wroclaw Univ Technol, Fac Comp Sci & Management, Dept Management Syst								Lapa, Krystian/T-4849-2018	Lapa, Krystian/0000-0002-3926-5685												2194-5357		978-3-319-28555-9; 978-3-319-28553-5				2016	429						101	110		10.1007/978-3-319-28555-9_9							WOS:000378550500009						
C	Suraj, R; Chitra, P; Madumidha, S		Suresh, LP; Dash, SS; Panigrahi, BK		Suraj, R.; Chitra, P.; Madumidha, S.			Evaluation of Worst-Case Execution Time of Tasks on Multi-core Processor	ARTIFICIAL INTELLIGENCE AND EVOLUTIONARY ALGORITHMS IN ENGINEERING SYSTEMS, VOL 2	Advances in Intelligent Systems and Computing				International Conference on Artificial Intelligence and Evolutionary Algorithms in Engineering Systems (ICAEES)	APR 22-23, 2014	Noorul Islam Univ, Noorul Islam Ctr Higher Educ, Kumaracoil, INDIA		Noorul Islam Univ, Noorul Islam Ctr Higher Educ							Chitra, P./AAQ-4817-2020	P, Chitra/0000-0002-0235-1205												2194-5357	2194-5365	978-81-322-2135-7; 978-81-322-2134-0				2015	325						441	448		10.1007/978-81-322-2135-7_47							WOS:000357378500047						
S	Baginski, K; Wierciak, J		Szewczyk, R; Zielinski, C; Kaliczynska, M		Baginski, Karol; Wierciak, Jakub			Forming of Operational Characteristics of an Orthotic Robot by Influencing Parameters of Its Drive Systems	PROGRESS IN AUTOMATION, ROBOTICS AND MEASURING TECHNIQUES: VOL 2 ROBOTICS	Advances in Intelligent Systems and Computing															Baginski, Karol/R-6798-2018	Baginski, Karol/0000-0001-9488-0923												2194-5357	2194-5365	978-3-319-15847-1				2015	351						1	9		10.1007/978-3-319-15847-1_1	10.1007/978-3-319-15847-1						WOS:000400259000002						
C	Suciu, G; Ciuciuc, R; Pasat, A; Scheianu, A		Rocha, A; Correia, AM; Adeli, H; Reis, LP; Costanzo, S		Suciu, George; Ciuciuc, Ramona; Pasat, Adrian; Scheianu, Andrei			Remote Sensing for Forest Environment Preservation	RECENT ADVANCES IN INFORMATION SYSTEMS AND TECHNOLOGIES, VOL 2	Advances in Intelligent Systems and Computing				World Conference on Information Systems and Technologies (WorldCIST)	APR 11-13, 2017	Madeira, PORTUGAL									Suciu, George/G-9070-2014	Suciu, George/0000-0001-8455-6177												2194-5357	2194-5365	978-3-319-56538-5; 978-3-319-56537-8				2017	570						211	220		10.1007/978-3-319-56538-5_23							WOS:000425541200023						
C	Wnuk, P; Syfert, M		Koscielny, JM; Syfert, M; Sztyber, A		Wnuk, Pawel; Syfert, Michal			Efficiency Analysis of Relational and Nonrelational Databases in Application to Archiving Measurements	ADVANCED SOLUTIONS IN DIAGNOSTICS AND FAULT TOLERANT CONTROL	Advances in Intelligent Systems and Computing				13th International Conference on Diagnostics of Processes and Systems (DPS)	SEP 10-13, 2017	Sandomierz, POLAND	Warsaw Univ Technol, Univ Zielona Gora, Gdansk Univ Technol, Warsaw Univ Technol, Fac Mechatron, Inst Automat Control & Robot, Polish Acad Sci, Comm Automat Control & Robot									Syfert, Michal/0000-0001-7741-607X												2194-5357	2194-5365	978-3-319-64474-5; 978-3-319-64473-8				2018	635						458	470		10.1007/978-3-319-64474-5_39							WOS:000456930300039						
C	Smits, D; Visser, A; Groen, FCA		Lee, S; Cho, HS; Yoon, KJ; Lee, JM		Smits, Djura; Visser, Arnoud; Groen, Frans C. A.			Modeling Pedestrians in an Airport Scenario with a Time-Augmented Petri Net	INTELLIGENT AUTONOMOUS SYSTEMS 12 , VOL 2	Advances in Intelligent Systems and Computing				12th International Conference of Intelligent Autonomous Systems	JUN 26-29, 2012	Jeju, SOUTH KOREA									Visser, Arnoud/J-9800-2013	Visser, Arnoud/0000-0002-7525-7017												2194-5357	2194-5365	978-3-642-33931-8; 978-3-642-33932-5				2013	194						543	551									WOS:000313768300050						
C	Butlewski, M; Dahlke, G; Drzewiecka-Dahlke, M; Gorny, A; Pacholski, L		Goossens, RHM		Butlewski, Marcin; Dahlke, Grzegorz; Drzewiecka-Dahlke, Milena; Gorny, Adam; Pacholski, Leszek			Implementation of TPM Methodology in Worker Fatigue Management - A Macroergonomic Approach	ADVANCES IN SOCIAL & OCCUPATIONAL ERGONOMICS, AHFE 2017	Advances in Intelligent Systems and Computing				International Conference on Social & Occupational Ergonomics/8th International Conference on Applied Human Factors and Ergonomics (AHFE)	JUL 17-21, 2017	Los Angeles, CA																						2194-5357	2194-5365	978-3-319-60828-0; 978-3-319-60827-3				2018	605						32	41		10.1007/978-3-319-60828-0_4							WOS:000449704700004						
C	Baczynska, P; Burduk, R		Choras, RS		Baczynska, Paulina; Burduk, Robert			Classifier Selection Uses Decision Profiles in Binary Classification Task	IMAGE PROCESSING AND COMMUNICATIONS CHALLENGES 7	Advances in Intelligent Systems and Computing				8th International Conference on Image Processing and Communications (IP and C)	SEP 09-11, 2015	UTP Univ Sci & Technol, Bydgoszcz, POLAND		UTP Univ Sci & Technol																				2194-5357		978-3-319-23814-2; 978-3-319-23813-5				2016	389						3	10		10.1007/978-3-319-23814-2_1							WOS:000369842100001						
C	Selvaraju, E; Sundaram, R		Reddy, MS; Viswanath, K; Prasad, KMS		Selvaraju, Elamathy; Sundaram, Ravi			A New Fibonacci Backoff Method for Congestion Control in Wireless Sensor Network	INTERNATIONAL PROCEEDINGS ON ADVANCES IN SOFT COMPUTING, INTELLIGENT SYSTEMS AND APPLICATIONS, ASISA 2016	Advances in Intelligent Systems and Computing				International Conference on Advances in Soft Computing, Intelligent Systems and Applications (ASISA)	2016	Bangalore, INDIA	R L Jalappa Inst Technol, ARPVGSI, IEEE Robot & Automat Soc																					2194-5357	2194-5365	978-981-10-5272-9; 978-981-10-5271-2				2018	628						237	247		10.1007/978-981-10-5272-9_23							WOS:000451046800023						
C	Dronga, A; Hsairi, L; Ghedira, K		Abraham, A; Haqiq, A; Alimi, AM; Mezzour, G; Rokbani, N; Muda, AK		Dronga, Alaeddine; Hsairi, Lobna; Ghedira, Khaled			Integration of Game Theory in R-2-IBN Framework for Conflict Resolution in a Multi-agents Model of an Extended Enterprise	PROCEEDINGS OF THE 16TH INTERNATIONAL CONFERENCE ON HYBRID INTELLIGENT SYSTEMS (HIS 2016)	Advances in Intelligent Systems and Computing				16th International Conference on Hybrid Intelligent Systems (HIS) / 8th World Congress on Nature and Biologically Inspired Computing (NaBIC)	NOV 21-23, 2016	Marrakech, MOROCCO	Machine Intelligence Res Labs, Hassan 1st Univ, Univ Sfax, Fac Sci Tech Settat, e ngn org, Assoc Grand Atlas, Groupement Format Continue, Univ Int Rabat, Lab Informatique Reseaux Mobilite & Modelisat, Res Grp Intelligent Machines Lab																					2194-5357	2194-5365	978-3-319-52941-7; 978-3-319-52940-0				2017	552						88	98		10.1007/978-3-319-52941-7_10							WOS:000418854600010						
S	Nauth, PM		Hippe, ZS; Kulikowski, JL; Mroczek, T; Wtorek, J		Nauth, P. M.			Improvement of Assistive Robot Behavior by Experience-Based Learning	HUMAN-COMPUTER SYSTEMS INTERACTION: BACKGROUNDS AND APPLICATIONS 3	Advances in Intelligent Systems and Computing																												2194-5357		978-3-319-08491-6; 978-3-319-08490-9				2014	300						325	336		10.1007/978-3-319-08491-6_27	10.1007/978-3-319-08491-6						WOS:000360129800027						
C	Jang, JH; Lee, SM; Gwon, OS; Lee, SE		Latifi, S		Jang, Ji Hoon; Lee, Seong Mo; Gwon, Oh Seong; Lee, Seung Eun			An FPGA Based Compression Accelerator for Forex Trading System	INFORMATION TECHNOLOGY: NEW GENERATIONS	Advances in Intelligent Systems and Computing				13th International Conference on Information Technology - New Generations (ITNG)	APR 11-13, 2016	Las Vegas, NV																						2194-5357		978-3-319-32467-8; 978-3-319-32466-1				2016	448						711	720		10.1007/978-3-319-32467-8_62							WOS:000385289400062						
C	Reis, JL; Carvalho, JA		Rocha, A; Correia, AM; Wilson, T; Stroetmann, KA		Reis, Jose Luis; Carvalho, Joao Alvaro			Aspects That Contribute to the Success of Personalized Web Applications	ADVANCES IN INFORMATION SYSTEMS AND TECHNOLOGIES	Advances in Intelligent Systems and Computing				World Conference on Information Systems and Technologies (WorldCIST)	MAR 27-30, 2013	Olhao, PORTUGAL	Iberian Assoc Informat Syst & Technologies								Carvalho, Joao A/B-6886-2011	Carvalho, Joao A/0000-0002-7223-1532; Reis, Jose Luis/0000-0002-0987-0980												2194-5357		978-3-642-36981-0				2013	206						421	432		10.1007/978-3-642-36981-0_39							WOS:000354617500039						
C	Rostkowska, M; Topolski, M; Skrzypczynski, P		Szewczyk, R; Zielinski, C; Kaliczynska, M		Rostkowska, Marta; Topolski, Michal; Skrzypczynski, Piotr			Direct Local Communication for Distributed Coordination in a Multi-robot Team	RECENT ADVANCES IN AUTOMATION, ROBOTICS AND MEASURING TECHNIQUES	Advances in Intelligent Systems and Computing				International Conference on Automation	MAR 26-28, 2014	Warsaw, POLAND									Skrzypczynski, Piotr/M-1376-2014	Skrzypczynski, Piotr/0000-0002-9843-2404												2194-5357	2194-5365	978-3-319-05353-0; 978-3-319-05352-3				2014	267						463	473		10.1007/978-3-319-05353-0_44							WOS:000374238800044						
C	Nehal, SK; Obheroi, RK; Anand, A; Rana, H		Singh, R; Choudhury, S; Gehlot, A		Nehal, S. K.; Obheroi, Rajat Kumar; Anand, Ajay; Rana, Haneet			A Navigation Device with Voice for Visually Impaired People	INTELLIGENT COMMUNICATION, CONTROL AND DEVICES, ICICCD 2017	Advances in Intelligent Systems and Computing				2nd International Conference on Intelligent Communication, Control and Devices (ICICCD)	APR 15-16, 2017	Dehradun, INDIA	Univ Petr & Energy Studies Engn, Dept Elect, Instrumentat & Control Engn									Rana, Haneet/0000-0001-8320-2246												2194-5357	2194-5365	978-981-10-5903-2; 978-981-10-5902-5				2018	624						1369	1380		10.1007/978-981-10-5903-2_144							WOS:000553697500144						
C	Osaci, M; Berdie, AD; Hammes, AD		Balas, VE; Fodor, J; VarkonyiKoczy, AR; Dombi, J; Jain, LC		Osaci, Mihaela; Berdie, Adela Diana; Hammes, Ana Daniela			Studies on Efficiency of the Data Access by ABAP Programming	SOFT COMPUTING APPLICATIONS	Advances in Intelligent Systems and Computing				5th International Workshop Soft Computing Applications (SOFA)	AUG 22-24, 2012	Szeged, HUNGARY									Osaci, Mihaela/Q-5638-2016	Osaci, Mihaela/0000-0003-4062-7556												2194-5357		978-3-642-33940-0				2013	195						707	713									WOS:000314077300063						
C	Kammuller, F		Nicholson, D		Kammueller, Florian			Human Centric Security and Privacy for the IoT Using Formal Techniques	ADVANCES IN HUMAN FACTORS IN CYBERSECURITY	Advances in Intelligent Systems and Computing				AHFE International Conference on Human Factors in Cybersecurity	JUL 17-21, 2017	Los Angeles, CA																						2194-5357	2194-5365	978-3-319-60585-2; 978-3-319-60584-5				2018	593						106	116		10.1007/978-3-319-60585-2_12							WOS:000448247800012						
C	Gu, Z; Yamamoto, I; Hiratsuka, T		Lee, S; Cho, HS; Yoon, KJ; Lee, JM		Gu, Zusong; Yamamoto, Ikuo; Hiratsuka, Tomokazu			Research on Bio-mechanism Robotics by Robotic Fish Fin Technology	INTELLIGENT AUTONOMOUS SYSTEMS 12, VOL 1	Advances in Intelligent Systems and Computing				12th International Conference of Intelligent Autonomous Systems	JUN 26-29, 2012	Jeju, SOUTH KOREA																						2194-5357		978-3-642-33925-7				2013	193						577	584									WOS:000313842700054						
C	Wang, WR; Shi, XC		Wen, Z; Li, T		Wang Weiru; Shi Xincong			Simulation of STATCOM Effect on the Dynamic Response Performance of HVDC	PRACTICAL APPLICATIONS OF INTELLIGENT SYSTEMS, ISKE 2013	Advances in Intelligent Systems and Computing				8th International Conference on Intelligent Systems and Knowledge Engineering (ISKE)	NOV 20-23, 2013	Shenzhen, PEOPLES R CHINA	Shenzhen Univ, Sci China Press, Chinese Acad Sci, IEEE Computat Intelligence Soc, Chinese Assoc Artificial Intelligence, State Key Lab Complex Elect Syst Simulat, Sci & Technol Integrated Informat Syst Lab, SW Jiaotong Univ, Univ Technol																					2194-5357		978-3-642-54927-4; 978-3-642-54926-7				2014	279						473	+		10.1007/978-3-642-54927-4_45							WOS:000348509400045						
C	Zhang, L; Li, FL		Du, ZY		Zhang, Li; Li, Fule			Output-Feedback Stabilization of Discrete-Time Systems with Multiple Time-Varying Delays	INTELLIGENCE COMPUTATION AND EVOLUTIONARY COMPUTATION	Advances in Intelligent Systems and Computing				International Conference of Intelligence Computation and Evolutionary Computation (ICEC 2012)	JUL 07, 2012	Wuhan, PEOPLES R CHINA	Informat Technol & Ind Engn Res Ctr																					2194-5357	2194-5365	978-3-642-31655-5; 978-3-642-31656-2				2013	180						607	613									WOS:000316302700084						
C	Murthy, VB; Varma, GPS		Satapathy, SC; Udgata, SK; Biswal, BN		Murthy, V. Bhaskara; Varma, G. Pardha Saradhi			Neural Networks - A Case Study in Gene Identification	PROCEEDINGS OF THE INTERNATIONAL CONFERENCE ON FRONTIERS OF INTELLIGENT COMPUTING: THEORY AND APPLICATIONS (FICTA) 2013	Advances in Intelligent Systems and Computing				2nd International Conference on Frontiers in Intelligent Computing - Theory and Applications (FICTA)	NOV 14-16, 2013	Bhubaneswar, INDIA	Bhubaneswar Engn Coll																					2194-5357		978-3-319-02931-3; 978-3-319-02930-6				2014	247						99	110		10.1007/978-3-319-02931-3_13							WOS:000339490600013						
C	Sierra, AJ; Martin-Rodriguez, A; Ariza, T; Munoz-Calle, J; Fernandez-Jimenez, FJ		Caporuscio, M; DeLaPrieta, F; DiMascio, T; Gennari, R; Rodriguez, JG; AzambujaSilveira, R; Vittorini, P		Sierra, Antonio J.; Martin-Rodriguez, Alvaro; Ariza, Teresa; Munoz-Calle, Javier; Fernandez-Jimenez, Francisco J.			LTI for Interoperating e-Assessment Tools with LMS	METHODOLOGIES AND INTELLIGENT SYSTEMS FOR TECHNOLOGY ENHANCED LEARNING (MIS4TEL)	Advances in Intelligent Systems and Computing				6th International Conference on Methodologies and Intelligent Systems for Technology Enhanced Learning (mis4TEL)	JUN 01-03, 2016	Univ Seville, Seville, SPAIN	IBM, Indra, Fidetia, IEEE SMC	Univ Seville							Munoz-Calle, Javier/AAT-7433-2020; Fernandez-Jimenez, Francisco J./B-6049-2008	Munoz-Calle, Javier/0000-0001-8146-8438; Fernandez-Jimenez, Francisco J./0000-0003-4275-3177												2194-5357		978-3-319-40165-2; 978-3-319-40164-5				2016	478						173	181		10.1007/978-3-319-40165-2_18							WOS:000382642600018						
C	Yamaji, K; Aoyama, T; Furukawa, M; Yamada, T		Zin, TT; Lin, JCW; Pan, JS; Tin, P; Yokota, M		Yamaji, Kazutsuna; Aoyama, Toshihiro; Furukawa, Masako; Yamada, Tsuneo			Development and Deployment of the Open Access Repository and Its Application to the Open Educational Recourses	GENETIC AND EVOLUTIONARY COMPUTING, VOL II	Advances in Intelligent Systems and Computing				9th International Conference on Genetic and Evolutionary Computing (ICGEC)	AUG 26-28, 2015	Univ Comp Studies, Yangon, MYANMAR	Springer, Minist Sci & Technol, Univ Miyazaki, Kaohsiung Univ Appl Sci, Fujian Univ Technol, Tech Univ Ostrava	Univ Comp Studies								Aoyama, Toshihiro/0000-0001-7150-3180												2194-5357		978-3-319-23207-2; 978-3-319-23206-5				2016	388						395	403		10.1007/978-3-319-23207-2_40							WOS:000381875900040						
C	Li, BT; Chen, YZ; Ren, JQ; Cheng, L		Balas, VE; Jain, LC; Zhao, X		Li, Baotong; Chen, Yangzhou; Ren, Jianqiang; Cheng, Lan			A Fast Video Stabilization Method Based on Feature Matching and Histogram Clustering	INFORMATION TECHNOLOGY AND INTELLIGENT TRANSPORTATION SYSTEMS, VOL 2	Advances in Intelligent Systems and Computing				International Conference on Information Technology and Intelligent Transportation Systems (ITITS)	DEC 12-13, 2015	Xian, PEOPLES R CHINA	Shaanxi Comp Soc, Changan Univ, Xian Univ Technol, NW Poly Tech Univ, Shaanxi Sirui Ind Co Ltd, CAS																					2194-5357	2194-5365	978-3-319-38771-0; 978-3-319-38769-7				2017	455		2				315	325		10.1007/978-3-319-38771-0_31							WOS:000452856700031						
C	Niewiatowski, J; Nowak, P		Szewczyk, R; Kaliczynska, M		Niewiatowski, Jerzy; Nowak, Pawel			The Measuring System for Bee Hives Environmental Monitoring	RECENT ADVANCES IN SYSTEMS, CONTROL AND INFORMATION TECHNOLOGY	Advances in Intelligent Systems and Computing				International Conference on Systems, Control and Information Technologies (SCIT)	MAY 20-21, 2016	Warsaw, POLAND										Nowak, Pawel/0000-0003-4156-5473; Niewiatowski, Jerzy/0000-0002-7699-1977												2194-5357		978-3-319-48923-0; 978-3-319-48922-3				2017	543						203	210		10.1007/978-3-319-48923-0_25							WOS:000413065400025						
C	Singhal, S; Gupta, S; Suri, B; Panda, S		Choudhary, RK; Mandal, JK; Auluck, N; Nagarajaram, HA		Singhal, Shweta; Gupta, Shivangi; Suri, Bharti; Panda, Supriya			Multi-deterministic Prioritization of Regression Test Suite Compared: ACO and BCO	ADVANCED COMPUTING AND COMMUNICATION TECHNOLOGIES	Advances in Intelligent Systems and Computing				9th International Conference on Advanced Computing and Communication Technologies (ICACCT)	NOV 28-29, 2015	Asia Pacific Inst Informat Technol, Panipat, INDIA	Inst Elect & Telecommunicat Engineers, Comp Soc India	Asia Pacific Inst Informat Technol							singhal, shweta/AAM-9679-2020	Singhal, Shweta/0000-0001-8267-8867												2194-5357	2194-5365	978-981-10-1023-1; 978-981-10-1021-7				2016	452						187	194		10.1007/978-981-10-1023-1_19							WOS:000387180900019						
C	Joshi, V; Mehra, R		Satapathy, SC; Joshi, A; Modi, N; Pathak, N		Joshi, Vibha; Mehra, Rekha			An Improvement in Performance of Optical Communication System Using Linearly Chirped Apodized Fiber Bragg Grating	PROCEEDINGS OF INTERNATIONAL CONFERENCE ON ICT FOR SUSTAINABLE DEVELOPMENT, ICT4SD 2015, VOL 1	Advances in Intelligent Systems and Computing				International Conference on Information and Communication Technology for Sustainable Development (ICT4SD)	JUL 03-04, 2015	Ahmedabad, INDIA	ASSOCHAM Gujarat Chapter, ACM Profess Chapter, GESIA, Sabar Inst Technol																					2194-5357	2194-5365	978-981-10-0129-1; 978-981-10-0127-7				2016	408						81	88		10.1007/978-981-10-0129-1_9							WOS:000372056300009						
C	Sahoo, PK; Panda, R; Satpathy, PK; Mohanty, MN		Dash, SS; Bhaskar, MA; Panigrahi, BK; Das, S		Sahoo, Pradyumna K.; Panda, Ramaprasad; Satpathy, Prasanta K.; Mohanty, Mihir N.			Performance Comparison for Feed Forward, Elman, and Radial Basis Neural Networks Applied to Line Congestion Study of Electrical Power Systems	ARTIFICIAL INTELLIGENCE AND EVOLUTIONARY COMPUTATIONS IN ENGINEERING SYSTEMS, ICAIECES 2015	Advances in Intelligent Systems and Computing				International Conference on Artificial Intelligence and Evolutionary Computations in Engineering Systems (ICAIECES)	APR 22-23, 2015	Velammal Engn Coll, Chennai, INDIA		Velammal Engn Coll								Mohanty, Dr. Mihir Narayan/0000-0003-1252-949X												2194-5357		978-81-322-2656-7; 978-81-322-2654-3				2016	394						1227	1237		10.1007/978-81-322-2656-7_112							WOS:000371315700112						
C	Chen, JF; Wang, XS		Kim, JH; Yang, W; Jo, J; Sincak, P; Myung, H		Chen Jianfei; Wang Xingsong			Conception of a Tendon-Sheath and Pneumatic System Driven Soft Rescue Robot	ROBOT INTELLIGENCE TECHNOLOGY ANDAPPLICATIONS 3	Advances in Intelligent Systems and Computing				3rd International Conference on Robot Intelligence Technology and Applications	NOV 06-08, 2014	Beijing, PEOPLES R CHINA									wang, xingsong/ABA-9587-2021													2194-5357	2194-5365	978-3-319-16841-8; 978-3-319-16840-1				2015	345						475	481		10.1007/978-3-319-16841-8_43							WOS:000380533900043						
C	Llu, GR; Wang, LL; Wang, J; Qiang, J		Xhafa, F; Patnaik, S; Yu, Z		Llu, Guiru; Wang, Lulin; Wang, Jun; Qiang, Jun			CGSA-CFAR Detector in Urban Traffic Environments	RECENT DEVELOPMENTS IN INTELLIGENT SYSTEMS AND INTERACTIVE APPLICATIONS (IISA2016)	Advances in Intelligent Systems and Computing				International Conference on Intelligent and Interactive Systems and Applications (IISA)	JUN 25-26, 2016	Shanghai, PEOPLES R CHINA																						2194-5357		978-3-319-49568-2; 978-3-319-49567-5				2017	541						454	459		10.1007/978-3-319-49568-2_64							WOS:000400685600064						
C	Pitteri, G; Munaro, M; Menegatti, E		Chen, W; Hosoda, K; Menegatti, E; Shimizu, M; Wang, H		Pitteri, Giorgia; Munaro, Matteo; Menegatti, Emanuele			Depth-Based Frontal View Generation for Pose Invariant Face Recognition with Consumer RGB-D Sensors	INTELLIGENT AUTONOMOUS SYSTEMS 14	Advances in Intelligent Systems and Computing				14th International Conference on Intelligent Autonomous Systems (IAS)	JUL 03-07, 2016	Shanghai Jiao Tong Univ, Shanghai, PEOPLES R CHINA		Shanghai Jiao Tong Univ								Menegatti, Emanuele/0000-0001-5794-9979												2194-5357	2194-5365	978-3-319-48036-7; 978-3-319-48035-0				2017	531						925	937		10.1007/978-3-319-48036-7_67							WOS:000406996500067						
S	Zamojski, W; Sugier, J		Zamojski, W; Sugier, J		Zamojski, Wojciech; Sugier, Jaroslaw			Dependability Problems of Complex Information Systems Preface	DEPENDABILITY PROBLEMS OF COMPLEX INFORMATION SYSTEMS	Advances in Intelligent Systems and Computing																												2194-5357		978-3-319-08964-5; 978-3-319-08963-8				2015	307						V	VII			10.1007/978-3-319-08964-5						WOS:000360128500001						
C	Sakow, M; Miadlicki, K		Szewczyk, R; Zielinski, C; Kaliczynska, M		Sakow, Mateusz; Miadlicki, Karol			Transport Delay and First Order Inertia Time Signal Prediction Dedicated to Teleoperation	AUTOMATION 2018: ADVANCES IN AUTOMATION, ROBOTICS AND MEASUREMENT TECHNIQUES	Advances in Intelligent Systems and Computing				International Conference on Automation	MAR 21-23, 2018	Warsaw, POLAND									Miadlicki, Karol/P-3368-2017	Miadlicki, Karol/0000-0001-6456-3724; Sakow, Mateusz/0000-0002-4340-932X												2194-5357	2194-5365	978-3-319-77179-3; 978-3-319-77178-6				2018	743						142	151		10.1007/978-3-319-77179-3_13							WOS:000462745200013						
C	Lin, RJ; Mu, HF; Guo, HW; Wang, WH		Wen, Z; Li, T		Lin, Rongjie; Mu, Hongfei; Guo, Hongwei; Wang, Wuhong			Reliability Analysis of Driver Behaviour Under Effect of Head-up Display System: A Probabilistic Risk Assessment in Traffic Operation	PRACTICAL APPLICATIONS OF INTELLIGENT SYSTEMS, ISKE 2013	Advances in Intelligent Systems and Computing				8th International Conference on Intelligent Systems and Knowledge Engineering (ISKE)	NOV 20-23, 2013	Shenzhen, PEOPLES R CHINA	Shenzhen Univ, Sci China Press, Chinese Acad Sci, IEEE Computat Intelligence Soc, Chinese Assoc Artificial Intelligence, State Key Lab Complex Elect Syst Simulat, Sci & Technol Integrated Informat Syst Lab, SW Jiaotong Univ, Univ Technol																					2194-5357		978-3-642-54927-4; 978-3-642-54926-7				2014	279						647	655		10.1007/978-3-642-54927-4_61							WOS:000348509400061						
C	Grobelny, J; Michalski, R		Borzemski, L; Grzech, A; Swiatek, J; Wilimowska, Z		Grobelny, Jerzy; Michalski, Rafal			Experimental Examination of Facilities Layout Problems in Logistics Systems Including Objects with Diverse Sizes and Shapes	INFORMATION SYSTEMS ARCHITECTURE AND TECHNOLOGY, ISAT 2015, PT I	Advances in Intelligent Systems and Computing				36th International Conference on Information Systems Architecture and Technology (ISAT)	SEP 20-22, 2015	Karpacz, POLAND	Wroclaw Univ Technol, Fac Comp Sci & Management, Dept Comp Sci, Wroclaw Univ Technol, Fac Comp Sci & Management, Dept Management Syst								Michalski, Rafal/D-7289-2011	Michalski, Rafal/0000-0002-0807-1925; Grobelny, Jerzy/0000-0001-9791-9395; Grobelny, Jerzy/0000-0001-7182-6801												2194-5357		978-3-319-28555-9; 978-3-319-28553-5				2016	429						159	169		10.1007/978-3-319-28555-9_14							WOS:000378550500014						
C	Strohm, PT; Wittmer, S; Haberstroh, A; Lauer, T		Bassiliades, N; Ivanovic, M; KonPopovska, M; Manolopoulos, Y; Palpanas, T; Trajcevski, G; Vakali, A		Strohm, Peter Tim; Wittmer, Steffen; Haberstroh, Alexander; Lauer, Tobias			GPU-Accelerated Quantification Filters for Analytical Queries in Multidimensional Databases	NEW TRENDS IN DATABASE AND INFORMATION SYSTEMS II	Advances in Intelligent Systems and Computing				18th East European Conference on Advances in Databases and Information Systems and Associated Satellite Events (ADBIS)	SEP 07-10, 2014	Ohrid, MACEDONIA	Minist Informat Soc & Adm Ss Cyril, Univ Ss Cyril & Methodius, Fac Comp Sci & Engn, ICT ACT Assoc, Municipal Ohrid																					2194-5357	2194-5365	978-3-319-10517-8				2015	312						229	242		10.1007/978-3-319-10518-5_18							WOS:000360219900018						
